projects/hipblaslt/library/src/amd_detail/rocblaslt/src/Tensile/Logic/asm_full/aquavanjaram/gfx942/GridBased/aquavanjaram_Cijk_Alik_Bljk_BBS_STA_BH_Bias_HAS_SAV_UserArgs.yaml
- {MinimumRequiredVersion: 4.33.0}
- aquavanjaram
- gfx942
- [Device 0049, Device 0050]
    SolutionIndex: 0
    SolutionNameMin: Cijk_Alik_Bljk_BBS_STA_BH_Bias_HAS_SAV_UserArgs_MT64x48x128_MI16x16x1_SN_LDSB0_GRVWB8_GSU1_GSUAMB_GSUC1_GSUWGMRR1_K1_LBSPPB256_MIWT1_3_NTA0_NLCA4_SU0_SUM0_SUS0_VWB1_WG64_4_1_WGM1_WGMXCC8_WGMXCCGn1
    SolutionIndex: 1
    SolutionNameMin: Cijk_Alik_Bljk_BBS_STA_BH_Bias_HAS_SAV_UserArgs_MT64x48x128_MI16x16x1_SN_LDSB0_GRVWB8_GSU3_GSUAMBSK_GSUC1_GSUWGMRR1_K1_LBSPPB256_MIWT1_3_NTA0_NLCA4_SU0_SUM0_SUS0_VWB1_WG64_4_1_WGM1_WGMXCC8_WGMXCCGn1
    SolutionIndex: 2
    SolutionNameMin: Cijk_Alik_Bljk_BBS_STA_BH_Bias_HAS_SAV_UserArgs_MT128x64x128_MI16x16x1_SN_LDSB1_GRVWB8_GSU1_GSUAMB_GSUC1_GSUWGMRR1_K1_LBSPPB1024_MIWT2_4_NTA0_NLCA4_SU0_SUM0_SUS0_VWB4_WG64_4_1_WGM1_WGMXCC8_WGMXCCGn1
    SolutionIndex: 3
    SolutionNameMin: Cijk_Alik_Bljk_BBS_STA_BH_Bias_HAS_SAV_UserArgs_MT128x80x128_MI16x16x1_SN_LDSB1_GRVWB8_GSU1_GSUAMB_GSUC1_GSUWGMRR1_K1_LBSPPB256_MIWT2_5_NTA0_NLCA4_SU0_SUM0_SUS0_VWB1_WG64_4_1_WGM1_WGMXCC8_WGMXCCGn1
    SolutionIndex: 4
    SolutionNameMin: Cijk_Alik_Bljk_BBS_STA_BH_Bias_HAS_SAV_UserArgs_MT64x144x128_MI16x16x1_SN_LDSB1_GRVWB8_GSU1_GSUAMB_GSUC1_GSUWGMRR1_K1_LBSPPB256_MIWT1_9_NTA0_NLCA4_SU0_SUM0_SUS0_VWB1_WG64_4_1_WGM1_WGMXCC8_WGMXCCGn1
    SolutionIndex: 5
    SolutionNameMin: Cijk_Alik_Bljk_BBS_STA_BH_Bias_HAS_SAV_UserArgs_MT64x80x128_MI16x16x1_SN_LDSB1_GRVWB8_GSU1_GSUAMB_GSUC1_GSUWGMRR1_K1_LBSPPB256_MIWT2_5_NTA0_NLCA4_SU0_SUM0_SUS0_VWB1_WG32_4_1_WGM1_WGMXCC8_WGMXCCGn1
    SolutionIndex: 6
    SolutionNameMin: Cijk_Alik_Bljk_BBS_STA_BH_Bias_HAS_SAV_UserArgs_MT64x48x256_MI16x16x1_SN_LDSB1_GRVWB8_GSU1_GSUAMB_GSUC1_GSUWGMRR1_K1_LBSPPB512_MIWT1_3_NTA0_NLCA8_SU0_SUM0_SUS0_VWB1_WG64_4_1_WGM1_WGMXCC8_WGMXCCGn1
    SolutionIndex: 7
    SolutionNameMin: Cijk_Alik_Bljk_BBS_STA_BH_Bias_HAS_SAV_UserArgs_MT32x32x256_MI16x16x1_SN_LDSB1_GRVWB8_GSU1_GSUAMB_GSUC1_GSUWGMRR1_K1_LBSPPB1024_MIWT1_2_NTA0_NLCA8_SU0_SUM0_SUS0_VWB2_WG32_4_1_WGM1_WGMXCC8_WGMXCCGn1
    SolutionIndex: 8
    SolutionNameMin: Cijk_Alik_Bljk_BBS_STA_BH_Bias_HAS_SAV_UserArgs_MT64x32x256_MI16x16x1_SN_LDSB1_GRVWB8_GSU1_GSUAMB_GSUC1_GSUWGMRR1_K1_LBSPPB1024_MIWT2_2_NTA0_NLCA8_SU0_SUM0_SUS0_VWB2_WG32_4_1_WGM1_WGMXCC8_WGMXCCGn1
    SolutionIndex: 9
    SolutionNameMin: Cijk_Alik_Bljk_BBS_STA_BH_Bias_HAS_SAV_UserArgs_MT32x16x512_MI16x16x1_SN_LDSB1_GRVWB8_GSU1_GSUAMB_GSUC1_GSUWGMRR1_K1_LBSPPB1024_MIWT1_1_NTA0_NLCA16_SU0_SUM0_SUS0_VWB1_WG32_4_1_WGM1_WGMXCC8_WGMXCCGn1
    SolutionIndex: 10
    SolutionNameMin: Cijk_Alik_Bljk_BBS_STA_BH_Bias_HAS_SAV_UserArgs_MT128x160x64_MI16x16x1_SN_LDSB1_GRVWB8_GSU1_GSUAMB_GSUC1_GSUWGMRR1_K1_LBSPPB256_MIWT2_10_NTA4_NLCA2_SU0_SUM0_SUS0_VWB2_WG64_4_1_WGM1_WGMXCC8_WGMXCCGn1
    SolutionIndex: 11
    SolutionNameMin: Cijk_Alik_Bljk_BBS_STA_BH_Bias_HAS_SAV_UserArgs_MT64x32x128_MI16x16x1_SN_LDSB0_GRVWB8_GSU1_GSUAMB_GSUC1_GSUWGMRR1_K1_LBSPPB512_MIWT1_2_NTA4_NLCA4_SU0_SUM0_SUS0_VWB2_WG64_4_1_WGM1_WGMXCC8_WGMXCCGn1
    SolutionIndex: 12
    SolutionNameMin: Cijk_Alik_Bljk_BBS_STA_BH_Bias_HAS_SAV_UserArgs_MT64x48x128_MI16x16x1_SN_LDSB0_GRVWB8_GSU1_GSUAMB_GSUC1_GSUWGMRR1_K1_LBSPPB256_MIWT1_3_NTA4_NLCA4_SU0_SUM0_SUS0_VWB1_WG64_4_1_WGM1_WGMXCC8_WGMXCCGn1
    SolutionIndex: 13
    SolutionNameMin: Cijk_Alik_Bljk_BBS_STA_BH_Bias_HAS_SAV_UserArgs_MT128x64x128_MI16x16x1_SN_LDSB1_GRVWB8_GSU1_GSUAMB_GSUC1_GSUWGMRR1_K1_LBSPPB1024_MIWT2_4_NTA4_NLCA4_SU0_SUM0_SUS0_VWB4_WG64_4_1_WGM1_WGMXCC8_WGMXCCGn1
    SolutionIndex: 14
    SolutionNameMin: Cijk_Alik_Bljk_BBS_STA_BH_Bias_HAS_SAV_UserArgs_MT64x80x128_MI16x16x1_SN_LDSB1_GRVWB8_GSU1_GSUAMB_GSUC1_GSUWGMRR1_K1_LBSPPB256_MIWT1_5_NTA4_NLCA4_SU0_SUM0_SUS0_VWB1_WG64_4_1_WGM1_WGMXCC8_WGMXCCGn1
    SolutionIndex: 15
    SolutionNameMin: Cijk_Alik_Bljk_BBS_STA_BH_Bias_HAS_SAV_UserArgs_MT128x96x128_MI16x16x1_SN_LDSB1_GRVWB8_GSU1_GSUAMB_GSUC1_GSUWGMRR1_K1_LBSPPB512_MIWT2_6_NTA4_NLCA4_SU0_SUM0_SUS0_VWB2_WG64_4_1_WGM1_WGMXCC8_WGMXCCGn1
    SolutionIndex: 16
    SolutionNameMin: Cijk_Alik_Bljk_BBS_STA_BH_Bias_HAS_SAV_UserArgs_MT64x112x128_MI16x16x1_SN_LDSB1_GRVWB8_GSU1_GSUAMB_GSUC1_GSUWGMRR1_K1_LBSPPB256_MIWT1_7_NTA4_NLCA4_SU0_SUM0_SUS0_VWB1_WG64_4_1_WGM1_WGMXCC8_WGMXCCGn1
    SolutionIndex: 17
    SolutionNameMin: Cijk_Alik_Bljk_BBS_STA_BH_Bias_HAS_SAV_UserArgs_MT128x128x128_MI16x16x1_SN_LDSB1_GRVWB8_GSU1_GSUAMB_GSUC1_GSUWGMRR1_K1_LBSPPB2048_MIWT2_8_NTA4_NLCA4_SU0_SUM0_SUS0_VWB8_WG64_4_1_WGM1_WGMXCC8_WGMXCCGn1
    SolutionIndex: 18
    SolutionNameMin: Cijk_Alik_Bljk_BBS_STA_BH_Bias_HAS_SAV_UserArgs_MT64x16x256_MI16x16x1_SN_LDSB0_GRVWB8_GSU3_GSUAMBSK_GSUC1_GSUWGMRR1_K1_LBSPPB512_MIWT1_1_NTA4_NLCA8_SU0_SUM0_SUS0_VWB1_WG64_4_1_WGM1_WGMXCC8_WGMXCCGn1
    SolutionIndex: 19
    SolutionNameMin: Cijk_Alik_Bljk_BBS_STA_BH_Bias_HAS_SAV_UserArgs_MT64x32x256_MI16x16x1_SN_LDSB1_GRVWB8_GSU3_GSUAMBSK_GSUC1_GSUWGMRR1_K1_LBSPPB1024_MIWT1_2_NTA4_NLCA8_SU0_SUM0_SUS0_VWB2_WG64_4_1_WGM1_WGMXCC8_WGMXCCGn1
    SolutionIndex: 20
    SolutionNameMin: Cijk_Alik_Bljk_BBS_STA_BH_Bias_HAS_SAV_UserArgs_MT64x48x256_MI16x16x1_SN_LDSB1_GRVWB8_GSU3_GSUAMBSK_GSUC1_GSUWGMRR1_K1_LBSPPB512_MIWT1_3_NTA4_NLCA8_SU0_SUM0_SUS0_VWB1_WG64_4_1_WGM1_WGMXCC8_WGMXCCGn1
    SolutionIndex: 21
    SolutionNameMin: Cijk_Alik_Bljk_BBS_STA_BH_Bias_HAS_SAV_UserArgs_MT64x16x256_MI16x16x1_SN_LDSB0_GRVWB8_GSU1_GSUAMB_GSUC1_GSUWGMRR1_K1_LBSPPB512_MIWT2_1_NTA4_NLCA8_SU0_SUM0_SUS0_VWB1_WG32_4_1_WGM1_WGMXCC8_WGMXCCGn1
    SolutionIndex: 22
    SolutionNameMin: Cijk_Alik_Bljk_BBS_STA_BH_Bias_HAS_SAV_UserArgs_MT32x32x256_MI16x16x1_SN_LDSB1_GRVWB8_GSU1_GSUAMB_GSUC1_GSUWGMRR1_K1_LBSPPB1024_MIWT1_2_NTA4_NLCA8_SU0_SUM0_SUS0_VWB2_WG32_4_1_WGM1_WGMXCC8_WGMXCCGn1
    SolutionIndex: 23
    SolutionNameMin: Cijk_Alik_Bljk_BBS_STA_BH_Bias_HAS_SAV_UserArgs_MT32x16x512_MI16x16x1_SN_LDSB1_GRVWB8_GSU1_GSUAMB_GSUC1_GSUWGMRR1_K1_LBSPPB1024_MIWT1_1_NTA4_NLCA16_SU0_SUM0_SUS0_VWB1_WG32_4_1_WGM1_WGMXCC8_WGMXCCGn1
    SolutionIndex: 24
    SolutionNameMin: Cijk_Alik_Bljk_BBS_STA_BH_Bias_HAS_SAV_UserArgs_MT64x32x256_MI16x16x1_SN_LDSB1_GRVWB8_GSU1_GSUC0_GSUWGMRR0_K1_LBSPPB1024_MIWT2_2_NLCA8_SU0_SUM0_SUS0_VWB2_WG32_4_1_WGM6_WGMXCC8_WGMXCCGn1
    SolutionIndex: 25
    SolutionNameMin: Cijk_Alik_Bljk_BBS_STA_BH_Bias_HAS_SAV_UserArgs_MT64x32x256_MI16x16x1_SN_LDSB1_GRVWB8_GSU1_GSUC0_GSUWGMRR0_K1_LBSPPB1024_MIWT2_2_NLCA8_SU0_SUM0_SUS0_VWB2_WG32_4_1_WGM8_WGMXCC8_WGMXCCGn1
    SolutionIndex: 26
    SolutionNameMin: Cijk_Alik_Bljk_BBS_STA_BH_Bias_HAS_SAV_UserArgs_MT128x32x256_MI16x16x1_SN_LDSB1_GRVWB8_GSU1_GSUC0_GSUWGMRR0_K1_LBSPPB1024_MIWT2_2_NLCA8_SU0_SUM0_SUS0_VWB2_WG64_4_1_WGM6_WGMXCC8_WGMXCCGn1
    SolutionIndex: 27
    SolutionNameMin: Cijk_Alik_Bljk_BBS_STA_BH_Bias_HAS_SAV_UserArgs_MT128x32x256_MI16x16x1_SN_LDSB1_GRVWB8_GSU1_GSUC0_GSUWGMRR0_K1_LBSPPB1024_MIWT2_2_NLCA8_SU8_SUM0_SUS512_VWB2_WG64_4_1_WGM8_WGMXCC8_WGMXCCGn1
    SolutionIndex: 28
    SolutionNameMin: Cijk_Alik_Bljk_BBS_STA_BH_Bias_HAS_SAV_UserArgs_MT128x32x256_MI16x16x1_SN_LDSB1_GRVWB8_GSU1_GSUC0_GSUWGMRR0_K1_LBSPPB1024_MIWT2_2_NLCA8_SU0_SUM0_SUS0_VWB2_WG64_4_1_WGM8_WGMXCC8_WGMXCCGn1
    SolutionIndex: 29
    SolutionNameMin: Cijk_Alik_Bljk_BBS_STA_BH_Bias_HAS_SAV_UserArgs_MT128x48x128_MI16x16x1_SN_LDSB0_GRVWB8_GSU1_GSUC0_GSUWGMRR0_K1_LBSPPB256_MIWT2_3_NLCA4_SU0_SUM0_SUS0_VWB1_WG64_4_1_WGM8_WGMXCC8_WGMXCCGn1
    SolutionIndex: 30
    SolutionNameMin: Cijk_Alik_Bljk_BBS_STA_BH_Bias_HAS_SAV_UserArgs_MT128x48x128_MI16x16x1_SN_LDSB0_GRVWB8_GSU1_GSUC0_GSUWGMRR0_K1_LBSPPB256_MIWT2_3_NLCA4_SU0_SUM0_SUS0_VWB1_WG64_4_1_WGM6_WGMXCC8_WGMXCCGn1
    SolutionIndex: 31
    SolutionNameMin: Cijk_Alik_Bljk_BBS_STA_BH_Bias_HAS_SAV_UserArgs_MT128x64x128_MI16x16x1_SN_LDSB1_GRVWB8_GSU1_GSUC0_GSUWGMRR0_K1_LBSPPB1024_MIWT2_4_NLCA4_SU0_SUM0_SUS0_VWB4_WG64_4_1_WGM8_WGMXCC8_WGMXCCGn1
    SolutionIndex: 32
    SolutionNameMin: Cijk_Alik_Bljk_BBS_STA_BH_Bias_HAS_SAV_UserArgs_MT128x64x128_MI16x16x1_SN_LDSB1_GRVWB8_GSU1_GSUC0_GSUWGMRR0_K1_LBSPPB1024_MIWT2_4_NLCA4_SU0_SUM0_SUS0_VWB4_WG64_4_1_WGM6_WGMXCC8_WGMXCCGn1
    SolutionIndex: 33
    SolutionNameMin: Cijk_Alik_Bljk_BBS_STA_BH_Bias_HAS_SAV_UserArgs_MT128x80x128_MI16x16x1_SN_LDSB1_GRVWB8_GSU1_GSUC0_GSUWGMRR0_K1_LBSPPB256_MIWT2_5_NLCA4_SU0_SUM0_SUS0_VWB1_WG64_4_1_WGM8_WGMXCC8_WGMXCCGn1
    SolutionIndex: 34
    SolutionNameMin: Cijk_Alik_Bljk_BBS_STA_BH_Bias_HAS_SAV_UserArgs_MT128x80x128_MI16x16x1_SN_LDSB1_GRVWB8_GSU1_GSUC0_GSUWGMRR0_K1_LBSPPB256_MIWT2_5_NLCA4_SU0_SUM0_SUS0_VWB1_WG64_4_1_WGM6_WGMXCC8_WGMXCCGn1
    SolutionIndex: 35
    SolutionNameMin: Cijk_Alik_Bljk_BBS_STA_BH_Bias_HAS_SAV_UserArgs_MT128x96x128_MI16x16x1_SN_LDSB1_GRVWB8_GSU1_GSUC0_GSUWGMRR0_K1_LBSPPB512_MIWT2_6_NLCA4_SU0_SUM0_SUS0_VWB2_WG64_4_1_WGM6_WGMXCC8_WGMXCCGn1
    SolutionIndex: 36
    SolutionNameMin: Cijk_Alik_Bljk_BBS_STA_BH_Bias_HAS_SAV_UserArgs_MT128x96x128_MI16x16x1_SN_LDSB1_GRVWB8_GSU1_GSUC0_GSUWGMRR0_K1_LBSPPB512_MIWT2_6_NLCA4_SU0_SUM0_SUS0_VWB2_WG64_4_1_WGM8_WGMXCC8_WGMXCCGn1
    SolutionIndex: 37
    SolutionNameMin: Cijk_Alik_Bljk_BBS_STA_BH_Bias_HAS_SAV_UserArgs_MT128x112x128_MI16x16x1_SN_LDSB1_GRVWB8_GSU1_GSUC0_GSUWGMRR0_K1_LBSPPB256_MIWT2_7_NLCA4_SU0_SUM0_SUS0_VWB1_WG64_4_1_WGM6_WGMXCC8_WGMXCCGn1
    SolutionIndex: 38
    SolutionNameMin: Cijk_Alik_Bljk_BBS_STA_BH_Bias_HAS_SAV_UserArgs_MT256x64x128_MI16x16x1_SN_LDSB1_GRVWB8_GSU1_GSUC0_GSUWGMRR0_K1_LBSPPB1024_MIWT4_4_NLCA4_SU0_SUM0_SUS0_VWB4_WG64_4_1_WGM8_WGMXCC8_WGMXCCGn1
    SolutionIndex: 39
    SolutionNameMin: Cijk_Alik_Bljk_BBS_STA_BH_Bias_HAS_SAV_UserArgs_MT256x64x128_MI16x16x1_SN_LDSB1_GRVWB8_GSU1_GSUC0_GSUWGMRR0_K1_LBSPPB1024_MIWT4_4_NLCA4_SU0_SUM0_SUS0_VWB4_WG64_4_1_WGM6_WGMXCC8_WGMXCCGn1
    SolutionIndex: 40
    SolutionNameMin: Cijk_Alik_Bljk_BBS_STA_BH_Bias_HAS_SAV_UserArgs_MT128x128x128_MI16x16x1_SN_LDSB1_GRVWB8_GSU1_GSUC0_GSUWGMRR0_K1_LBSPPB2048_MIWT2_8_NLCA4_SU0_SUM0_SUS0_VWB8_WG64_4_1_WGM6_WGMXCC8_WGMXCCGn1
    SolutionIndex: 41
    SolutionNameMin: Cijk_Alik_Bljk_BBS_STA_BH_Bias_HAS_SAV_UserArgs_MT256x64x128_MI16x16x1_SN_LDSB1_GRVWB8_GSU1_GSUC0_GSUWGMRR0_K1_LBSPPB1024_MIWT4_4_NLCA4_SU0_SUM0_SUS0_VWB4_WG64_4_1_WGM1_WGMXCC8_WGMXCCGn1
    SolutionIndex: 42
    SolutionNameMin: Cijk_Alik_Bljk_BBS_STA_BH_Bias_HAS_SAV_UserArgs_MT192x96x128_MI16x16x1_SN_LDSB1_GRVWB8_GSU1_GSUC0_GSUWGMRR0_K1_LBSPPB512_MIWT3_6_NLCA4_SU0_SUM0_SUS0_VWB2_WG64_4_1_WGM6_WGMXCC8_WGMXCCGn1
    SolutionIndex: 43
    SolutionNameMin: Cijk_Alik_Bljk_BBS_STA_BH_Bias_HAS_SAV_UserArgs_MT256x96x64_MI16x16x1_SN_LDSB0_GRVWB8_GSU1_GSUC0_GSUWGMRR0_K1_LBSPPB256_MIWT4_6_NLCA2_SU0_SUM0_SUS0_VWB2_WG64_4_1_WGM8_WGMXCC8_WGMXCCGn1
    SolutionIndex: 44
    SolutionNameMin: Cijk_Alik_Bljk_BBS_STA_BH_Bias_HAS_SAV_UserArgs_MT256x80x128_MI16x16x1_SN_LDSB1_GRVWB8_GSU1_GSUC0_GSUWGMRR0_K1_LBSPPB256_MIWT4_5_NLCA4_SU0_SUM0_SUS0_VWB1_WG64_4_1_WGM8_WGMXCC8_WGMXCCGn1
    SolutionIndex: 45
    SolutionNameMin: Cijk_Alik_Bljk_BBS_STA_BH_Bias_HAS_SAV_UserArgs_MT256x96x64_MI16x16x1_SN_LDSB0_GRVWB8_GSU1_GSUC0_GSUWGMRR0_K1_LBSPPB256_MIWT4_6_NLCA2_SU0_SUM0_SUS0_VWB2_WG64_4_1_WGM6_WGMXCC8_WGMXCCGn1
    SolutionIndex: 46
    SolutionNameMin: Cijk_Alik_Bljk_BBS_STA_BH_Bias_HAS_SAV_UserArgs_MT256x96x64_MI16x16x1_SN_LDSB0_GRVWB8_GSU1_GSUC0_GSUWGMRR0_K1_LBSPPB256_MIWT4_6_NLCA2_SU0_SUM0_SUS0_VWB2_WG64_4_1_WGM1_WGMXCC8_WGMXCCGn1
    SolutionIndex: 47
    SolutionNameMin: Cijk_Alik_Bljk_BBS_STA_BH_Bias_HAS_SAV_UserArgs_MT256x112x64_MI16x16x1_SN_LDSB1_GRVWB4_GSU1_GSUC0_GSUWGMRR0_K1_LBSPPB128_MIWT4_7_NLCA2_SU0_SUM0_SUS0_VWB1_WG64_4_1_WGM1_WGMXCC8_WGMXCCGn1
    SolutionIndex: 48
    SolutionNameMin: Cijk_Alik_Bljk_BBS_STA_BH_Bias_HAS_SAV_UserArgs_MT192x160x64_MI16x16x1_SN_LDSB1_GRVWB8_GSU1_GSUC0_GSUWGMRR0_K1_LBSPPB256_MIWT3_10_NLCA2_SU0_SUM0_SUS0_VWB2_WG64_4_1_WGM6_WGMXCC8_WGMXCCGn1
    SolutionIndex: 49
    SolutionNameMin: Cijk_Alik_Bljk_BBS_STA_BH_Bias_HAS_SAV_UserArgs_MT256x128x64_MI16x16x1_SN_LDSB1_GRVWB8_GSU1_GSUC0_GSUWGMRR0_K1_LBSPPB1024_MIWT4_8_NLCA2_SU0_SUM0_SUS0_VWB8_WG64_4_1_WGM8_WGMXCC8_WGMXCCGn1
    SolutionIndex: 50
    SolutionNameMin: Cijk_Alik_Bljk_BBS_STA_BH_Bias_HAS_SAV_UserArgs_MT128x48x128_MI16x16x1_SN_LDSB0_GRVWB8_GSU1_GSUC0_GSUWGMRR0_K1_LBSPPB256_MIWT2_3_NLCA4_SU8_SUM0_SUS256_VWB1_WG64_4_1_WGM8_WGMXCC8_WGMXCCGn1
    SolutionIndex: 51
    SolutionNameMin: Cijk_Alik_Bljk_BBS_STA_BH_Bias_HAS_SAV_UserArgs_MT128x64x128_MI16x16x1_SN_LDSB1_GRVWB8_GSU1_GSUC0_GSUWGMRR0_K1_LBSPPB1024_MIWT2_4_NLCA4_SU8_SUM0_SUS256_VWB4_WG64_4_1_WGM8_WGMXCC8_WGMXCCGn1
    SolutionIndex: 52
    SolutionNameMin: Cijk_Alik_Bljk_BBS_STA_BH_Bias_HAS_SAV_UserArgs_MT128x80x128_MI16x16x1_SN_LDSB1_GRVWB8_GSU1_GSUC0_GSUWGMRR0_K1_LBSPPB256_MIWT2_5_NLCA4_SU8_SUM0_SUS256_VWB1_WG64_4_1_WGM8_WGMXCC8_WGMXCCGn1
    SolutionIndex: 53
    SolutionNameMin: Cijk_Alik_Bljk_BBS_STA_BH_Bias_HAS_SAV_UserArgs_MT128x112x128_MI16x16x1_SN_LDSB1_GRVWB8_GSU1_GSUC0_GSUWGMRR0_K1_LBSPPB256_MIWT2_7_NLCA4_SU0_SUM0_SUS0_VWB1_WG64_4_1_WGM8_WGMXCC8_WGMXCCGn1
    SolutionIndex: 54
    SolutionNameMin: Cijk_Alik_Bljk_BBS_STA_BH_Bias_HAS_SAV_UserArgs_MT192x80x128_MI16x16x1_SN_LDSB1_GRVWB8_GSU1_GSUC0_GSUWGMRR0_K1_LBSPPB256_MIWT3_5_NLCA4_SU0_SUM0_SUS0_VWB1_WG64_4_1_WGM6_WGMXCC8_WGMXCCGn1
    SolutionIndex: 55
    SolutionNameMin: Cijk_Alik_Bljk_BBS_STA_BH_Bias_HAS_SAV_UserArgs_MT320x64x64_MI16x16x1_SN_LDSB0_GRVWB8_GSU1_GSUC0_GSUWGMRR0_K1_LBSPPB512_MIWT5_4_NLCA2_SU0_SUM0_SUS0_VWB4_WG64_4_1_WGM8_WGMXCC8_WGMXCCGn1
    SolutionIndex: 56
    SolutionNameMin: Cijk_Alik_Bljk_BBS_STA_BH_Bias_HAS_SAV_UserArgs_MT320x96x64_MI16x16x1_SN_LDSB0_GRVWB8_GSU1_GSUC0_GSUWGMRR0_K1_LBSPPB256_MIWT5_6_NLCA2_SU0_SUM0_SUS0_VWB2_WG64_4_1_WGM8_WGMXCC8_WGMXCCGn1
    SolutionIndex: 57
    SolutionNameMin: Cijk_Alik_Bljk_BBS_STA_BH_Bias_HAS_SAV_UserArgs_MT256x112x64_MI16x16x1_SN_LDSB1_GRVWB4_GSU1_GSUC0_GSUWGMRR0_K1_LBSPPB128_MIWT4_7_NLCA2_SU0_SUM0_SUS0_VWB1_WG64_4_1_WGM8_WGMXCC8_WGMXCCGn1
    SolutionIndex: 58
    SolutionNameMin: Cijk_Alik_Bljk_BBS_STA_BH_Bias_HAS_SAV_UserArgs_MT320x96x64_MI16x16x1_SN_LDSB0_GRVWB8_GSU1_GSUC0_GSUWGMRR0_K1_LBSPPB256_MIWT5_6_NLCA2_SU0_SUM0_SUS0_VWB2_WG64_4_1_WGM6_WGMXCC8_WGMXCCGn1
    SolutionIndex: 59
    SolutionNameMin: Cijk_Alik_Bljk_BBS_STA_BH_Bias_HAS_SAV_UserArgs_MT256x128x64_MI16x16x1_SN_LDSB1_GRVWB8_GSU1_GSUC0_GSUWGMRR0_K1_LBSPPB1024_MIWT4_8_NLCA2_SU0_SUM0_SUS0_VWB8_WG64_4_1_WGM6_WGMXCC8_WGMXCCGn1
    SolutionIndex: 60
    SolutionNameMin: Cijk_Alik_Bljk_BBS_STA_BH_Bias_HAS_SAV_UserArgs_MT256x160x64_MI16x16x1_SN_LDSB0_GRVWB8_GSU1_GSUC0_GSUWGMRR0_K1_LBSPPB256_MIWT4_10_NLCA2_SU0_SUM0_SUS0_VWB2_WG64_4_1_WGM6_WGMXCC8_WGMXCCGn1
    SolutionIndex: 61
    SolutionNameMin: Cijk_Alik_Bljk_BBS_STA_BH_Bias_HAS_SAV_UserArgs_MT256x160x64_MI16x16x1_SN_LDSB0_GRVWB8_GSU1_GSUC0_GSUWGMRR0_K1_LBSPPB256_MIWT4_10_NLCA2_SU0_SUM0_SUS0_VWB2_WG64_4_1_WGM8_WGMXCC8_WGMXCCGn1
    SolutionIndex: 62
    SolutionNameMin: Cijk_Alik_Bljk_BBS_STA_BH_Bias_HAS_SAV_UserArgs_MT256x160x64_MI16x16x1_SN_LDSB0_GRVWB8_GSU1_GSUC0_GSUWGMRR0_K1_LBSPPB256_MIWT4_10_NLCA2_SU8_SUM0_SUS128_VWB2_WG64_4_1_WGM8_WGMXCC8_WGMXCCGn1
    SolutionIndex: 63
    SolutionNameMin: Cijk_Alik_Bljk_BBS_STA_BH_Bias_HAS_SAV_UserArgs_MT256x192x64_MI16x16x1_SN_LDSB0_GRVWB8_GSU1_GSUC0_GSUWGMRR0_K1_LBSPPB512_MIWT4_12_NLCA2_SU0_SUM0_SUS0_VWB4_WG64_4_1_WGM6_WGMXCC8_WGMXCCGn1
    SolutionIndex: 64
    SolutionNameMin: Cijk_Alik_Bljk_BBS_STA_BH_Bias_HAS_SAV_UserArgs_MT256x192x64_MI16x16x1_SN_LDSB0_GRVWB8_GSU1_GSUC0_GSUWGMRR0_K1_LBSPPB512_MIWT4_12_NLCA2_SU0_SUM0_SUS0_VWB4_WG64_4_1_WGM8_WGMXCC8_WGMXCCGn1
    SolutionIndex: 65
    SolutionNameMin: Cijk_Alik_Bljk_BBS_STA_BH_Bias_HAS_SAV_UserArgs_MT256x176x64_MI16x16x1_SN_LDSB0_GRVWB4_GSU1_GSUC0_GSUWGMRR0_K1_LBSPPB128_MIWT4_11_NLCA2_SU0_SUM0_SUS0_VWB1_WG64_4_1_WGM6_WGMXCC8_WGMXCCGn1
    SolutionIndex: 66
    SolutionNameMin: Cijk_Alik_Bljk_BBS_STA_BH_Bias_HAS_SAV_UserArgs_MT256x224x64_MI16x16x1_SN_LDSB0_GRVWB8_GSU1_GSUC0_GSUWGMRR0_K1_LBSPPB256_MIWT4_14_NLCA2_SU0_SUM0_SUS0_VWB2_WG64_4_1_WGM8_WGMXCC8_WGMXCCGn1
    SolutionIndex: 67
    SolutionNameMin: Cijk_Alik_Bljk_BBS_STA_BH_Bias_HAS_SAV_UserArgs_MT256x224x64_MI16x16x1_SN_LDSB0_GRVWB8_GSU1_GSUC0_GSUWGMRR0_K1_LBSPPB256_MIWT4_14_NLCA2_SU0_SUM0_SUS0_VWB2_WG64_4_1_WGM1_WGMXCC8_WGMXCCGn1
    SolutionIndex: 68
    SolutionNameMin: Cijk_Alik_Bljk_BBS_STA_BH_Bias_HAS_SAV_UserArgs_MT256x48x128_MI16x16x1_SN_LDSB0_GRVWB8_GSU1_GSUC0_GSUWGMRR0_K1_LBSPPB256_MIWT4_3_NLCA4_SU0_SUM0_SUS0_VWB1_WG64_4_1_WGM6_WGMXCC8_WGMXCCGn1
    SolutionIndex: 69
    SolutionNameMin: Cijk_Alik_Bljk_BBS_STA_BH_Bias_HAS_SAV_UserArgs_MT128x96x128_MI16x16x1_SN_LDSB1_GRVWB8_GSU1_GSUC0_GSUWGMRR0_K1_LBSPPB512_MIWT2_6_NLCA4_SU8_SUM0_SUS256_VWB2_WG64_4_1_WGM8_WGMXCC8_WGMXCCGn1
    SolutionIndex: 70
    SolutionNameMin: Cijk_Alik_Bljk_BBS_STA_BH_Bias_HAS_SAV_UserArgs_MT128x112x128_MI16x16x1_SN_LDSB1_GRVWB8_GSU1_GSUC0_GSUWGMRR0_K1_LBSPPB256_MIWT2_7_NLCA4_SU8_SUM0_SUS256_VWB1_WG64_4_1_WGM8_WGMXCC8_WGMXCCGn1
    SolutionIndex: 71
    SolutionNameMin: Cijk_Alik_Bljk_BBS_STA_BH_Bias_HAS_SAV_UserArgs_MT192x80x128_MI16x16x1_SN_LDSB1_GRVWB8_GSU1_GSUC0_GSUWGMRR0_K1_LBSPPB256_MIWT3_5_NLCA4_SU0_SUM0_SUS0_VWB1_WG64_4_1_WGM8_WGMXCC8_WGMXCCGn1
    SolutionIndex: 72
    SolutionNameMin: Cijk_Alik_Bljk_BBS_STA_BH_Bias_HAS_SAV_UserArgs_MT192x96x64_MI16x16x1_SN_LDSB0_GRVWB8_GSU1_GSUC0_GSUWGMRR0_K1_LBSPPB256_MIWT3_6_NLCA2_SU0_SUM0_SUS0_VWB2_WG64_4_1_WGM6_WGMXCC8_WGMXCCGn1
    SolutionIndex: 73
    SolutionNameMin: Cijk_Alik_Bljk_BBS_STA_BH_Bias_HAS_SAV_UserArgs_MT256x80x128_MI16x16x1_SN_LDSB1_GRVWB8_GSU1_GSUC0_GSUWGMRR0_K1_LBSPPB256_MIWT4_5_NLCA4_SU0_SUM0_SUS0_VWB1_WG64_4_1_WGM6_WGMXCC8_WGMXCCGn1
    SolutionIndex: 74
    SolutionNameMin: Cijk_Alik_Bljk_BBS_STA_BH_Bias_HAS_SAV_UserArgs_MT320x80x64_MI16x16x1_SN_LDSB0_GRVWB4_GSU1_GSUC0_GSUWGMRR0_K1_LBSPPB128_MIWT5_5_NLCA2_SU0_SUM0_SUS0_VWB1_WG64_4_1_WGM6_WGMXCC8_WGMXCCGn1
    SolutionIndex: 75
    SolutionNameMin: Cijk_Alik_Bljk_BBS_STA_BH_Bias_HAS_SAV_UserArgs_MT384x64x64_MI16x16x1_SN_LDSB0_GRVWB8_GSU1_GSUC0_GSUWGMRR0_K1_LBSPPB512_MIWT6_4_NLCA2_SU0_SUM0_SUS0_VWB4_WG64_4_1_WGM8_WGMXCC8_WGMXCCGn1
    SolutionIndex: 76
    SolutionNameMin: Cijk_Alik_Bljk_BBS_STA_BH_Bias_HAS_SAV_UserArgs_MT448x64x64_MI16x16x1_SN_LDSB0_GRVWB8_GSU1_GSUC0_GSUWGMRR0_K1_LBSPPB512_MIWT7_4_NLCA2_SU0_SUM0_SUS0_VWB4_WG64_4_1_WGM8_WGMXCC8_WGMXCCGn1
    SolutionIndex: 77
    SolutionNameMin: Cijk_Alik_Bljk_BBS_STA_BH_Bias_HAS_SAV_UserArgs_MT192x192x64_MI16x16x1_SN_LDSB0_GRVWB8_GSU1_GSUC0_GSUWGMRR0_K1_LBSPPB512_MIWT3_12_NLCA2_SU0_SUM0_SUS0_VWB4_WG64_4_1_WGM6_WGMXCC8_WGMXCCGn1
    SolutionIndex: 78
    SolutionNameMin: Cijk_Alik_Bljk_BBS_STA_BH_Bias_HAS_SAV_UserArgs_MT256x144x64_MI16x16x1_SN_LDSB0_GRVWB4_GSU1_GSUC0_GSUWGMRR0_K1_LBSPPB128_MIWT4_9_NLCA2_SU8_SUM0_SUS128_VWB1_WG64_4_1_WGM6_WGMXCC8_WGMXCCGn1
    SolutionIndex: 79
    SolutionNameMin: Cijk_Alik_Bljk_BBS_STA_BH_Bias_HAS_SAV_UserArgs_MT256x160x64_MI16x16x1_SN_LDSB0_GRVWB8_GSU1_GSUC0_GSUWGMRR0_K1_LBSPPB256_MIWT4_10_NLCA2_SU8_SUM0_SUS128_VWB2_WG64_4_1_WGM6_WGMXCC8_WGMXCCGn1
    SolutionIndex: 80
    SolutionNameMin: Cijk_Alik_Bljk_BBS_STA_BH_Bias_HAS_SAV_UserArgs_MT192x224x64_MI16x16x1_SN_LDSB0_GRVWB8_GSU1_GSUC0_GSUWGMRR0_K1_LBSPPB256_MIWT3_14_NLCA2_SU0_SUM0_SUS0_VWB2_WG64_4_1_WGM8_WGMXCC8_WGMXCCGn1
    SolutionIndex: 81
    SolutionNameMin: Cijk_Alik_Bljk_BBS_STA_BH_Bias_HAS_SAV_UserArgs_MT320x160x64_MI16x16x1_SN_LDSB0_GRVWB8_GSU1_GSUC0_GSUWGMRR0_K1_LBSPPB256_MIWT5_10_NLCA2_SU0_SUM0_SUS0_VWB2_WG64_4_1_WGM8_WGMXCC8_WGMXCCGn1
    SolutionIndex: 82
    SolutionNameMin: Cijk_Alik_Bljk_BBS_STA_BH_Bias_HAS_SAV_UserArgs_MT256x208x64_MI16x16x1_SN_LDSB1_GRVWB4_GSU1_GSUC0_GSUWGMRR0_K1_LBSPPB128_MIWT4_13_NLCA2_SU0_SUM0_SUS0_VWB1_WG64_4_1_WGM6_WGMXCC8_WGMXCCGn1
    SolutionIndex: 83
    SolutionNameMin: Cijk_Alik_Bljk_BBS_STA_BH_Bias_HAS_SAV_UserArgs_MT256x224x64_MI16x16x1_SN_LDSB0_GRVWB8_GSU1_GSUC0_GSUWGMRR0_K1_LBSPPB256_MIWT4_14_NLCA2_SU0_SUM0_SUS0_VWB2_WG64_4_1_WGM6_WGMXCC8_WGMXCCGn1
    SolutionIndex: 84
    SolutionNameMin: Cijk_Alik_Bljk_BBS_STA_BH_Bias_HAS_SAV_UserArgs_MT384x128x64_MI16x16x1_SN_LDSB0_GRVWB8_GSU1_GSUC0_GSUWGMRR0_K1_LBSPPB1024_MIWT6_8_NLCA2_SU0_SUM0_SUS0_VWB8_WG64_4_1_WGM8_WGMXCC8_WGMXCCGn1
    SolutionIndex: 85
    SolutionNameMin: Cijk_Alik_Bljk_BBS_STA_BH_Bias_HAS_SAV_UserArgs_MT384x160x64_MI16x16x1_SN_LDSB0_GRVWB8_GSU1_GSUC0_GSUWGMRR0_K1_LBSPPB256_MIWT6_10_NLCA2_SU0_SUM0_SUS0_VWB2_WG64_4_1_WGM6_WGMXCC8_WGMXCCGn1
    SolutionIndex: 86
    SolutionNameMin: Cijk_Alik_Bljk_BBS_STA_BH_Bias_HAS_SAV_UserArgs_MT384x160x64_MI16x16x1_SN_LDSB0_GRVWB8_GSU1_GSUC0_GSUWGMRR0_K1_LBSPPB256_MIWT6_10_NLCA2_SU8_SUM0_SUS128_VWB2_WG64_4_1_WGM8_WGMXCC8_WGMXCCGn1
    SolutionIndex: 87
    SolutionNameMin: Cijk_Alik_Bljk_BBS_STA_BH_Bias_HAS_SAV_UserArgs_MT384x144x64_MI16x16x1_SN_LDSB0_GRVWB4_GSU1_GSUC0_GSUWGMRR0_K1_LBSPPB128_MIWT6_9_NLCA2_SU0_SUM0_SUS0_VWB1_WG64_4_1_WGM8_WGMXCC8_WGMXCCGn1
    SolutionIndex: 88
    SolutionNameMin: Cijk_Alik_Bljk_BBS_STA_BH_Bias_HAS_SAV_UserArgs_MT448x128x64_MI16x16x1_SN_LDSB0_GRVWB8_GSU1_GSUC0_GSUWGMRR0_K1_LBSPPB1024_MIWT7_8_NLCA2_SU0_SUM0_SUS0_VWB8_WG64_4_1_WGM8_WGMXCC8_WGMXCCGn1
    SolutionIndex: 89
    SolutionNameMin: Cijk_Alik_Bljk_BBS_STA_BH_Bias_HAS_SAV_UserArgs_MT384x160x64_MI16x16x1_SN_LDSB0_GRVWB8_GSU1_GSUC0_GSUWGMRR0_K1_LBSPPB256_MIWT6_10_NLCA2_SU0_SUM0_SUS0_VWB2_WG64_4_1_WGM8_WGMXCC8_WGMXCCGn1
    SolutionIndex: 90
    SolutionNameMin: Cijk_Alik_Bljk_BBS_STA_BH_Bias_HAS_SAV_UserArgs_MT512x128x64_MI16x16x1_SN_LDSB0_GRVWB8_GSU1_GSUC0_GSUWGMRR0_K1_LBSPPB1024_MIWT8_8_NLCA2_SU0_SUM0_SUS0_VWB8_WG64_4_1_WGM6_WGMXCC8_WGMXCCGn1
    SolutionIndex: 91
    SolutionNameMin: Cijk_Alik_Bljk_BBS_STA_BH_Bias_HAS_SAV_UserArgs_MT384x176x64_MI16x16x1_SN_LDSB0_GRVWB4_GSU1_GSUC0_GSUWGMRR0_K1_LBSPPB128_MIWT6_11_NLCA2_SU0_SUM0_SUS0_VWB1_WG64_4_1_WGM8_WGMXCC8_WGMXCCGn1
    SolutionIndex: 92
    SolutionNameMin: Cijk_Alik_Bljk_BBS_STA_BH_Bias_HAS_SAV_UserArgs_MT512x128x64_MI16x16x1_SN_LDSB0_GRVWB8_GSU1_GSUC0_GSUWGMRR0_K1_LBSPPB1024_MIWT8_8_NLCA2_SU0_SUM0_SUS0_VWB8_WG64_4_1_WGM8_WGMXCC8_WGMXCCGn1
    SolutionIndex: 93
    SolutionNameMin: Cijk_Alik_Bljk_BBS_STA_BH_Bias_HAS_SAV_UserArgs_MT320x128x64_MI16x16x1_SN_LDSB0_GRVWB8_GSU1_GSUC0_GSUWGMRR0_K1_LBSPPB1024_MIWT5_8_NLCA2_SU0_SUM0_SUS0_VWB8_WG64_4_1_WGM8_WGMXCC8_WGMXCCGn1
    SolutionIndex: 94
    SolutionNameMin: Cijk_Alik_Bljk_BBS_STA_BH_Bias_HAS_SAV_UserArgs_MT256x96x64_MI16x16x1_SN_LDSB0_GRVWB8_GSU1_GSUC0_GSUWGMRR0_K1_LBSPPB256_MIWT4_6_NLCA2_SU8_SUM0_SUS128_VWB2_WG64_4_1_WGM8_WGMXCC8_WGMXCCGn1
    SolutionIndex: 95
    SolutionNameMin: Cijk_Alik_Bljk_BBS_STA_BH_Bias_HAS_SAV_UserArgs_MT128x48x128_MI16x16x1_SN_LDSB0_GRVWB8_GSU1_GSUC0_GSUWGMRR0_K1_LBSPPB256_MIWT2_3_NLCA4_SU8_SUM0_SUS256_VWB1_WG64_4_1_WGM6_WGMXCC8_WGMXCCGn1
    SolutionIndex: 96
    SolutionNameMin: Cijk_Alik_Bljk_BBS_STA_BH_Bias_HAS_SAV_UserArgs_MT192x48x128_MI16x16x1_SN_LDSB0_GRVWB8_GSU1_GSUC0_GSUWGMRR0_K1_LBSPPB256_MIWT3_3_NLCA4_SU0_SUM0_SUS0_VWB1_WG64_4_1_WGM8_WGMXCC8_WGMXCCGn1
    SolutionIndex: 97
    SolutionNameMin: Cijk_Alik_Bljk_BBS_STA_BH_Bias_HAS_SAV_UserArgs_MT192x64x128_MI16x16x1_SN_LDSB1_GRVWB8_GSU1_GSUC0_GSUWGMRR0_K1_LBSPPB1024_MIWT3_4_NLCA4_SU0_SUM0_SUS0_VWB4_WG64_4_1_WGM6_WGMXCC8_WGMXCCGn1
    SolutionIndex: 98
    SolutionNameMin: Cijk_Alik_Bljk_BBS_STA_BH_Bias_HAS_SAV_UserArgs_MT128x128x128_MI16x16x1_SN_LDSB1_GRVWB8_GSU1_GSUC0_GSUWGMRR0_K1_LBSPPB2048_MIWT2_8_NLCA4_SU8_SUM0_SUS256_VWB8_WG64_4_1_WGM8_WGMXCC8_WGMXCCGn1
    SolutionIndex: 99
    SolutionNameMin: Cijk_Alik_Bljk_BBS_STA_BH_Bias_HAS_SAV_UserArgs_MT192x96x64_MI16x16x1_SN_LDSB0_GRVWB8_GSU1_GSUC0_GSUWGMRR0_K1_LBSPPB256_MIWT3_6_NLCA2_SU8_SUM0_SUS128_VWB2_WG64_4_1_WGM8_WGMXCC8_WGMXCCGn1
    SolutionIndex: 100
    SolutionNameMin: Cijk_Alik_Bljk_BBS_STA_BH_Bias_HAS_SAV_UserArgs_MT256x80x64_MI16x16x1_SN_LDSB0_GRVWB4_GSU1_GSUC0_GSUWGMRR0_K1_LBSPPB128_MIWT4_5_NLCA2_SU0_SUM0_SUS0_VWB1_WG64_4_1_WGM6_WGMXCC8_WGMXCCGn1
    SolutionIndex: 101
    SolutionNameMin: Cijk_Alik_Bljk_BBS_STA_BH_Bias_HAS_SAV_UserArgs_MT320x80x64_MI16x16x1_SN_LDSB0_GRVWB4_GSU1_GSUC0_GSUWGMRR0_K1_LBSPPB128_MIWT5_5_NLCA2_SU8_SUM0_SUS128_VWB1_WG64_4_1_WGM8_WGMXCC8_WGMXCCGn1
    SolutionIndex: 102
    SolutionNameMin: Cijk_Alik_Bljk_BBS_STA_BH_Bias_HAS_SAV_UserArgs_MT192x128x64_MI16x16x1_SN_LDSB1_GRVWB8_GSU1_GSUC0_GSUWGMRR0_K1_LBSPPB1024_MIWT3_8_NLCA2_SU0_SUM0_SUS0_VWB8_WG64_4_1_WGM6_WGMXCC8_WGMXCCGn1
    SolutionIndex: 103
    SolutionNameMin: Cijk_Alik_Bljk_BBS_STA_BH_Bias_HAS_SAV_UserArgs_MT320x80x64_MI16x16x1_SN_LDSB0_GRVWB4_GSU1_GSUC0_GSUWGMRR0_K1_LBSPPB128_MIWT5_5_NLCA2_SU0_SUM0_SUS0_VWB1_WG64_4_1_WGM8_WGMXCC8_WGMXCCGn1
    SolutionIndex: 104
    SolutionNameMin: Cijk_Alik_Bljk_BBS_STA_BH_Bias_HAS_SAV_UserArgs_MT256x112x64_MI16x16x1_SN_LDSB1_GRVWB4_GSU1_GSUC0_GSUWGMRR0_K1_LBSPPB128_MIWT4_7_NLCA2_SU8_SUM0_SUS128_VWB1_WG64_4_1_WGM8_WGMXCC8_WGMXCCGn1
    SolutionIndex: 105
    SolutionNameMin: Cijk_Alik_Bljk_BBS_STA_BH_Bias_HAS_SAV_UserArgs_MT320x112x64_MI16x16x1_SN_LDSB0_GRVWB4_GSU1_GSUC0_GSUWGMRR0_K1_LBSPPB128_MIWT5_7_NLCA2_SU0_SUM0_SUS0_VWB1_WG64_4_1_WGM8_WGMXCC8_WGMXCCGn1
    SolutionIndex: 106
    SolutionNameMin: Cijk_Alik_Bljk_BBS_STA_BH_Bias_HAS_SAV_UserArgs_MT320x128x64_MI16x16x1_SN_LDSB0_GRVWB8_GSU1_GSUC0_GSUWGMRR0_K1_LBSPPB1024_MIWT5_8_NLCA2_SU8_SUM0_SUS128_VWB8_WG64_4_1_WGM8_WGMXCC8_WGMXCCGn1
    SolutionIndex: 107
    SolutionNameMin: Cijk_Alik_Bljk_BBS_STA_BH_Bias_HAS_SAV_UserArgs_MT320x128x64_MI16x16x1_SN_LDSB0_GRVWB8_GSU1_GSUC0_GSUWGMRR0_K1_LBSPPB1024_MIWT5_8_NLCA2_SU0_SUM0_SUS0_VWB8_WG64_4_1_WGM6_WGMXCC8_WGMXCCGn1
    SolutionIndex: 108
    SolutionNameMin: Cijk_Alik_Bljk_BBS_STA_BH_Bias_HAS_SAV_UserArgs_MT320x144x64_MI16x16x1_SN_LDSB0_GRVWB4_GSU1_GSUC0_GSUWGMRR0_K1_LBSPPB128_MIWT5_9_NLCA2_SU0_SUM0_SUS0_VWB1_WG64_4_1_WGM6_WGMXCC8_WGMXCCGn1
    SolutionIndex: 109
    SolutionNameMin: Cijk_Alik_Bljk_BBS_STA_BH_Bias_HAS_SAV_UserArgs_MT320x144x64_MI16x16x1_SN_LDSB0_GRVWB4_GSU1_GSUC0_GSUWGMRR0_K1_LBSPPB128_MIWT5_9_NLCA2_SU8_SUM0_SUS128_VWB1_WG64_4_1_WGM8_WGMXCC8_WGMXCCGn1
    SolutionIndex: 110
    SolutionNameMin: Cijk_Alik_Bljk_BBS_STA_BH_Bias_HAS_SAV_UserArgs_MT256x192x64_MI16x16x1_SN_LDSB0_GRVWB8_GSU1_GSUC0_GSUWGMRR0_K1_LBSPPB512_MIWT4_12_NLCA2_SU8_SUM0_SUS128_VWB4_WG64_4_1_WGM6_WGMXCC8_WGMXCCGn1
    SolutionIndex: 111
    SolutionNameMin: Cijk_Alik_Bljk_BBS_STA_BH_Bias_HAS_SAV_UserArgs_MT320x160x64_MI16x16x1_SN_LDSB0_GRVWB8_GSU1_GSUC0_GSUWGMRR0_K1_LBSPPB256_MIWT5_10_NLCA2_SU0_SUM0_SUS0_VWB2_WG64_4_1_WGM6_WGMXCC8_WGMXCCGn1
    SolutionIndex: 112
    SolutionNameMin: Cijk_Alik_Bljk_BBS_STA_BH_Bias_HAS_SAV_UserArgs_MT256x208x64_MI16x16x1_SN_LDSB1_GRVWB4_GSU1_GSUC0_GSUWGMRR0_K1_LBSPPB128_MIWT4_13_NLCA2_SU8_SUM0_SUS128_VWB1_WG64_4_1_WGM8_WGMXCC8_WGMXCCGn1
    SolutionIndex: 113
    SolutionNameMin: Cijk_Alik_Bljk_BBS_STA_BH_Bias_HAS_SAV_UserArgs_MT320x176x64_MI16x16x1_SN_LDSB0_GRVWB4_GSU1_GSUC0_GSUWGMRR0_K1_LBSPPB128_MIWT5_11_NLCA2_SU8_SUM0_SUS128_VWB1_WG64_4_1_WGM6_WGMXCC8_WGMXCCGn1
    SolutionIndex: 114
    SolutionNameMin: Cijk_Alik_Bljk_BBS_STA_BH_Bias_HAS_SAV_UserArgs_MT320x176x64_MI16x16x1_SN_LDSB0_GRVWB4_GSU1_GSUC0_GSUWGMRR0_K1_LBSPPB128_MIWT5_11_NLCA2_SU0_SUM0_SUS0_VWB1_WG64_4_1_WGM6_WGMXCC8_WGMXCCGn1
    SolutionIndex: 115
    SolutionNameMin: Cijk_Alik_Bljk_BBS_STA_BH_Bias_HAS_SAV_UserArgs_MT320x192x64_MI16x16x1_SN_LDSB0_GRVWB8_GSU1_GSUC0_GSUWGMRR0_K1_LBSPPB512_MIWT5_12_NLCA2_SU0_SUM0_SUS0_VWB4_WG64_4_1_WGM8_WGMXCC8_WGMXCCGn1
    SolutionIndex: 116
    SolutionNameMin: Cijk_Alik_Bljk_BBS_STA_BH_Bias_HAS_SAV_UserArgs_MT512x128x64_MI16x16x1_SN_LDSB0_GRVWB8_GSU1_GSUC0_GSUWGMRR0_K1_LBSPPB1024_MIWT8_8_NLCA2_SU0_SUM0_SUS0_VWB8_WG64_4_1_WGM1_WGMXCC8_WGMXCCGn1
    SolutionIndex: 117
    SolutionNameMin: Cijk_Alik_Bljk_BBS_STA_BH_Bias_HAS_SAV_UserArgs_MT256x256x64_MI16x16x1_SN_LDSB1_GRVWB8_GSU1_GSUC0_GSUWGMRR0_K1_LBSPPB1024_MIWT4_16_NLCA2_SU0_SUM0_SUS0_VWB8_WG64_4_1_WGM6_WGMXCC8_WGMXCCGn1
    SolutionIndex: 118
    SolutionNameMin: Cijk_Alik_Bljk_BBS_STA_BH_Bias_HAS_SAV_UserArgs_MT32x16x256_MI16x16x1_SN_LDSB0_GRVWB8_GSU1_GSUC0_GSUWGMRR0_K1_LBSPPB512_MIWT1_1_NLCA8_SU0_SUM0_SUS0_VWB1_WG32_4_1_WGM1_WGMXCC8_WGMXCCGn1
    SolutionIndex: 119
    SolutionNameMin: Cijk_Alik_Bljk_BBS_STA_BH_Bias_HAS_SAV_UserArgs_MT64x16x256_MI16x16x1_SN_LDSB0_GRVWB8_GSU1_GSUC0_GSUWGMRR0_K1_LBSPPB512_MIWT1_1_NLCA8_SU0_SUM0_SUS0_VWB1_WG64_4_1_WGM8_WGMXCC8_WGMXCCGn1
    SolutionIndex: 120
    SolutionNameMin: Cijk_Alik_Bljk_BBS_STA_BH_Bias_HAS_SAV_UserArgs_MT64x32x256_MI16x16x1_SN_LDSB1_GRVWB8_GSU1_GSUC0_GSUWGMRR0_K1_LBSPPB1024_MIWT1_2_NLCA8_SU0_SUM0_SUS0_VWB2_WG64_4_1_WGM6_WGMXCC8_WGMXCCGn1
    SolutionIndex: 121
    SolutionNameMin: Cijk_Alik_Bljk_BBS_STA_BH_Bias_HAS_SAV_UserArgs_MT128x16x256_MI16x16x1_SN_LDSB0_GRVWB8_GSU1_GSUC0_GSUWGMRR0_K1_LBSPPB512_MIWT2_1_NLCA8_SU0_SUM0_SUS0_VWB1_WG64_4_1_WGM6_WGMXCC8_WGMXCCGn1
    SolutionIndex: 122
    SolutionNameMin: Cijk_Alik_Bljk_BBS_STA_BH_Bias_HAS_SAV_UserArgs_MT128x16x256_MI16x16x1_SN_LDSB0_GRVWB8_GSU1_GSUC0_GSUWGMRR0_K1_LBSPPB512_MIWT2_1_NLCA8_SU0_SUM0_SUS0_VWB1_WG64_4_1_WGM8_WGMXCC8_WGMXCCGn1
    SolutionIndex: 123
    SolutionNameMin: Cijk_Alik_Bljk_BBS_STA_BH_Bias_HAS_SAV_UserArgs_MT64x48x128_MI16x16x1_SN_LDSB0_GRVWB8_GSU1_GSUC0_GSUWGMRR0_K1_LBSPPB256_MIWT1_3_NLCA4_SU8_SUM0_SUS256_VWB1_WG64_4_1_WGM8_WGMXCC8_WGMXCCGn1
    SolutionIndex: 124
    SolutionNameMin: Cijk_Alik_Bljk_BBS_STA_BH_Bias_HAS_SAV_UserArgs_MT320x48x128_MI16x16x1_SN_LDSB0_GRVWB8_GSU1_GSUC0_GSUWGMRR0_K1_LBSPPB256_MIWT5_3_NLCA4_SU0_SUM0_SUS0_VWB1_WG64_4_1_WGM8_WGMXCC8_WGMXCCGn1
    SolutionIndex: 125
    SolutionNameMin: Cijk_Alik_Bljk_BBS_STA_BH_Bias_HAS_SAV_UserArgs_MT320x48x128_MI16x16x1_SN_LDSB0_GRVWB8_GSU1_GSUC0_GSUWGMRR0_K1_LBSPPB256_MIWT5_3_NLCA4_SU0_SUM0_SUS0_VWB1_WG64_4_1_WGM6_WGMXCC8_WGMXCCGn1
    SolutionIndex: 126
    SolutionNameMin: Cijk_Alik_Bljk_BBS_STA_BH_Bias_HAS_SAV_UserArgs_MT256x64x64_MI16x16x1_SN_LDSB0_GRVWB8_GSU1_GSUC0_GSUWGMRR0_K1_LBSPPB512_MIWT4_4_NLCA2_SU0_SUM0_SUS0_VWB4_WG64_4_1_WGM8_WGMXCC8_WGMXCCGn1
    SolutionIndex: 127
    SolutionNameMin: Cijk_Alik_Bljk_BBS_STA_BH_Bias_HAS_SAV_UserArgs_MT192x128x64_MI16x16x1_SN_LDSB1_GRVWB8_GSU1_GSUC0_GSUWGMRR0_K1_LBSPPB1024_MIWT3_8_NLCA2_SU8_SUM0_SUS128_VWB8_WG64_4_1_WGM8_WGMXCC8_WGMXCCGn1
    SolutionIndex: 128
    SolutionNameMin: Cijk_Alik_Bljk_BBS_STA_BH_Bias_HAS_SAV_UserArgs_MT256x112x64_MI16x16x1_SN_LDSB1_GRVWB4_GSU1_GSUC0_GSUWGMRR0_K1_LBSPPB128_MIWT4_7_NLCA2_SU0_SUM0_SUS0_VWB1_WG64_4_1_WGM6_WGMXCC8_WGMXCCGn1
    SolutionIndex: 129
    SolutionNameMin: Cijk_Alik_Bljk_BBS_STA_BH_Bias_HAS_SAV_UserArgs_MT512x64x64_MI16x16x1_SN_LDSB0_GRVWB8_GSU1_GSUC0_GSUWGMRR0_K1_LBSPPB512_MIWT8_4_NLCA2_SU0_SUM0_SUS0_VWB4_WG64_4_1_WGM8_WGMXCC8_WGMXCCGn1
    SolutionIndex: 130
    SolutionNameMin: Cijk_Alik_Bljk_BBS_STA_BH_Bias_HAS_SAV_UserArgs_MT320x192x64_MI16x16x1_SN_LDSB0_GRVWB8_GSU1_GSUC0_GSUWGMRR0_K1_LBSPPB512_MIWT5_12_NLCA2_SU0_SUM0_SUS0_VWB4_WG64_4_1_WGM6_WGMXCC8_WGMXCCGn1
    SolutionIndex: 131
    SolutionNameMin: Cijk_Alik_Bljk_BBS_STA_BH_Bias_HAS_SAV_UserArgs_MT256x256x64_MI16x16x1_SN_LDSB1_GRVWB8_GSU1_GSUC0_GSUWGMRR0_K1_LBSPPB1024_MIWT4_16_NLCA2_SU0_SUM0_SUS0_VWB8_WG64_4_1_WGM1_WGMXCC8_WGMXCCGn1
    SolutionIndex: 132
    SolutionNameMin: Cijk_Alik_Bljk_BBS_STA_BH_Bias_HAS_SAV_UserArgs_MT192x128x64_MI16x16x1_SN_LDSB1_GRVWB8_GSU1_GSUC0_GSUWGMRR0_K1_LBSPPB1024_MIWT3_8_NLCA2_SU0_SUM0_SUS0_VWB8_WG64_4_1_WGM8_WGMXCC8_WGMXCCGn1
    SolutionIndex: 133
    SolutionNameMin: Cijk_Alik_Bljk_BBS_STA_BH_Bias_HAS_SAV_UserArgs_MT16x16x256_MI16x16x1_SN_LDSB0_GRVWB8_GSU6_GSUAMBSK_GSUC1_GSUWGMRR1_K1_LBSPPB512_MIWT1_1_NTA4_NLCA8_SU0_SUM0_SUS0_VWB1_WG16_4_1_WGM1_WGMXCC8_WGMXCCGn1
    SolutionIndex: 134
    SolutionNameMin: Cijk_Alik_Bljk_BBS_STA_BH_Bias_HAS_SAV_UserArgs_MT64x16x256_MI16x16x1_SN_LDSB0_GRVWB8_GSU8_GSUAMBSK_GSUC1_GSUWGMRR1_K1_LBSPPB512_MIWT1_1_NTA4_NLCA8_SU0_SUM0_SUS0_VWB1_WG64_4_1_WGM1_WGMXCC8_WGMXCCGn1
    SolutionIndex: 135
    SolutionNameMin: Cijk_Alik_Bljk_BBS_STA_BH_Bias_HAS_SAV_UserArgs_MT64x16x256_MI16x16x1_SN_LDSB0_GRVWB8_GSU4_GSUAMBSK_GSUC1_GSUWGMRR1_K1_LBSPPB512_MIWT1_1_NTA4_NLCA8_SU0_SUM0_SUS0_VWB1_WG64_4_1_WGM1_WGMXCC8_WGMXCCGn1
    SolutionIndex: 136
    SolutionNameMin: Cijk_Alik_Bljk_BBS_STA_BH_Bias_HAS_SAV_UserArgs_MT64x16x256_MI16x16x1_SN_LDSB0_GRVWB8_GSU5_GSUAMBSK_GSUC1_GSUWGMRR1_K1_LBSPPB512_MIWT1_1_NTA0_NLCA8_SU0_SUM0_SUS0_VWB1_WG64_4_1_WGM1_WGMXCC8_WGMXCCGn1
    SolutionIndex: 137
    SolutionNameMin: Cijk_Alik_Bljk_BBS_STA_BH_Bias_HAS_SAV_UserArgs_MT64x16x256_MI16x16x1_SN_LDSB0_GRVWB8_GSU4_GSUAMBSK_GSUC1_GSUWGMRR1_K1_LBSPPB512_MIWT1_1_NTA0_NLCA8_SU0_SUM0_SUS0_VWB1_WG64_4_1_WGM1_WGMXCC8_WGMXCCGn1
    SolutionIndex: 138
    SolutionNameMin: Cijk_Alik_Bljk_BBS_STA_BH_Bias_HAS_SAV_UserArgs_MT64x16x256_MI16x16x1_SN_LDSB0_GRVWB8_GSU3_GSUAMBSK_GSUC1_GSUWGMRR1_K1_LBSPPB512_MIWT1_1_NTA0_NLCA8_SU0_SUM0_SUS0_VWB1_WG64_4_1_WGM1_WGMXCC8_WGMXCCGn1
    SolutionIndex: 139
    SolutionNameMin: Cijk_Alik_Bljk_BBS_STA_BH_Bias_HAS_SAV_UserArgs_MT64x16x256_MI16x16x1_SN_LDSB0_GRVWB8_GSU2_GSUAMBSK_GSUC1_GSUWGMRR1_K1_LBSPPB512_MIWT1_1_NTA0_NLCA8_SU0_SUM0_SUS0_VWB1_WG64_4_1_WGM1_WGMXCC8_WGMXCCGn1
    SolutionIndex: 140
    SolutionNameMin: Cijk_Alik_Bljk_BBS_STA_BH_Bias_HAS_SAV_UserArgs_MT64x32x256_MI16x16x1_SN_LDSB1_GRVWB8_GSU3_GSUAMBSK_GSUC1_GSUWGMRR1_K1_LBSPPB1024_MIWT1_2_NTA0_NLCA8_SU0_SUM0_SUS0_VWB2_WG64_4_1_WGM1_WGMXCC8_WGMXCCGn1
    SolutionIndex: 141
    SolutionNameMin: Cijk_Alik_Bljk_BBS_STA_BH_Bias_HAS_SAV_UserArgs_MT64x32x128_MI16x16x1_SN_LDSB0_GRVWB8_GSU5_GSUAMBSK_GSUC1_GSUWGMRR1_K1_LBSPPB512_MIWT1_2_NTA0_NLCA4_SU0_SUM0_SUS0_VWB2_WG64_4_1_WGM1_WGMXCC8_WGMXCCGn1
    SolutionIndex: 142
    SolutionNameMin: Cijk_Alik_Bljk_BBS_STA_BH_Bias_HAS_SAV_UserArgs_MT64x16x256_MI16x16x1_SN_LDSB0_GRVWB8_GSU1_GSUAMB_GSUC1_GSUWGMRR1_K1_LBSPPB512_MIWT1_1_NTA0_NLCA8_SU0_SUM0_SUS0_VWB1_WG64_4_1_WGM1_WGMXCC8_WGMXCCGn1
    SolutionIndex: 143
    SolutionNameMin: Cijk_Alik_Bljk_BBS_STA_BH_Bias_HAS_SAV_UserArgs_MT128x32x256_MI16x16x1_SN_LDSB1_GRVWB8_GSU1_GSUAMB_GSUC1_GSUWGMRR1_K1_LBSPPB1024_MIWT2_2_NTA0_NLCA8_SU0_SUM0_SUS0_VWB2_WG64_4_1_WGM1_WGMXCC8_WGMXCCGn1
    SolutionIndex: 144
    SolutionNameMin: Cijk_Alik_Bljk_BBS_STA_BH_Bias_HAS_SAV_UserArgs_MT32x16x256_MI16x16x1_SN_LDSB0_GRVWB8_GSU1_GSUAMB_GSUC1_GSUWGMRR1_K1_LBSPPB512_MIWT1_1_NTA4_NLCA8_SU0_SUM0_SUS0_VWB1_WG32_4_1_WGM1_WGMXCC8_WGMXCCGn1
    SolutionIndex: 145
    SolutionNameMin: Cijk_Alik_Bljk_BBS_STA_BH_Bias_HAS_SAV_UserArgs_MT64x32x128_MI16x16x1_SN_LDSB0_GRVWB8_GSU1_GSUAMB_GSUC1_GSUWGMRR1_K1_LBSPPB512_MIWT1_2_NTA0_NLCA4_SU0_SUM0_SUS0_VWB2_WG64_4_1_WGM1_WGMXCC8_WGMXCCGn1
    SolutionIndex: 146
    SolutionNameMin: Cijk_Alik_Bljk_BBS_STA_BH_Bias_HAS_SAV_UserArgs_MT64x80x128_MI16x16x1_SN_LDSB1_GRVWB8_GSU1_GSUAMB_GSUC1_GSUWGMRR1_K1_LBSPPB256_MIWT1_5_NTA0_NLCA4_SU0_SUM0_SUS0_VWB1_WG64_4_1_WGM1_WGMXCC8_WGMXCCGn1
    SolutionIndex: 147
    SolutionNameMin: Cijk_Alik_Bljk_BBS_STA_BH_Bias_HAS_SAV_UserArgs_MT64x16x512_MI16x16x1_SN_LDSB1_GRVWB8_GSU1_GSUC0_GSUWGMRR0_K1_LBSPPB1024_MIWT1_1_NLCA16_SU8_SUM0_SUS1024_VWB1_WG64_4_1_WGM6_WGMXCC8_WGMXCCGn1
    SolutionIndex: 148
    SolutionNameMin: Cijk_Alik_Bljk_BBS_STA_BH_Bias_HAS_SAV_UserArgs_MT64x16x512_MI16x16x1_SN_LDSB1_GRVWB8_GSU1_GSUC0_GSUWGMRR0_K1_LBSPPB1024_MIWT1_1_NLCA16_SU8_SUM0_SUS1024_VWB1_WG64_4_1_WGM8_WGMXCC8_WGMXCCGn1
    SolutionIndex: 149
    SolutionNameMin: Cijk_Alik_Bljk_BBS_STA_BH_Bias_HAS_SAV_UserArgs_MT64x16x256_MI16x16x1_SN_LDSB0_GRVWB8_GSU1_GSUC0_GSUWGMRR0_K1_LBSPPB512_MIWT1_1_NLCA8_SU8_SUM0_SUS512_VWB1_WG64_4_1_WGM8_WGMXCC8_WGMXCCGn1
    SolutionIndex: 150
    SolutionNameMin: Cijk_Alik_Bljk_BBS_STA_BH_Bias_HAS_SAV_UserArgs_MT64x16x256_MI16x16x1_SN_LDSB0_GRVWB8_GSU1_GSUC0_GSUWGMRR0_K1_LBSPPB512_MIWT1_1_NLCA8_SU0_SUM0_SUS0_VWB1_WG64_4_1_WGM6_WGMXCC8_WGMXCCGn1
    SolutionIndex: 151
    SolutionNameMin: Cijk_Alik_Bljk_BBS_STA_BH_Bias_HAS_SAV_UserArgs_MT64x32x256_MI16x16x1_SN_LDSB1_GRVWB8_GSU1_GSUC0_GSUWGMRR0_K1_LBSPPB1024_MIWT2_2_NLCA8_SU8_SUM0_SUS512_VWB2_WG32_4_1_WGM6_WGMXCC8_WGMXCCGn1
    SolutionIndex: 152
    SolutionNameMin: Cijk_Alik_Bljk_BBS_STA_BH_Bias_HAS_SAV_UserArgs_MT64x32x256_MI16x16x1_SN_LDSB1_GRVWB8_GSU1_GSUC0_GSUWGMRR0_K1_LBSPPB1024_MIWT2_2_NLCA8_SU8_SUM0_SUS512_VWB2_WG32_4_1_WGM8_WGMXCC8_WGMXCCGn1
    SolutionIndex: 153
    SolutionNameMin: Cijk_Alik_Bljk_BBS_STA_BH_Bias_HAS_SAV_UserArgs_MT128x32x256_MI16x16x1_SN_LDSB1_GRVWB8_GSU1_GSUC0_GSUWGMRR0_K1_LBSPPB1024_MIWT2_2_NLCA8_SU0_SUM0_SUS0_VWB2_WG64_4_1_WGM1_WGMXCC8_WGMXCCGn1
    SolutionIndex: 154
    SolutionNameMin: Cijk_Alik_Bljk_BBS_STA_BH_Bias_HAS_SAV_UserArgs_MT128x48x128_MI16x16x1_SN_LDSB0_GRVWB8_GSU1_GSUC0_GSUWGMRR0_K1_LBSPPB256_MIWT2_3_NLCA4_SU0_SUM0_SUS0_VWB1_WG64_4_1_WGM1_WGMXCC8_WGMXCCGn1
    SolutionIndex: 155
    SolutionNameMin: Cijk_Alik_Bljk_BBS_STA_BH_Bias_HAS_SAV_UserArgs_MT128x64x128_MI16x16x1_SN_LDSB1_GRVWB8_GSU1_GSUC0_GSUWGMRR0_K1_LBSPPB1024_MIWT2_4_NLCA4_SU8_SUM0_SUS256_VWB4_WG64_4_1_WGM1_WGMXCC8_WGMXCCGn1
    SolutionIndex: 156
    SolutionNameMin: Cijk_Alik_Bljk_BBS_STA_BH_Bias_HAS_SAV_UserArgs_MT128x48x128_MI16x16x1_SN_LDSB0_GRVWB8_GSU1_GSUC0_GSUWGMRR0_K1_LBSPPB256_MIWT2_3_NLCA4_SU8_SUM0_SUS256_VWB1_WG64_4_1_WGM1_WGMXCC8_WGMXCCGn1
    SolutionIndex: 157
    SolutionNameMin: Cijk_Alik_Bljk_BBS_STA_BH_Bias_HAS_SAV_UserArgs_MT128x64x128_MI16x16x1_SN_LDSB1_GRVWB8_GSU1_GSUC0_GSUWGMRR0_K1_LBSPPB1024_MIWT2_4_NLCA4_SU0_SUM0_SUS0_VWB4_WG64_4_1_WGM1_WGMXCC8_WGMXCCGn1
    SolutionIndex: 158
    SolutionNameMin: Cijk_Alik_Bljk_BBS_STA_BH_Bias_HAS_SAV_UserArgs_MT192x48x128_MI16x16x1_SN_LDSB0_GRVWB8_GSU1_GSUC0_GSUWGMRR0_K1_LBSPPB256_MIWT3_3_NLCA4_SU0_SUM0_SUS0_VWB1_WG64_4_1_WGM1_WGMXCC8_WGMXCCGn1
    SolutionIndex: 159
    SolutionNameMin: Cijk_Alik_Bljk_BBS_STA_BH_Bias_HAS_SAV_UserArgs_MT128x80x128_MI16x16x1_SN_LDSB1_GRVWB8_GSU1_GSUC0_GSUWGMRR0_K1_LBSPPB256_MIWT2_5_NLCA4_SU0_SUM0_SUS0_VWB1_WG64_4_1_WGM1_WGMXCC8_WGMXCCGn1
    SolutionIndex: 160
    SolutionNameMin: Cijk_Alik_Bljk_BBS_STA_BH_Bias_HAS_SAV_UserArgs_MT128x96x128_MI16x16x1_SN_LDSB1_GRVWB8_GSU1_GSUC0_GSUWGMRR0_K1_LBSPPB512_MIWT2_6_NLCA4_SU0_SUM0_SUS0_VWB2_WG64_4_1_WGM1_WGMXCC8_WGMXCCGn1
    SolutionIndex: 161
    SolutionNameMin: Cijk_Alik_Bljk_BBS_STA_BH_Bias_HAS_SAV_UserArgs_MT128x112x128_MI16x16x1_SN_LDSB1_GRVWB8_GSU1_GSUC0_GSUWGMRR0_K1_LBSPPB256_MIWT2_7_NLCA4_SU0_SUM0_SUS0_VWB1_WG64_4_1_WGM1_WGMXCC8_WGMXCCGn1
    SolutionIndex: 162
    SolutionNameMin: Cijk_Alik_Bljk_BBS_STA_BH_Bias_HAS_SAV_UserArgs_MT128x128x128_MI16x16x1_SN_LDSB1_GRVWB8_GSU1_GSUC0_GSUWGMRR0_K1_LBSPPB2048_MIWT2_8_NLCA4_SU8_SUM0_SUS256_VWB8_WG64_4_1_WGM1_WGMXCC8_WGMXCCGn1
    SolutionIndex: 163
    SolutionNameMin: Cijk_Alik_Bljk_BBS_STA_BH_Bias_HAS_SAV_UserArgs_MT192x96x128_MI16x16x1_SN_LDSB1_GRVWB8_GSU1_GSUC0_GSUWGMRR0_K1_LBSPPB512_MIWT3_6_NLCA4_SU0_SUM0_SUS0_VWB2_WG64_4_1_WGM1_WGMXCC8_WGMXCCGn1
    SolutionIndex: 164
    SolutionNameMin: Cijk_Alik_Bljk_BBS_STA_BH_Bias_HAS_SAV_UserArgs_MT320x64x64_MI16x16x1_SN_LDSB0_GRVWB8_GSU1_GSUC0_GSUWGMRR0_K1_LBSPPB512_MIWT5_4_NLCA2_SU0_SUM0_SUS0_VWB4_WG64_4_1_WGM1_WGMXCC8_WGMXCCGn1
    SolutionIndex: 165
    SolutionNameMin: Cijk_Alik_Bljk_BBS_STA_BH_Bias_HAS_SAV_UserArgs_MT256x96x64_MI16x16x1_SN_LDSB0_GRVWB8_GSU1_GSUC0_GSUWGMRR0_K1_LBSPPB256_MIWT4_6_NLCA2_SU8_SUM0_SUS128_VWB2_WG64_4_1_WGM1_WGMXCC8_WGMXCCGn1
    SolutionIndex: 166
    SolutionNameMin: Cijk_Alik_Bljk_BBS_STA_BH_Bias_HAS_SAV_UserArgs_MT192x128x64_MI16x16x1_SN_LDSB1_GRVWB8_GSU1_GSUC0_GSUWGMRR0_K1_LBSPPB1024_MIWT3_8_NLCA2_SU0_SUM0_SUS0_VWB8_WG64_4_1_WGM1_WGMXCC8_WGMXCCGn1
    SolutionIndex: 167
    SolutionNameMin: Cijk_Alik_Bljk_BBS_STA_BH_Bias_HAS_SAV_UserArgs_MT448x64x64_MI16x16x1_SN_LDSB0_GRVWB8_GSU1_GSUC0_GSUWGMRR0_K1_LBSPPB512_MIWT7_4_NLCA2_SU0_SUM0_SUS0_VWB4_WG64_4_1_WGM6_WGMXCC8_WGMXCCGn1
    SolutionIndex: 168
    SolutionNameMin: Cijk_Alik_Bljk_BBS_STA_BH_Bias_HAS_SAV_UserArgs_MT448x64x64_MI16x16x1_SN_LDSB0_GRVWB8_GSU1_GSUC0_GSUWGMRR0_K1_LBSPPB512_MIWT7_4_NLCA2_SU0_SUM0_SUS0_VWB4_WG64_4_1_WGM1_WGMXCC8_WGMXCCGn1
    SolutionIndex: 169
    SolutionNameMin: Cijk_Alik_Bljk_BBS_STA_BH_Bias_HAS_SAV_UserArgs_MT448x64x64_MI16x16x1_SN_LDSB0_GRVWB8_GSU1_GSUC0_GSUWGMRR0_K1_LBSPPB512_MIWT7_4_NLCA2_SU8_SUM0_SUS128_VWB4_WG64_4_1_WGM1_WGMXCC8_WGMXCCGn1
    SolutionIndex: 170
    SolutionNameMin: Cijk_Alik_Bljk_BBS_STA_BH_Bias_HAS_SAV_UserArgs_MT320x112x64_MI16x16x1_SN_LDSB0_GRVWB4_GSU1_GSUC0_GSUWGMRR0_K1_LBSPPB128_MIWT5_7_NLCA2_SU0_SUM0_SUS0_VWB1_WG64_4_1_WGM1_WGMXCC8_WGMXCCGn1
    SolutionIndex: 171
    SolutionNameMin: Cijk_Alik_Bljk_BBS_STA_BH_Bias_HAS_SAV_UserArgs_MT32x16x128_MI16x16x1_SN_LDSB0_GRVWB8_GSU1_GSUC0_GSUWGMRR0_K1_LBSPPB256_MIWT1_1_NLCA4_SU8_SUM0_SUS256_VWB1_WG32_4_1_WGM1_WGMXCC8_WGMXCCGn1
    SolutionIndex: 172
    SolutionNameMin: Cijk_Alik_Bljk_BBS_STA_BH_Bias_HAS_SAV_UserArgs_MT16x16x128_MI16x16x1_SN_LDSB0_GRVWB8_GSU1_GSUC0_GSUWGMRR0_K1_LBSPPB256_MIWT1_1_NLCA4_SU0_SUM0_SUS0_VWB1_WG16_4_1_WGM1_WGMXCC8_WGMXCCGn1
    SolutionIndex: 173
    SolutionNameMin: Cijk_Alik_Bljk_BBS_STA_BH_Bias_HAS_SAV_UserArgs_MT64x16x128_MI16x16x1_SN_LDSB0_GRVWB8_GSU1_GSUC0_GSUWGMRR0_K1_LBSPPB256_MIWT1_1_NLCA4_SU0_SUM0_SUS0_VWB1_WG64_4_1_WGM6_WGMXCC8_WGMXCCGn1
    SolutionIndex: 174
    SolutionNameMin: Cijk_Alik_Bljk_BBS_STA_BH_Bias_HAS_SAV_UserArgs_MT32x16x128_MI16x16x1_SN_LDSB0_GRVWB8_GSU1_GSUC0_GSUWGMRR0_K1_LBSPPB256_MIWT1_1_NLCA4_SU0_SUM0_SUS0_VWB1_WG32_4_1_WGM6_WGMXCC8_WGMXCCGn1
    SolutionIndex: 175
    SolutionNameMin: Cijk_Alik_Bljk_BBS_STA_BH_Bias_HAS_SAV_UserArgs_MT128x16x128_MI16x16x1_SN_LDSB0_GRVWB8_GSU1_GSUC0_GSUWGMRR0_K1_LBSPPB256_MIWT2_1_NLCA4_SU0_SUM0_SUS0_VWB1_WG64_4_1_WGM6_WGMXCC8_WGMXCCGn1
    SolutionIndex: 176
    SolutionNameMin: Cijk_Alik_Bljk_BBS_STA_BH_Bias_HAS_SAV_UserArgs_MT64x32x128_MI16x16x1_SN_LDSB0_GRVWB8_GSU1_GSUC0_GSUWGMRR0_K1_LBSPPB512_MIWT1_2_NLCA4_SU0_SUM0_SUS0_VWB2_WG64_4_1_WGM8_WGMXCC8_WGMXCCGn1
    SolutionIndex: 177
    SolutionNameMin: Cijk_Alik_Bljk_BBS_STA_BH_Bias_HAS_SAV_UserArgs_MT128x16x128_MI16x16x1_SN_LDSB0_GRVWB8_GSU1_GSUC0_GSUWGMRR0_K1_LBSPPB256_MIWT2_1_NLCA4_SU0_SUM0_SUS0_VWB1_WG64_4_1_WGM8_WGMXCC8_WGMXCCGn1
    SolutionIndex: 178
    SolutionNameMin: Cijk_Alik_Bljk_BBS_STA_BH_Bias_HAS_SAV_UserArgs_MT128x32x128_MI16x16x1_SN_LDSB0_GRVWB8_GSU1_GSUC0_GSUWGMRR0_K1_LBSPPB512_MIWT2_2_NLCA4_SU0_SUM0_SUS0_VWB2_WG64_4_1_WGM8_WGMXCC8_WGMXCCGn1
    SolutionIndex: 179
    SolutionNameMin: Cijk_Alik_Bljk_BBS_STA_BH_Bias_HAS_SAV_UserArgs_MT64x48x128_MI16x16x1_SN_LDSB0_GRVWB8_GSU1_GSUC0_GSUWGMRR0_K1_LBSPPB256_MIWT1_3_NLCA4_SU0_SUM0_SUS0_VWB1_WG64_4_1_WGM8_WGMXCC8_WGMXCCGn1
    SolutionIndex: 180
    SolutionNameMin: Cijk_Alik_Bljk_BBS_STA_BH_Bias_HAS_SAV_UserArgs_MT128x32x128_MI16x16x1_SN_LDSB0_GRVWB8_GSU1_GSUC0_GSUWGMRR0_K1_LBSPPB512_MIWT2_2_NLCA4_SU0_SUM0_SUS0_VWB2_WG64_4_1_WGM6_WGMXCC8_WGMXCCGn1
    SolutionIndex: 181
    SolutionNameMin: Cijk_Alik_Bljk_BBS_STA_BH_Bias_HAS_SAV_UserArgs_MT128x96x128_MI16x16x1_SN_LDSB1_GRVWB8_GSU1_GSUC0_GSUWGMRR0_K1_LBSPPB512_MIWT2_6_NLCA4_SU8_SUM0_SUS256_VWB2_WG64_4_1_WGM6_WGMXCC8_WGMXCCGn1
    SolutionIndex: 182
    SolutionNameMin: Cijk_Alik_Bljk_BBS_STA_BH_Bias_HAS_SAV_UserArgs_MT128x160x64_MI16x16x1_SN_LDSB1_GRVWB8_GSU1_GSUC0_GSUWGMRR0_K1_LBSPPB256_MIWT2_10_NLCA2_SU8_SUM0_SUS128_VWB2_WG64_4_1_WGM8_WGMXCC8_WGMXCCGn1
    SolutionIndex: 183
    SolutionNameMin: Cijk_Alik_Bljk_BBS_STA_BH_Bias_HAS_SAV_UserArgs_MT128x128x64_MI16x16x1_SN_LDSB1_GRVWB8_GSU1_GSUC0_GSUWGMRR0_K1_LBSPPB1024_MIWT2_8_NLCA2_SU8_SUM0_SUS128_VWB8_WG64_4_1_WGM8_WGMXCC8_WGMXCCGn1
    SolutionIndex: 184
    SolutionNameMin: Cijk_Alik_Bljk_BBS_STA_BH_Bias_HAS_SAV_UserArgs_MT128x64x64_MI16x16x1_SN_LDSB0_GRVWB8_GSU1_GSUC0_GSUWGMRR0_K1_LBSPPB512_MIWT2_4_NLCA2_SU0_SUM0_SUS0_VWB4_WG64_4_1_WGM8_WGMXCC8_WGMXCCGn1
    SolutionIndex: 185
    SolutionNameMin: Cijk_Alik_Bljk_BBS_STA_BH_Bias_HAS_SAV_UserArgs_MT320x64x64_MI16x16x1_SN_LDSB0_GRVWB8_GSU1_GSUC0_GSUWGMRR0_K1_LBSPPB512_MIWT5_4_NLCA2_SU0_SUM0_SUS0_VWB4_WG64_4_1_WGM6_WGMXCC8_WGMXCCGn1
    SolutionIndex: 186
    SolutionNameMin: Cijk_Alik_Bljk_BBS_STA_BH_Bias_HAS_SAV_UserArgs_MT128x96x64_MI16x16x1_SN_LDSB0_GRVWB8_GSU1_GSUC0_GSUWGMRR0_K1_LBSPPB256_MIWT2_6_NLCA2_SU0_SUM0_SUS0_VWB2_WG64_4_1_WGM8_WGMXCC8_WGMXCCGn1
    SolutionIndex: 187
    SolutionNameMin: Cijk_Alik_Bljk_BBS_STA_BH_Bias_HAS_SAV_UserArgs_MT128x96x64_MI16x16x1_SN_LDSB0_GRVWB8_GSU1_GSUC0_GSUWGMRR0_K1_LBSPPB256_MIWT2_6_NLCA2_SU8_SUM0_SUS128_VWB2_WG64_4_1_WGM8_WGMXCC8_WGMXCCGn1
    SolutionIndex: 188
    SolutionNameMin: Cijk_Alik_Bljk_BBS_STA_BH_Bias_HAS_SAV_UserArgs_MT256x64x64_MI16x16x1_SN_LDSB0_GRVWB8_GSU1_GSUC0_GSUWGMRR0_K1_LBSPPB512_MIWT4_4_NLCA2_SU0_SUM0_SUS0_VWB4_WG64_4_1_WGM6_WGMXCC8_WGMXCCGn1
    SolutionIndex: 189
    SolutionNameMin: Cijk_Alik_Bljk_BBS_STA_BH_Bias_HAS_SAV_UserArgs_MT320x96x64_MI16x16x1_SN_LDSB0_GRVWB8_GSU1_GSUC0_GSUWGMRR0_K1_LBSPPB256_MIWT5_6_NLCA2_SU8_SUM0_SUS128_VWB2_WG64_4_1_WGM8_WGMXCC8_WGMXCCGn1
    SolutionIndex: 190
    SolutionNameMin: Cijk_Alik_Bljk_BBS_STA_BH_Bias_HAS_SAV_UserArgs_MT128x128x64_MI16x16x1_SN_LDSB1_GRVWB8_GSU1_GSUC0_GSUWGMRR0_K1_LBSPPB1024_MIWT2_8_NLCA2_SU0_SUM0_SUS0_VWB8_WG64_4_1_WGM8_WGMXCC8_WGMXCCGn1
    SolutionIndex: 191
    SolutionNameMin: Cijk_Alik_Bljk_BBS_STA_BH_Bias_HAS_SAV_UserArgs_MT192x96x64_MI16x16x1_SN_LDSB0_GRVWB8_GSU1_GSUC0_GSUWGMRR0_K1_LBSPPB256_MIWT3_6_NLCA2_SU0_SUM0_SUS0_VWB2_WG64_4_1_WGM8_WGMXCC8_WGMXCCGn1
    SolutionIndex: 192
    SolutionNameMin: Cijk_Alik_Bljk_BBS_STA_BH_Bias_HAS_SAV_UserArgs_MT128x160x64_MI16x16x1_SN_LDSB1_GRVWB8_GSU1_GSUC0_GSUWGMRR0_K1_LBSPPB256_MIWT2_10_NLCA2_SU0_SUM0_SUS0_VWB2_WG64_4_1_WGM8_WGMXCC8_WGMXCCGn1
    SolutionIndex: 193
    SolutionNameMin: Cijk_Alik_Bljk_BBS_STA_BH_Bias_HAS_SAV_UserArgs_MT256x256x64_MI16x16x1_SN_LDSB1_GRVWB8_GSU1_GSUC0_GSUWGMRR0_K1_LBSPPB1024_MIWT4_16_NLCA2_SU0_SUM0_SUS0_VWB8_WG64_4_1_WGM8_WGMXCC8_WGMXCCGn1
    SolutionIndex: 194
    SolutionNameMin: Cijk_Alik_Bljk_BBS_STA_BH_Bias_HAS_SAV_UserArgs_MT128x64x128_MI16x16x1_SN_LDSB1_GRVWB8_GSU1_GSUC0_GSUWGMRR0_K1_LBSPPB1024_MIWT2_4_NLCA4_SU8_SUM0_SUS256_VWB4_WG64_4_1_WGM6_WGMXCC8_WGMXCCGn1
    SolutionIndex: 195
    SolutionNameMin: Cijk_Alik_Bljk_BBS_STA_BH_Bias_HAS_SAV_UserArgs_MT128x64x128_MI16x16x1_SN_LDSB1_GRVWB8_GSU1_GSUC0_GSUWGMRR0_K1_LBSPPB1024_MIWT4_4_NLCA4_SU0_SUM0_SUS0_VWB4_WG32_4_1_WGM1_WGMXCC8_WGMXCCGn1
    SolutionIndex: 196
    SolutionNameMin: Cijk_Alik_Bljk_BBS_STA_BH_Bias_HAS_SAV_UserArgs_MT256x80x128_MI16x16x1_SN_LDSB1_GRVWB8_GSU1_GSUC0_GSUWGMRR0_K1_LBSPPB256_MIWT4_5_NLCA4_SU0_SUM0_SUS0_VWB1_WG64_4_1_WGM1_WGMXCC8_WGMXCCGn1
    SolutionIndex: 197
    SolutionNameMin: Cijk_Alik_Bljk_BBS_STA_BH_Bias_HAS_SAV_UserArgs_MT256x80x64_MI16x16x1_SN_LDSB0_GRVWB4_GSU1_GSUC0_GSUWGMRR0_K1_LBSPPB128_MIWT4_5_NLCA2_SU8_SUM0_SUS128_VWB1_WG64_4_1_WGM1_WGMXCC8_WGMXCCGn1
    SolutionIndex: 198
    SolutionNameMin: Cijk_Alik_Bljk_BBS_STA_BH_Bias_HAS_SAV_UserArgs_MT192x32x128_MI16x16x1_SN_LDSB0_GRVWB8_GSU1_GSUC0_GSUWGMRR0_K1_LBSPPB512_MIWT3_2_NLCA4_SU0_SUM0_SUS0_VWB2_WG64_4_1_WGM6_WGMXCC8_WGMXCCGn1
    SolutionIndex: 199
    SolutionNameMin: Cijk_Alik_Bljk_BBS_STA_BH_Bias_HAS_SAV_UserArgs_MT128x128x64_MI16x16x1_SN_LDSB1_GRVWB8_GSU1_GSUC0_GSUWGMRR0_K1_LBSPPB1024_MIWT2_8_NLCA2_SU0_SUM0_SUS0_VWB8_WG64_4_1_WGM6_WGMXCC8_WGMXCCGn1
    SolutionIndex: 200
    SolutionNameMin: Cijk_Alik_Bljk_BBS_STA_BH_Bias_HAS_SAV_UserArgs_MT192x80x128_MI16x16x1_SN_LDSB1_GRVWB8_GSU1_GSUC0_GSUWGMRR0_K1_LBSPPB256_MIWT3_5_NLCA4_SU8_SUM0_SUS256_VWB1_WG64_4_1_WGM6_WGMXCC8_WGMXCCGn1
    SolutionIndex: 201
    SolutionNameMin: Cijk_Alik_Bljk_BBS_STA_BH_Bias_HAS_SAV_UserArgs_MT192x96x64_MI16x16x1_SN_LDSB0_GRVWB8_GSU1_GSUC0_GSUWGMRR0_K1_LBSPPB256_MIWT3_6_NLCA2_SU8_SUM0_SUS128_VWB2_WG64_4_1_WGM6_WGMXCC8_WGMXCCGn1
    SolutionIndex: 202
    SolutionNameMin: Cijk_Alik_Bljk_BBS_STA_BH_Bias_HAS_SAV_UserArgs_MT256x80x64_MI16x16x1_SN_LDSB0_GRVWB4_GSU1_GSUC0_GSUWGMRR0_K1_LBSPPB128_MIWT4_5_NLCA2_SU0_SUM0_SUS0_VWB1_WG64_4_1_WGM8_WGMXCC8_WGMXCCGn1
    SolutionIndex: 203
    SolutionNameMin: Cijk_Alik_Bljk_BBS_STA_BH_Bias_HAS_SAV_UserArgs_MT320x208x64_MI16x16x1_SN_LDSB1_GRVWB4_GSU1_GSUC0_GSUWGMRR0_K1_LBSPPB128_MIWT5_13_NLCA2_SU0_SUM0_SUS0_VWB1_WG64_4_1_WGM6_WGMXCC8_WGMXCCGn1
- - - [2048, 16, 1, 5120]
    - [18, 14.29]
  - - [2048, 32, 1, 5120]
    - [9, 23.68]
  - - [2048, 48, 1, 5120]
    - [9, 29.07]
  - - [2048, 64, 1, 5120]
    - [7, 35.13]
  - - [2048, 80, 1, 5120]
    - [7, 38.58]
  - - [2048, 96, 1, 5120]
    - [8, 46.44]
  - - [2048, 112, 1, 5120]
    - [7, 48.17]
  - - [2048, 128, 1, 5120]
    - [7, 55.37]
  - - [2048, 144, 1, 5120]
    - [8, 54.07]
  - - [2048, 160, 1, 5120]
    - [8, 60.69]
  - - [4096, 16, 1, 5120]
    - [23, 21.77]
  - - [4096, 32, 1, 5120]
    - [22, 33.07]
  - - [4096, 48, 1, 5120]
    - [7, 38.99]
  - - [4096, 64, 1, 5120]
    - [7, 52.16]
  - - [4096, 80, 1, 5120]
    - [6, 53.0]
  - - [4096, 96, 1, 5120]
    - [6, 62.49]
  - - [4096, 112, 1, 5120]
    - [6, 62.6]
  - - [4096, 128, 1, 5120]
    - [6, 70.68]
  - - [4096, 144, 1, 5120]
    - [0, 79.64]
  - - [4096, 160, 1, 5120]
    - [0, 79.95]
  - - [16384, 16, 1, 5120]
    - [21, 31.69]
  - - [16384, 32, 1, 5120]
    - [11, 58.02]
  - - [16384, 48, 1, 5120]
    - [12, 78.15]
  - - [16384, 64, 1, 5120]
    - [13, 92.87]
  - - [16384, 80, 1, 5120]
    - [14, 102.79]
  - - [16384, 96, 1, 5120]
    - [15, 113.78]
  - - [16384, 112, 1, 5120]
    - [16, 119.49]
  - - [16384, 128, 1, 5120]
    - [17, 123.82]
  - - [16384, 144, 1, 5120]
    - [4, 127.2]
  - - [16384, 160, 1, 5120]
    - [10, 138.42]
  - - [5120, 16, 1, 8192]
    - [23, 27.15]
  - - [5120, 32, 1, 8192]
    - [19, 42.45]
  - - [5120, 48, 1, 8192]
    - [20, 51.82]
  - - [5120, 64, 1, 8192]
    - [8, 62.27]
  - - [5120, 80, 1, 8192]
    - [1, 62.74]
  - - [5120, 96, 1, 8192]
    - [1, 72.65]
  - - [5120, 112, 1, 8192]
    - [0, 73.17]
  - - [5120, 128, 1, 8192]
    - [6, 82.72]
  - - [5120, 144, 1, 8192]
    - [6, 91.79]
  - - [5120, 160, 1, 8192]
    - [5, 92.28]
  - - [5120, 176, 1, 8192]
    - [2, 95.37]
  - - [5120, 192, 1, 8192]
    - [2, 106.18]
  - - [5120, 208, 1, 8192]
    - [3, 104.12]
  - - [5120, 224, 1, 8192]
    - [3, 110.61]
  - - [5120, 240, 1, 8192]
    - [3, 118.76]
  - - [5120, 256, 1, 8192]
    - [2, 124.68]
  - - [2048, 176, 1, 5120]
    - [24, 77.24]
  - - [2048, 192, 1, 5120]
    - [24, 85.44]
  - - [2048, 208, 1, 5120]
    - [25, 85.99]
  - - [2048, 224, 1, 5120]
    - [25, 94.13]
  - - [2048, 240, 1, 5120]
    - [25, 95.44]
  - - [2048, 256, 1, 5120]
    - [25, 103.7]
  - - [2048, 272, 1, 5120]
    - [24, 102.03]
  - - [2048, 288, 1, 5120]
    - [24, 109.0]
  - - [2048, 304, 1, 5120]
    - [26, 98.86]
  - - [2048, 320, 1, 5120]
    - [26, 105.06]
  - - [2048, 336, 1, 5120]
    - [27, 105.62]
  - - [2048, 352, 1, 5120]
    - [26, 111.65]
  - - [2048, 368, 1, 5120]
    - [26, 113.7]
  - - [2048, 384, 1, 5120]
    - [26, 119.66]
  - - [2048, 400, 1, 5120]
    - [28, 118.57]
  - - [2048, 416, 1, 5120]
    - [28, 126.11]
  - - [2048, 432, 1, 5120]
    - [28, 126.75]
  - - [2048, 448, 1, 5120]
    - [28, 128.53]
  - - [2048, 464, 1, 5120]
    - [26, 126.8]
  - - [2048, 480, 1, 5120]
    - [27, 132.13]
  - - [2048, 496, 1, 5120]
    - [28, 134.16]
  - - [2048, 512, 1, 5120]
    - [28, 140.03]
  - - [2048, 544, 1, 5120]
    - [26, 140.89]
  - - [2048, 576, 1, 5120]
    - [26, 145.95]
  - - [2048, 608, 1, 5120]
    - [28, 146.97]
  - - [2048, 640, 1, 5120]
    - [29, 148.87]
  - - [2048, 672, 1, 5120]
    - [29, 154.45]
  - - [2048, 704, 1, 5120]
    - [29, 155.12]
  - - [2048, 736, 1, 5120]
    - [30, 157.67]
  - - [2048, 768, 1, 5120]
    - [29, 167.88]
  - - [2048, 800, 1, 5120]
    - [29, 164.44]
  - - [2048, 832, 1, 5120]
    - [31, 171.28]
  - - [2048, 864, 1, 5120]
    - [30, 177.33]
  - - [2048, 896, 1, 5120]
    - [29, 178.3]
  - - [2048, 928, 1, 5120]
    - [31, 175.69]
  - - [2048, 960, 1, 5120]
    - [31, 182.5]
  - - [2048, 992, 1, 5120]
    - [31, 186.56]
  - - [2048, 1024, 1, 5120]
    - [31, 192.72]
  - - [2048, 1088, 1, 5120]
    - [31, 193.56]
  - - [2048, 1152, 1, 5120]
    - [32, 202.76]
  - - [2048, 1216, 1, 5120]
    - [32, 206.77]
  - - [2048, 1280, 1, 5120]
    - [33, 204.01]
  - - [2048, 1344, 1, 5120]
    - [33, 205.35]
  - - [2048, 1408, 1, 5120]
    - [34, 214.86]
  - - [2048, 1472, 1, 5120]
    - [34, 214.02]
  - - [2048, 1536, 1, 5120]
    - [35, 219.16]
  - - [2048, 1600, 1, 5120]
    - [36, 216.16]
  - - [2048, 1664, 1, 5120]
    - [36, 220.24]
  - - [2048, 1728, 1, 5120]
    - [36, 230.08]
  - - [2048, 1792, 1, 5120]
    - [36, 229.78]
  - - [2048, 1856, 1, 5120]
    - [37, 219.27]
  - - [2048, 1920, 1, 5120]
    - [37, 224.81]
  - - [2048, 1984, 1, 5120]
    - [37, 231.85]
  - - [2048, 2048, 1, 5120]
    - [38, 232.68]
  - - [2048, 2176, 1, 5120]
    - [39, 235.89]
  - - [2048, 2304, 1, 5120]
    - [40, 241.16]
  - - [2048, 2432, 1, 5120]
    - [41, 247.76]
  - - [2048, 2560, 1, 5120]
    - [42, 242.38]
  - - [2048, 2688, 1, 5120]
    - [43, 238.14]
  - - [2048, 2816, 1, 5120]
    - [44, 244.02]
  - - [2048, 2944, 1, 5120]
    - [43, 249.23]
  - - [2048, 3072, 1, 5120]
    - [43, 258.38]
  - - [2048, 3200, 1, 5120]
    - [45, 259.52]
  - - [2048, 3328, 1, 5120]
    - [46, 262.49]
  - - [2048, 3456, 1, 5120]
    - [46, 267.65]
  - - [2048, 3584, 1, 5120]
    - [46, 271.66]
  - - [2048, 3712, 1, 5120]
    - [47, 252.84]
  - - [2048, 3840, 1, 5120]
    - [48, 255.89]
  - - [2048, 3968, 1, 5120]
    - [49, 261.84]
  - - [2048, 4096, 1, 5120]
    - [49, 264.14]
  - - [4096, 176, 1, 5120]
    - [26, 105.51]
  - - [4096, 192, 1, 5120]
    - [28, 116.52]
  - - [4096, 208, 1, 5120]
    - [28, 114.99]
  - - [4096, 224, 1, 5120]
    - [28, 125.06]
  - - [4096, 240, 1, 5120]
    - [28, 126.83]
  - - [4096, 256, 1, 5120]
    - [28, 136.55]
  - - [4096, 272, 1, 5120]
    - [26, 130.5]
  - - [4096, 288, 1, 5120]
    - [26, 139.1]
  - - [4096, 304, 1, 5120]
    - [29, 137.11]
  - - [4096, 320, 1, 5120]
    - [32, 143.25]
  - - [4096, 336, 1, 5120]
    - [50, 150.84]
  - - [4096, 352, 1, 5120]
    - [29, 149.37]
  - - [4096, 368, 1, 5120]
    - [31, 151.39]
  - - [4096, 384, 1, 5120]
    - [29, 160.47]
  - - [4096, 400, 1, 5120]
    - [30, 159.12]
  - - [4096, 416, 1, 5120]
    - [30, 164.05]
  - - [4096, 432, 1, 5120]
    - [30, 169.86]
  - - [4096, 448, 1, 5120]
    - [31, 175.6]
  - - [4096, 464, 1, 5120]
    - [31, 168.85]
  - - [4096, 480, 1, 5120]
    - [33, 174.32]
  - - [4096, 496, 1, 5120]
    - [51, 177.21]
  - - [4096, 512, 1, 5120]
    - [31, 190.41]
  - - [4096, 544, 1, 5120]
    - [32, 186.51]
  - - [4096, 576, 1, 5120]
    - [32, 196.33]
  - - [4096, 608, 1, 5120]
    - [52, 190.6]
  - - [4096, 640, 1, 5120]
    - [52, 201.28]
  - - [4096, 672, 1, 5120]
    - [36, 202.21]
  - - [4096, 704, 1, 5120]
    - [34, 201.51]
  - - [4096, 736, 1, 5120]
    - [36, 204.57]
  - - [4096, 768, 1, 5120]
    - [36, 212.42]
  - - [4096, 800, 1, 5120]
    - [35, 208.47]
  - - [4096, 832, 1, 5120]
    - [35, 216.76]
  - - [4096, 864, 1, 5120]
    - [35, 227.01]
  - - [4096, 896, 1, 5120]
    - [53, 218.24]
  - - [4096, 928, 1, 5120]
    - [37, 211.98]
  - - [4096, 960, 1, 5120]
    - [54, 219.46]
  - - [4096, 992, 1, 5120]
    - [37, 221.43]
  - - [4096, 1024, 1, 5120]
    - [38, 229.24]
  - - [4096, 1088, 1, 5120]
    - [38, 230.49]
  - - [4096, 1152, 1, 5120]
    - [39, 239.97]
  - - [4096, 1216, 1, 5120]
    - [39, 241.02]
  - - [4096, 1280, 1, 5120]
    - [44, 234.75]
  - - [4096, 1344, 1, 5120]
    - [43, 238.35]
  - - [4096, 1408, 1, 5120]
    - [55, 243.1]
  - - [4096, 1472, 1, 5120]
    - [55, 247.63]
  - - [4096, 1536, 1, 5120]
    - [43, 259.0]
  - - [4096, 1600, 1, 5120]
    - [43, 254.32]
  - - [4096, 1664, 1, 5120]
    - [45, 260.5]
  - - [4096, 1728, 1, 5120]
    - [45, 266.96]
  - - [4096, 1792, 1, 5120]
    - [45, 267.61]
  - - [4096, 1856, 1, 5120]
    - [56, 255.08]
  - - [4096, 1920, 1, 5120]
    - [56, 260.03]
  - - [4096, 1984, 1, 5120]
    - [57, 259.66]
  - - [4096, 2048, 1, 5120]
    - [49, 264.66]
  - - [4096, 2176, 1, 5120]
    - [58, 269.5]
  - - [4096, 2304, 1, 5120]
    - [59, 275.63]
  - - [4096, 2432, 1, 5120]
    - [49, 280.34]
  - - [4096, 2560, 1, 5120]
    - [60, 281.19]
  - - [4096, 2688, 1, 5120]
    - [61, 280.55]
  - - [4096, 2816, 1, 5120]
    - [62, 284.42]
  - - [4096, 2944, 1, 5120]
    - [60, 285.36]
  - - [4096, 3072, 1, 5120]
    - [63, 280.57]
  - - [4096, 3200, 1, 5120]
    - [64, 279.92]
  - - [4096, 3328, 1, 5120]
    - [65, 282.58]
  - - [4096, 3456, 1, 5120]
    - [64, 291.58]
  - - [4096, 3584, 1, 5120]
    - [63, 292.37]
  - - [4096, 3712, 1, 5120]
    - [66, 286.32]
  - - [4096, 3840, 1, 5120]
    - [66, 292.28]
  - - [4096, 3968, 1, 5120]
    - [67, 294.43]
  - - [4096, 4096, 1, 5120]
    - [67, 295.87]
  - - [16384, 176, 1, 5120]
    - [68, 165.46]
  - - [16384, 192, 1, 5120]
    - [69, 180.73]
  - - [16384, 208, 1, 5120]
    - [70, 172.99]
  - - [16384, 224, 1, 5120]
    - [53, 186.77]
  - - [16384, 240, 1, 5120]
    - [71, 190.29]
  - - [16384, 256, 1, 5120]
    - [38, 202.72]
  - - [16384, 272, 1, 5120]
    - [42, 196.74]
  - - [16384, 288, 1, 5120]
    - [72, 208.74]
  - - [16384, 304, 1, 5120]
    - [73, 203.11]
  - - [16384, 320, 1, 5120]
    - [55, 213.54]
  - - [16384, 336, 1, 5120]
    - [45, 208.2]
  - - [16384, 352, 1, 5120]
    - [43, 217.61]
  - - [16384, 368, 1, 5120]
    - [45, 223.7]
  - - [16384, 384, 1, 5120]
    - [45, 236.23]
  - - [16384, 400, 1, 5120]
    - [74, 222.1]
  - - [16384, 416, 1, 5120]
    - [75, 219.33]
  - - [16384, 432, 1, 5120]
    - [75, 226.88]
  - - [16384, 448, 1, 5120]
    - [75, 236.4]
  - - [16384, 464, 1, 5120]
    - [56, 234.14]
  - - [16384, 480, 1, 5120]
    - [56, 242.04]
  - - [16384, 496, 1, 5120]
    - [76, 234.8]
  - - [16384, 512, 1, 5120]
    - [49, 246.02]
  - - [16384, 544, 1, 5120]
    - [77, 235.61]
  - - [16384, 576, 1, 5120]
    - [78, 249.37]
  - - [16384, 608, 1, 5120]
    - [62, 251.62]
  - - [16384, 640, 1, 5120]
    - [79, 264.29]
  - - [16384, 672, 1, 5120]
    - [80, 257.85]
  - - [16384, 704, 1, 5120]
    - [65, 258.51]
  - - [16384, 736, 1, 5120]
    - [64, 251.37]
  - - [16384, 768, 1, 5120]
    - [63, 272.03]
  - - [16384, 800, 1, 5120]
    - [81, 268.25]
  - - [16384, 832, 1, 5120]
    - [82, 263.86]
  - - [16384, 864, 1, 5120]
    - [83, 265.87]
  - - [16384, 896, 1, 5120]
    - [84, 275.03]
  - - [16384, 928, 1, 5120]
    - [85, 268.63]
  - - [16384, 960, 1, 5120]
    - [86, 273.6]
  - - [16384, 992, 1, 5120]
    - [87, 270.25]
  - - [16384, 1024, 1, 5120]
    - [88, 283.24]
  - - [16384, 1088, 1, 5120]
    - [89, 285.48]
  - - [16384, 1152, 1, 5120]
    - [90, 287.46]
  - - [16384, 1216, 1, 5120]
    - [91, 281.42]
  - - [16384, 1280, 1, 5120]
    - [62, 274.17]
  - - [16384, 1344, 1, 5120]
    - [43, 280.1]
  - - [16384, 1408, 1, 5120]
    - [61, 279.48]
  - - [16384, 1472, 1, 5120]
    - [80, 272.22]
  - - [16384, 1536, 1, 5120]
    - [80, 279.34]
  - - [16384, 1600, 1, 5120]
    - [81, 276.05]
  - - [16384, 1664, 1, 5120]
    - [63, 279.26]
  - - [16384, 1728, 1, 5120]
    - [63, 292.07]
  - - [16384, 1792, 1, 5120]
    - [84, 288.31]
  - - [16384, 1856, 1, 5120]
    - [82, 279.19]
  - - [16384, 1920, 1, 5120]
    - [83, 284.77]
  - - [16384, 1984, 1, 5120]
    - [83, 293.24]
  - - [16384, 2048, 1, 5120]
    - [88, 294.49]
  - - [16384, 2176, 1, 5120]
    - [89, 299.7]
  - - [16384, 2304, 1, 5120]
    - [90, 300.3]
  - - [16384, 2432, 1, 5120]
    - [92, 307.85]
  - - [16384, 2560, 1, 5120]
    - [81, 298.03]
  - - [16384, 2688, 1, 5120]
    - [64, 305.07]
  - - [16384, 2816, 1, 5120]
    - [60, 295.24]
  - - [16384, 2944, 1, 5120]
    - [61, 301.02]
  - - [16384, 3072, 1, 5120]
    - [88, 305.53]
  - - [16384, 3200, 1, 5120]
    - [89, 307.54]
  - - [16384, 3328, 1, 5120]
    - [89, 313.47]
  - - [16384, 3456, 1, 5120]
    - [90, 307.9]
  - - [16384, 3584, 1, 5120]
    - [92, 311.46]
  - - [16384, 3712, 1, 5120]
    - [93, 299.11]
  - - [16384, 3840, 1, 5120]
    - [94, 299.13]
  - - [16384, 3968, 1, 5120]
    - [83, 305.59]
  - - [16384, 4096, 1, 5120]
    - [83, 308.84]
  - - [5120, 272, 1, 8192]
    - [30, 149.87]
  - - [5120, 288, 1, 8192]
    - [95, 155.7]
  - - [5120, 304, 1, 8192]
    - [29, 157.7]
  - - [5120, 320, 1, 8192]
    - [32, 166.72]
  - - [5120, 336, 1, 8192]
    - [50, 170.28]
  - - [5120, 352, 1, 8192]
    - [32, 169.97]
  - - [5120, 368, 1, 8192]
    - [32, 174.72]
  - - [5120, 384, 1, 8192]
    - [32, 184.14]
  - - [5120, 400, 1, 8192]
    - [33, 185.12]
  - - [5120, 416, 1, 8192]
    - [31, 182.75]
  - - [5120, 432, 1, 8192]
    - [31, 189.83]
  - - [5120, 448, 1, 8192]
    - [31, 197.01]
  - - [5120, 464, 1, 8192]
    - [34, 196.01]
  - - [5120, 480, 1, 8192]
    - [34, 202.71]
  - - [5120, 496, 1, 8192]
    - [96, 195.25]
  - - [5120, 512, 1, 8192]
    - [33, 201.38]
  - - [5120, 544, 1, 8192]
    - [52, 208.38]
  - - [5120, 576, 1, 8192]
    - [35, 207.92]
  - - [5120, 608, 1, 8192]
    - [36, 208.03]
  - - [5120, 640, 1, 8192]
    - [36, 215.8]
  - - [5120, 672, 1, 8192]
    - [36, 222.15]
  - - [5120, 704, 1, 8192]
    - [97, 219.94]
  - - [5120, 736, 1, 8192]
    - [53, 217.7]
  - - [5120, 768, 1, 8192]
    - [53, 225.13]
  - - [5120, 800, 1, 8192]
    - [54, 222.73]
  - - [5120, 832, 1, 8192]
    - [38, 226.65]
  - - [5120, 864, 1, 8192]
    - [54, 229.08]
  - - [5120, 896, 1, 8192]
    - [98, 235.73]
  - - [5120, 928, 1, 8192]
    - [38, 230.16]
  - - [5120, 960, 1, 8192]
    - [38, 236.9]
  - - [5120, 992, 1, 8192]
    - [99, 234.28]
  - - [5120, 1024, 1, 8192]
    - [42, 238.95]
  - - [5120, 1088, 1, 8192]
    - [100, 238.79]
  - - [5120, 1152, 1, 8192]
    - [45, 244.63]
  - - [5120, 1216, 1, 8192]
    - [55, 250.39]
  - - [5120, 1280, 1, 8192]
    - [101, 251.82]
  - - [5120, 1344, 1, 8192]
    - [94, 258.88]
  - - [5120, 1408, 1, 8192]
    - [102, 261.79]
  - - [5120, 1472, 1, 8192]
    - [103, 256.31]
  - - [5120, 1536, 1, 8192]
    - [49, 260.22]
  - - [5120, 1600, 1, 8192]
    - [104, 259.73]
  - - [5120, 1664, 1, 8192]
    - [104, 267.34]
  - - [5120, 1728, 1, 8192]
    - [58, 268.37]
  - - [5120, 1792, 1, 8192]
    - [49, 271.82]
  - - [5120, 1856, 1, 8192]
    - [49, 268.51]
  - - [5120, 1920, 1, 8192]
    - [49, 278.97]
  - - [5120, 1984, 1, 8192]
    - [105, 271.38]
  - - [5120, 2048, 1, 8192]
    - [106, 276.84]
  - - [5120, 2176, 1, 8192]
    - [106, 278.35]
  - - [5120, 2304, 1, 8192]
    - [93, 283.81]
  - - [5120, 2432, 1, 8192]
    - [107, 288.38]
  - - [5120, 2560, 1, 8192]
    - [108, 284.23]
  - - [5120, 2688, 1, 8192]
    - [109, 285.83]
  - - [5120, 2816, 1, 8192]
    - [110, 285.03]
  - - [5120, 2944, 1, 8192]
    - [111, 286.76]
  - - [5120, 3072, 1, 8192]
    - [112, 287.73]
  - - [5120, 3200, 1, 8192]
    - [113, 289.23]
  - - [5120, 3328, 1, 8192]
    - [114, 295.18]
  - - [5120, 3456, 1, 8192]
    - [90, 296.82]
  - - [5120, 3584, 1, 8192]
    - [115, 297.14]
  - - [5120, 3712, 1, 8192]
    - [116, 301.27]
  - - [5120, 3840, 1, 8192]
    - [117, 304.14]
  - - [5120, 3968, 1, 8192]
    - [105, 283.2]
  - - [5120, 4096, 1, 8192]
    - [105, 288.1]
  - - [5120, 16, 1, 2048]
    - [118, 18.01]
  - - [5120, 32, 1, 2048]
    - [119, 31.65]
  - - [5120, 48, 1, 2048]
    - [119, 43.29]
  - - [5120, 64, 1, 2048]
    - [120, 50.27]
  - - [5120, 80, 1, 2048]
    - [121, 58.64]
  - - [5120, 96, 1, 2048]
    - [120, 67.8]
  - - [5120, 112, 1, 2048]
    - [122, 71.3]
  - - [5120, 128, 1, 2048]
    - [28, 80.23]
  - - [5120, 144, 1, 2048]
    - [123, 85.95]
  - - [5120, 160, 1, 2048]
    - [28, 92.72]
  - - [5120, 176, 1, 2048]
    - [28, 93.34]
  - - [5120, 192, 1, 2048]
    - [28, 103.88]
  - - [5120, 208, 1, 2048]
    - [28, 103.82]
  - - [5120, 224, 1, 2048]
    - [28, 113.8]
  - - [5120, 240, 1, 2048]
    - [30, 115.12]
  - - [5120, 256, 1, 2048]
    - [31, 117.0]
  - - [5120, 272, 1, 2048]
    - [29, 118.34]
  - - [5120, 288, 1, 2048]
    - [29, 128.94]
  - - [5120, 304, 1, 2048]
    - [29, 125.6]
  - - [5120, 320, 1, 2048]
    - [31, 132.52]
  - - [5120, 336, 1, 2048]
    - [29, 141.02]
  - - [5120, 352, 1, 2048]
    - [31, 133.61]
  - - [5120, 368, 1, 2048]
    - [31, 137.35]
  - - [5120, 384, 1, 2048]
    - [32, 149.19]
  - - [5120, 400, 1, 2048]
    - [33, 145.64]
  - - [5120, 416, 1, 2048]
    - [31, 146.78]
  - - [5120, 432, 1, 2048]
    - [31, 151.58]
  - - [5120, 448, 1, 2048]
    - [31, 161.89]
  - - [5120, 464, 1, 2048]
    - [34, 153.97]
  - - [5120, 480, 1, 2048]
    - [34, 164.03]
  - - [5120, 496, 1, 2048]
    - [33, 154.59]
  - - [5120, 512, 1, 2048]
    - [33, 158.87]
  - - [5120, 544, 1, 2048]
    - [33, 165.32]
  - - [5120, 576, 1, 2048]
    - [35, 172.07]
  - - [5120, 608, 1, 2048]
    - [69, 165.36]
  - - [5120, 640, 1, 2048]
    - [36, 171.22]
  - - [5120, 672, 1, 2048]
    - [36, 181.79]
  - - [5120, 704, 1, 2048]
    - [97, 179.86]
  - - [5120, 736, 1, 2048]
    - [53, 177.18]
  - - [5120, 768, 1, 2048]
    - [124, 182.51]
  - - [5120, 800, 1, 2048]
    - [71, 181.06]
  - - [5120, 832, 1, 2048]
    - [38, 190.82]
  - - [5120, 864, 1, 2048]
    - [125, 188.24]
  - - [5120, 896, 1, 2048]
    - [126, 195.42]
  - - [5120, 928, 1, 2048]
    - [38, 189.68]
  - - [5120, 960, 1, 2048]
    - [126, 199.31]
  - - [5120, 992, 1, 2048]
    - [72, 190.69]
  - - [5120, 1024, 1, 2048]
    - [55, 199.31]
  - - [5120, 1088, 1, 2048]
    - [55, 199.61]
  - - [5120, 1152, 1, 2048]
    - [55, 206.28]
  - - [5120, 1216, 1, 2048]
    - [55, 211.87]
  - - [5120, 1280, 1, 2048]
    - [74, 208.82]
  - - [5120, 1344, 1, 2048]
    - [43, 221.93]
  - - [5120, 1408, 1, 2048]
    - [127, 217.63]
  - - [5120, 1472, 1, 2048]
    - [103, 219.42]
  - - [5120, 1536, 1, 2048]
    - [56, 219.5]
  - - [5120, 1600, 1, 2048]
    - [128, 219.04]
  - - [5120, 1664, 1, 2048]
    - [49, 226.71]
  - - [5120, 1728, 1, 2048]
    - [58, 233.8]
  - - [5120, 1792, 1, 2048]
    - [49, 233.59]
  - - [5120, 1856, 1, 2048]
    - [129, 230.04]
  - - [5120, 1920, 1, 2048]
    - [49, 240.15]
  - - [5120, 1984, 1, 2048]
    - [105, 232.64]
  - - [5120, 2048, 1, 2048]
    - [107, 235.77]
  - - [5120, 2176, 1, 2048]
    - [107, 240.66]
  - - [5120, 2304, 1, 2048]
    - [107, 247.71]
  - - [5120, 2432, 1, 2048]
    - [93, 251.93]
  - - [5120, 2560, 1, 2048]
    - [81, 243.02]
  - - [5120, 2688, 1, 2048]
    - [64, 251.07]
  - - [5120, 2816, 1, 2048]
    - [114, 246.11]
  - - [5120, 2944, 1, 2048]
    - [111, 248.75]
  - - [5120, 3072, 1, 2048]
    - [130, 250.42]
  - - [5120, 3200, 1, 2048]
    - [90, 245.83]
  - - [5120, 3328, 1, 2048]
    - [114, 255.94]
  - - [5120, 3456, 1, 2048]
    - [115, 263.47]
  - - [5120, 3584, 1, 2048]
    - [90, 257.11]
  - - [5120, 3712, 1, 2048]
    - [92, 261.59]
  - - [5120, 3840, 1, 2048]
    - [131, 264.81]
  - - [5120, 3968, 1, 2048]
    - [45, 251.65]
  - - [5120, 4096, 1, 2048]
    - [132, 255.37]
  - - [896, 16, 1, 5120]
    - [133, 7.35]
  - - [896, 32, 1, 5120]
    - [134, 13.78]
  - - [896, 48, 1, 5120]
    - [135, 19.07]
  - - [896, 64, 1, 5120]
    - [136, 24.81]
  - - [896, 80, 1, 5120]
    - [137, 29.58]
  - - [896, 96, 1, 5120]
    - [138, 31.0]
  - - [896, 112, 1, 5120]
    - [138, 34.82]
  - - [896, 128, 1, 5120]
    - [139, 37.6]
  - - [896, 144, 1, 5120]
    - [139, 40.39]
  - - [896, 160, 1, 5120]
    - [139, 44.74]
  - - [1024, 16, 1, 5120]
    - [133, 8.35]
  - - [1024, 32, 1, 5120]
    - [134, 15.87]
  - - [1024, 48, 1, 5120]
    - [137, 21.61]
  - - [1024, 64, 1, 5120]
    - [137, 27.27]
  - - [1024, 80, 1, 5120]
    - [138, 29.5]
  - - [1024, 96, 1, 5120]
    - [138, 33.6]
  - - [1024, 112, 1, 5120]
    - [139, 36.7]
  - - [1024, 128, 1, 5120]
    - [139, 40.98]
  - - [1024, 144, 1, 5120]
    - [139, 45.67]
  - - [1024, 160, 1, 5120]
    - [140, 45.35]
  - - [1024, 176, 1, 5120]
    - [140, 48.35]
  - - [1024, 192, 1, 5120]
    - [140, 52.32]
  - - [1024, 208, 1, 5120]
    - [141, 52.94]
  - - [1024, 224, 1, 5120]
    - [141, 56.51]
  - - [1024, 240, 1, 5120]
    - [142, 59.23]
  - - [1024, 256, 1, 5120]
    - [142, 62.69]
  - - [1024, 272, 1, 5120]
    - [142, 64.64]
  - - [1024, 288, 1, 5120]
    - [142, 67.92]
  - - [1024, 304, 1, 5120]
    - [142, 70.49]
  - - [1024, 320, 1, 5120]
    - [8, 69.55]
  - - [1024, 336, 1, 5120]
    - [8, 71.12]
  - - [1024, 352, 1, 5120]
    - [8, 75.15]
  - - [1024, 368, 1, 5120]
    - [8, 77.02]
  - - [1024, 384, 1, 5120]
    - [8, 81.19]
  - - [1024, 400, 1, 5120]
    - [8, 81.31]
  - - [1024, 416, 1, 5120]
    - [8, 85.25]
  - - [1024, 432, 1, 5120]
    - [8, 86.06]
  - - [1024, 448, 1, 5120]
    - [8, 89.97]
  - - [1024, 464, 1, 5120]
    - [8, 90.81]
  - - [1024, 480, 1, 5120]
    - [8, 93.94]
  - - [1024, 496, 1, 5120]
    - [8, 94.34]
  - - [1024, 512, 1, 5120]
    - [8, 97.86]
  - - [1024, 544, 1, 5120]
    - [8, 102.13]
  - - [1024, 576, 1, 5120]
    - [8, 105.68]
  - - [1024, 608, 1, 5120]
    - [8, 109.51]
  - - [1024, 640, 1, 5120]
    - [143, 104.53]
  - - [1024, 672, 1, 5120]
    - [143, 107.08]
  - - [1024, 704, 1, 5120]
    - [143, 112.03]
  - - [1024, 736, 1, 5120]
    - [143, 116.4]
  - - [1024, 768, 1, 5120]
    - [143, 119.26]
  - - [1024, 800, 1, 5120]
    - [143, 121.61]
  - - [1024, 832, 1, 5120]
    - [143, 125.02]
  - - [1024, 864, 1, 5120]
    - [143, 128.96]
  - - [1024, 896, 1, 5120]
    - [143, 131.72]
  - - [1024, 928, 1, 5120]
    - [143, 131.8]
  - - [1024, 960, 1, 5120]
    - [143, 136.0]
  - - [1024, 992, 1, 5120]
    - [143, 138.0]
  - - [1024, 1024, 1, 5120]
    - [143, 140.17]
  - - [5120, 16, 1, 1024]
    - [144, 13.26]
  - - [5120, 32, 1, 1024]
    - [22, 22.32]
  - - [5120, 48, 1, 1024]
    - [12, 27.23]
  - - [5120, 64, 1, 1024]
    - [145, 36.38]
  - - [5120, 80, 1, 1024]
    - [0, 40.85]
  - - [5120, 96, 1, 1024]
    - [0, 50.45]
  - - [5120, 112, 1, 1024]
    - [0, 46.57]
  - - [5120, 128, 1, 1024]
    - [0, 52.98]
  - - [5120, 144, 1, 1024]
    - [0, 60.35]
  - - [5120, 160, 1, 1024]
    - [146, 63.57]
  - - [896, 176, 1, 5120]
    - [147, 50.71]
  - - [896, 192, 1, 5120]
    - [147, 53.98]
  - - [896, 208, 1, 5120]
    - [148, 56.25]
  - - [896, 224, 1, 5120]
    - [148, 59.1]
  - - [896, 240, 1, 5120]
    - [119, 61.59]
  - - [896, 256, 1, 5120]
    - [149, 65.28]
  - - [896, 272, 1, 5120]
    - [150, 66.07]
  - - [896, 288, 1, 5120]
    - [150, 68.52]
  - - [896, 304, 1, 5120]
    - [149, 71.01]
  - - [896, 320, 1, 5120]
    - [119, 73.22]
  - - [896, 336, 1, 5120]
    - [119, 75.99]
  - - [896, 352, 1, 5120]
    - [24, 73.62]
  - - [896, 368, 1, 5120]
    - [151, 77.07]
  - - [896, 384, 1, 5120]
    - [24, 79.98]
  - - [896, 400, 1, 5120]
    - [151, 80.43]
  - - [896, 416, 1, 5120]
    - [25, 83.81]
  - - [896, 432, 1, 5120]
    - [152, 84.05]
  - - [896, 448, 1, 5120]
    - [25, 87.46]
  - - [896, 464, 1, 5120]
    - [25, 87.41]
  - - [896, 480, 1, 5120]
    - [152, 91.59]
  - - [896, 496, 1, 5120]
    - [25, 92.15]
  - - [896, 512, 1, 5120]
    - [25, 96.31]
  - - [896, 544, 1, 5120]
    - [24, 97.78]
  - - [896, 576, 1, 5120]
    - [24, 101.28]
  - - [896, 608, 1, 5120]
    - [25, 105.96]
  - - [896, 640, 1, 5120]
    - [25, 108.25]
  - - [896, 672, 1, 5120]
    - [24, 111.59]
  - - [896, 704, 1, 5120]
    - [25, 102.7]
  - - [896, 736, 1, 5120]
    - [27, 104.98]
  - - [896, 768, 1, 5120]
    - [26, 108.33]
  - - [896, 800, 1, 5120]
    - [26, 111.46]
  - - [896, 832, 1, 5120]
    - [28, 113.41]
  - - [896, 864, 1, 5120]
    - [28, 116.68]
  - - [896, 896, 1, 5120]
    - [28, 120.7]
  - - [896, 928, 1, 5120]
    - [153, 122.43]
  - - [896, 960, 1, 5120]
    - [26, 125.0]
  - - [896, 992, 1, 5120]
    - [153, 126.56]
  - - [896, 1024, 1, 5120]
    - [28, 131.28]
  - - [896, 1088, 1, 5120]
    - [153, 135.01]
  - - [896, 1152, 1, 5120]
    - [28, 133.59]
  - - [896, 1216, 1, 5120]
    - [153, 138.71]
  - - [896, 1280, 1, 5120]
    - [28, 143.17]
  - - [896, 1344, 1, 5120]
    - [153, 145.36]
  - - [896, 1408, 1, 5120]
    - [29, 143.48]
  - - [896, 1472, 1, 5120]
    - [154, 147.1]
  - - [896, 1536, 1, 5120]
    - [50, 153.67]
  - - [896, 1600, 1, 5120]
    - [155, 153.27]
  - - [896, 1664, 1, 5120]
    - [156, 155.23]
  - - [896, 1728, 1, 5120]
    - [154, 159.87]
  - - [896, 1792, 1, 5120]
    - [32, 162.35]
  - - [896, 1856, 1, 5120]
    - [157, 167.22]
  - - [896, 1920, 1, 5120]
    - [154, 172.31]
  - - [896, 1984, 1, 5120]
    - [31, 172.48]
  - - [896, 2048, 1, 5120]
    - [32, 175.15]
  - - [896, 2176, 1, 5120]
    - [155, 178.76]
  - - [896, 2304, 1, 5120]
    - [157, 183.94]
  - - [896, 2432, 1, 5120]
    - [157, 191.21]
  - - [896, 2560, 1, 5120]
    - [157, 197.41]
  - - [896, 2688, 1, 5120]
    - [31, 197.75]
  - - [896, 2816, 1, 5120]
    - [158, 190.75]
  - - [896, 2944, 1, 5120]
    - [159, 198.46]
  - - [896, 3072, 1, 5120]
    - [160, 205.74]
  - - [896, 3200, 1, 5120]
    - [33, 206.81]
  - - [896, 3328, 1, 5120]
    - [159, 210.93]
  - - [896, 3456, 1, 5120]
    - [35, 207.06]
  - - [896, 3584, 1, 5120]
    - [160, 213.95]
  - - [896, 3712, 1, 5120]
    - [160, 216.51]
  - - [896, 3840, 1, 5120]
    - [160, 224.21]
  - - [896, 3968, 1, 5120]
    - [35, 223.55]
  - - [896, 4096, 1, 5120]
    - [160, 228.13]
  - - [896, 4352, 1, 5120]
    - [161, 220.98]
  - - [896, 4608, 1, 5120]
    - [161, 225.85]
  - - [896, 4864, 1, 5120]
    - [40, 225.09]
  - - [896, 5120, 1, 5120]
    - [162, 233.28]
  - - [896, 5376, 1, 5120]
    - [40, 236.16]
  - - [896, 5632, 1, 5120]
    - [163, 233.75]
  - - [896, 5888, 1, 5120]
    - [164, 228.42]
  - - [896, 6144, 1, 5120]
    - [164, 232.78]
  - - [896, 6400, 1, 5120]
    - [164, 238.66]
  - - [896, 6656, 1, 5120]
    - [46, 232.15]
  - - [896, 6912, 1, 5120]
    - [165, 234.01]
  - - [896, 7168, 1, 5120]
    - [46, 240.86]
  - - [896, 7424, 1, 5120]
    - [166, 241.24]
  - - [896, 7680, 1, 5120]
    - [167, 244.86]
  - - [896, 7936, 1, 5120]
    - [168, 250.52]
  - - [896, 8192, 1, 5120]
    - [76, 249.66]
  - - [896, 8448, 1, 5120]
    - [168, 251.4]
  - - [896, 8704, 1, 5120]
    - [168, 254.19]
  - - [896, 8960, 1, 5120]
    - [168, 255.93]
  - - [896, 9216, 1, 5120]
    - [169, 260.55]
  - - [896, 9728, 1, 5120]
    - [167, 263.27]
  - - [896, 9984, 1, 5120]
    - [170, 242.97]
  - - [5120, 16, 1, 640]
    - [171, 8.46]
  - - [5120, 32, 1, 640]
    - [172, 16.36]
  - - [5120, 48, 1, 640]
    - [173, 24.0]
  - - [5120, 64, 1, 640]
    - [174, 30.44]
  - - [5120, 80, 1, 640]
    - [175, 36.42]
  - - [5120, 96, 1, 640]
    - [176, 44.09]
  - - [5120, 112, 1, 640]
    - [177, 47.13]
  - - [5120, 128, 1, 640]
    - [178, 50.69]
  - - [5120, 144, 1, 640]
    - [179, 56.6]
  - - [5120, 160, 1, 640]
    - [178, 61.36]
  - - [5120, 176, 1, 640]
    - [176, 59.81]
  - - [5120, 192, 1, 640]
    - [180, 68.33]
  - - [5120, 208, 1, 640]
    - [176, 67.28]
  - - [5120, 224, 1, 640]
    - [178, 75.47]
  - - [5120, 240, 1, 640]
    - [29, 76.5]
  - - [5120, 256, 1, 640]
    - [32, 77.07]
  - - [5120, 272, 1, 640]
    - [179, 78.36]
  - - [5120, 288, 1, 640]
    - [30, 86.53]
  - - [5120, 304, 1, 640]
    - [179, 83.77]
  - - [5120, 320, 1, 640]
    - [31, 89.31]
  - - [5120, 336, 1, 640]
    - [29, 96.44]
  - - [5120, 352, 1, 640]
    - [178, 91.98]
  - - [5120, 368, 1, 640]
    - [178, 90.69]
  - - [5120, 384, 1, 640]
    - [32, 100.92]
  - - [5120, 400, 1, 640]
    - [33, 99.44]
  - - [5120, 416, 1, 640]
    - [178, 102.33]
  - - [5120, 432, 1, 640]
    - [178, 100.1]
  - - [5120, 448, 1, 640]
    - [31, 111.33]
  - - [5120, 464, 1, 640]
    - [178, 103.1]
  - - [5120, 480, 1, 640]
    - [34, 111.71]
  - - [5120, 496, 1, 640]
    - [52, 104.68]
  - - [5120, 512, 1, 640]
    - [52, 106.72]
  - - [5120, 544, 1, 640]
    - [52, 112.8]
  - - [5120, 576, 1, 640]
    - [181, 122.88]
  - - [5120, 608, 1, 640]
    - [29, 112.59]
  - - [5120, 640, 1, 640]
    - [69, 118.02]
  - - [5120, 672, 1, 640]
    - [69, 129.76]
  - - [5120, 704, 1, 640]
    - [32, 123.51]
  - - [5120, 736, 1, 640]
    - [70, 120.47]
  - - [5120, 768, 1, 640]
    - [32, 131.78]
  - - [5120, 800, 1, 640]
    - [182, 125.58]
  - - [5120, 832, 1, 640]
    - [31, 138.01]
  - - [5120, 864, 1, 640]
    - [124, 136.29]
  - - [5120, 896, 1, 640]
    - [183, 145.71]
  - - [5120, 928, 1, 640]
    - [184, 143.2]
  - - [5120, 960, 1, 640]
    - [184, 149.93]
  - - [5120, 992, 1, 640]
    - [33, 133.38]
  - - [5120, 1024, 1, 640]
    - [55, 143.4]
  - - [5120, 1088, 1, 640]
    - [185, 141.76]
  - - [5120, 1152, 1, 640]
    - [185, 150.85]
  - - [5120, 1216, 1, 640]
    - [55, 153.59]
  - - [5120, 1280, 1, 640]
    - [103, 149.08]
  - - [5120, 1344, 1, 640]
    - [186, 161.5]
  - - [5120, 1408, 1, 640]
    - [187, 154.79]
  - - [5120, 1472, 1, 640]
    - [188, 153.38]
  - - [5120, 1536, 1, 640]
    - [189, 161.91]
  - - [5120, 1600, 1, 640]
    - [126, 159.85]
  - - [5120, 1664, 1, 640]
    - [183, 168.27]
  - - [5120, 1728, 1, 640]
    - [56, 169.69]
  - - [5120, 1792, 1, 640]
    - [190, 177.14]
  - - [5120, 1856, 1, 640]
    - [126, 175.08]
  - - [5120, 1920, 1, 640]
    - [183, 181.44]
  - - [5120, 1984, 1, 640]
    - [191, 165.88]
  - - [5120, 2048, 1, 640]
    - [93, 171.93]
  - - [5120, 2176, 1, 640]
    - [185, 174.45]
  - - [5120, 2304, 1, 640]
    - [185, 179.84]
  - - [5120, 2432, 1, 640]
    - [107, 184.35]
  - - [5120, 2560, 1, 640]
    - [111, 178.53]
  - - [5120, 2688, 1, 640]
    - [43, 192.1]
  - - [5120, 2816, 1, 640]
    - [190, 183.99]
  - - [5120, 2944, 1, 640]
    - [74, 175.5]
  - - [5120, 3072, 1, 640]
    - [115, 182.0]
  - - [5120, 3200, 1, 640]
    - [192, 180.68]
  - - [5120, 3328, 1, 640]
    - [185, 184.47]
  - - [5120, 3456, 1, 640]
    - [130, 189.57]
  - - [5120, 3584, 1, 640]
    - [193, 190.27]
  - - [5120, 3712, 1, 640]
    - [183, 190.8]
  - - [5120, 3840, 1, 640]
    - [131, 197.33]
  - - [5120, 3968, 1, 640]
    - [132, 187.15]
  - - [5120, 4096, 1, 640]
    - [43, 190.29]
  - - [5120, 4352, 1, 640]
    - [190, 188.14]
  - - [5120, 4608, 1, 640]
    - [185, 194.31]
  - - [5120, 4864, 1, 640]
    - [185, 200.65]
  - - [5120, 5120, 1, 640]
    - [43, 195.17]
  - - [5120, 5376, 1, 640]
    - [43, 205.15]
  - - [5120, 5632, 1, 640]
    - [43, 203.28]
  - - [5120, 5888, 1, 640]
    - [74, 202.31]
  - - [5120, 6144, 1, 640]
    - [43, 202.87]
  - - [5120, 6400, 1, 640]
    - [183, 203.58]
  - - [5120, 6656, 1, 640]
    - [102, 206.34]
  - - [5120, 6912, 1, 640]
    - [43, 216.7]
  - - [5120, 7168, 1, 640]
    - [43, 215.72]
  - - [5120, 7424, 1, 640]
    - [190, 206.43]
  - - [5120, 7680, 1, 640]
    - [190, 209.88]
  - - [5120, 7936, 1, 640]
    - [43, 208.81]
  - - [5120, 8192, 1, 640]
    - [43, 214.01]
  - - [5120, 8448, 1, 640]
    - [43, 219.65]
  - - [5120, 8704, 1, 640]
    - [94, 216.69]
  - - [5120, 8960, 1, 640]
    - [103, 210.33]
  - - [5120, 9216, 1, 640]
    - [94, 216.29]
  - - [5120, 9728, 1, 640]
    - [43, 217.69]
  - - [5120, 9984, 1, 640]
    - [94, 221.57]
  - - [1024, 1088, 1, 5120]
    - [28, 140.38]
  - - [1024, 1152, 1, 5120]
    - [26, 144.31]
  - - [1024, 1216, 1, 5120]
    - [28, 147.82]
  - - [1024, 1280, 1, 5120]
    - [29, 146.83]
  - - [1024, 1344, 1, 5120]
    - [29, 151.92]
  - - [1024, 1408, 1, 5120]
    - [31, 154.21]
  - - [1024, 1472, 1, 5120]
    - [51, 157.12]
  - - [1024, 1536, 1, 5120]
    - [29, 166.1]
  - - [1024, 1600, 1, 5120]
    - [194, 165.08]
  - - [1024, 1664, 1, 5120]
    - [157, 168.65]
  - - [1024, 1728, 1, 5120]
    - [30, 174.75]
  - - [1024, 1792, 1, 5120]
    - [30, 175.58]
  - - [1024, 1856, 1, 5120]
    - [157, 174.72]
  - - [1024, 1920, 1, 5120]
    - [31, 177.78]
  - - [1024, 1984, 1, 5120]
    - [155, 179.98]
  - - [1024, 2048, 1, 5120]
    - [31, 191.23]
  - - [1024, 2176, 1, 5120]
    - [157, 193.42]
  - - [1024, 2304, 1, 5120]
    - [32, 198.46]
  - - [1024, 2432, 1, 5120]
    - [157, 205.49]
  - - [1024, 2560, 1, 5120]
    - [159, 200.88]
  - - [1024, 2688, 1, 5120]
    - [33, 206.22]
  - - [1024, 2816, 1, 5120]
    - [33, 211.75]
  - - [1024, 2944, 1, 5120]
    - [52, 216.69]
  - - [1024, 3072, 1, 5120]
    - [36, 213.68]
  - - [1024, 3200, 1, 5120]
    - [160, 218.06]
  - - [1024, 3328, 1, 5120]
    - [160, 219.64]
  - - [1024, 3456, 1, 5120]
    - [160, 227.4]
  - - [1024, 3584, 1, 5120]
    - [160, 230.91]
  - - [1024, 3712, 1, 5120]
    - [161, 221.22]
  - - [1024, 3840, 1, 5120]
    - [161, 222.33]
  - - [1024, 3968, 1, 5120]
    - [41, 226.35]
  - - [1024, 4096, 1, 5120]
    - [161, 228.91]
  - - [1024, 4352, 1, 5120]
    - [41, 234.83]
  - - [1024, 4608, 1, 5120]
    - [41, 240.75]
  - - [1024, 4864, 1, 5120]
    - [195, 243.91]
  - - [1024, 5120, 1, 5120]
    - [196, 235.13]
  - - [1024, 5376, 1, 5120]
    - [196, 235.42]
  - - [1024, 5632, 1, 5120]
    - [197, 238.62]
  - - [5120, 176, 1, 1024]
    - [26, 73.45]
  - - [5120, 192, 1, 1024]
    - [26, 83.1]
  - - [5120, 208, 1, 1024]
    - [28, 82.11]
  - - [5120, 224, 1, 1024]
    - [28, 91.99]
  - - [5120, 240, 1, 1024]
    - [95, 93.84]
  - - [5120, 256, 1, 1024]
    - [51, 95.08]
  - - [5120, 272, 1, 1024]
    - [29, 95.9]
  - - [5120, 288, 1, 1024]
    - [29, 105.49]
  - - [5120, 304, 1, 1024]
    - [29, 102.73]
  - - [5120, 320, 1, 1024]
    - [32, 107.71]
  - - [5120, 336, 1, 1024]
    - [29, 116.32]
  - - [5120, 352, 1, 1024]
    - [198, 106.5]
  - - [5120, 368, 1, 1024]
    - [31, 109.02]
  - - [5120, 384, 1, 1024]
    - [31, 121.15]
  - - [5120, 400, 1, 1024]
    - [34, 119.09]
  - - [5120, 416, 1, 1024]
    - [31, 115.63]
  - - [5120, 432, 1, 1024]
    - [31, 120.3]
  - - [5120, 448, 1, 1024]
    - [31, 130.22]
  - - [5120, 464, 1, 1024]
    - [33, 122.57]
  - - [5120, 480, 1, 1024]
    - [33, 133.0]
  - - [5120, 496, 1, 1024]
    - [33, 125.88]
  - - [5120, 512, 1, 1024]
    - [33, 129.35]
  - - [5120, 544, 1, 1024]
    - [33, 136.02]
  - - [5120, 576, 1, 1024]
    - [36, 139.87]
  - - [5120, 608, 1, 1024]
    - [69, 133.36]
  - - [5120, 640, 1, 1024]
    - [69, 138.43]
  - - [5120, 672, 1, 1024]
    - [36, 151.76]
  - - [5120, 704, 1, 1024]
    - [97, 145.76]
  - - [5120, 736, 1, 1024]
    - [70, 144.66]
  - - [5120, 768, 1, 1024]
    - [199, 151.91]
  - - [5120, 800, 1, 1024]
    - [200, 147.14]
  - - [5120, 832, 1, 1024]
    - [51, 155.27]
  - - [5120, 864, 1, 1024]
    - [125, 158.32]
  - - [5120, 896, 1, 1024]
    - [98, 165.9]
  - - [5120, 928, 1, 1024]
    - [184, 158.76]
  - - [5120, 960, 1, 1024]
    - [38, 168.15]
  - - [5120, 992, 1, 1024]
    - [201, 156.5]
  - - [5120, 1024, 1, 1024]
    - [55, 163.69]
  - - [5120, 1088, 1, 1024]
    - [55, 170.39]
  - - [5120, 1152, 1, 1024]
    - [185, 177.82]
  - - [5120, 1216, 1, 1024]
    - [55, 182.81]
  - - [5120, 1280, 1, 1024]
    - [103, 180.67]
  - - [5120, 1344, 1, 1024]
    - [36, 183.32]
  - - [5120, 1408, 1, 1024]
    - [187, 180.68]
  - - [5120, 1472, 1, 1024]
    - [74, 180.38]
  - - [5120, 1536, 1, 1024]
    - [59, 187.84]
  - - [5120, 1600, 1, 1024]
    - [33, 188.34]
  - - [5120, 1664, 1, 1024]
    - [49, 193.7]
  - - [5120, 1728, 1, 1024]
    - [58, 201.96]
  - - [5120, 1792, 1, 1024]
    - [59, 202.07]
  - - [5120, 1856, 1, 1024]
    - [126, 198.45]
  - - [5120, 1920, 1, 1024]
    - [49, 207.53]
  - - [5120, 1984, 1, 1024]
    - [55, 194.08]
  - - [5120, 2048, 1, 1024]
    - [107, 200.99]
  - - [5120, 2176, 1, 1024]
    - [107, 206.79]
  - - [5120, 2304, 1, 1024]
    - [107, 213.91]
  - - [5120, 2432, 1, 1024]
    - [93, 219.1]
  - - [5120, 2560, 1, 1024]
    - [111, 211.97]
  - - [5120, 2688, 1, 1024]
    - [43, 218.84]
  - - [5120, 2816, 1, 1024]
    - [114, 216.89]
  - - [5120, 2944, 1, 1024]
    - [103, 213.15]
  - - [5120, 3072, 1, 1024]
    - [130, 215.87]
  - - [5120, 3200, 1, 1024]
    - [202, 218.45]
  - - [5120, 3328, 1, 1024]
    - [203, 221.09]
  - - [5120, 3456, 1, 1024]
    - [130, 228.71]
  - - [5120, 3584, 1, 1024]
    - [131, 230.96]
  - - [5120, 3712, 1, 1024]
    - [90, 228.71]
  - - [5120, 3840, 1, 1024]
    - [117, 234.55]
  - - [5120, 3968, 1, 1024]
    - [45, 224.17]
  - - [5120, 4096, 1, 1024]
    - [132, 228.08]
  - - [5120, 4352, 1, 1024]
    - [74, 228.0]
  - - [5120, 4608, 1, 1024]
    - [185, 229.03]
  - - [5120, 4864, 1, 1024]
    - [93, 230.44]
  - - [5120, 5120, 1, 1024]
    - [132, 227.51]
  - - [5120, 5376, 1, 1024]
    - [94, 233.98]
  - - [5120, 5632, 1, 1024]
    - [132, 234.97]
- null
- null
- DeviceEfficiency
- GridBased
