projects/hipblaslt/library/src/amd_detail/rocblaslt/src/Tensile/Logic/asm_full/aquavanjaram/gfx942/GridBased/aquavanjaram_Cijk_Alik_Bljk_F8NBS_STA_BH_BiasSB_HAS_SABV_SAV_UserArgs.yaml
- {MinimumRequiredVersion: 4.33.0}
- aquavanjaram
- gfx942
- [Device 0049, Device 0050]
    SolutionIndex: 0
    SolutionNameMin: Cijk_Alik_Bljk_F8NBS_STA_BH_BiasSB_HAS_SABV_SAV_UserArgs_MT64x48x256_MI16x16x1_SN_LDSB0_GRVWB16_GSU1_GSUAMB_GSUC1_GSUWGMRR1_K1_LBSPPB256_MIWT1_3_NTA0_NLCA4_SU0_SUM0_SUS0_VWB1_WG64_4_1_WGM1_WGMXCC8_WGMXCCGn1
    SolutionIndex: 1
    SolutionNameMin: Cijk_Alik_Bljk_F8NBS_STA_BH_BiasSB_HAS_SABV_SAV_UserArgs_MT128x48x256_MI16x16x1_SN_LDSB0_GRVWB16_GSU1_GSUAMB_GSUC1_GSUWGMRR1_K1_LBSPPB256_MIWT2_3_NTA0_NLCA4_SU0_SUM0_SUS0_VWB1_WG64_4_1_WGM1_WGMXCC8_WGMXCCGn1
    SolutionIndex: 2
    SolutionNameMin: Cijk_Alik_Bljk_F8NBS_STA_BH_BiasSB_HAS_SABV_SAV_UserArgs_MT128x64x256_MI16x16x1_SN_LDSB1_GRVWB16_GSU1_GSUAMB_GSUC1_GSUWGMRR1_K1_LBSPPB1024_MIWT2_4_NTA0_NLCA4_SU0_SUM0_SUS0_VWB4_WG64_4_1_WGM1_WGMXCC8_WGMXCCGn1
    SolutionIndex: 3
    SolutionNameMin: Cijk_Alik_Bljk_F8NBS_STA_BH_BiasSB_HAS_SABV_SAV_UserArgs_MT64x80x256_MI16x16x1_SN_LDSB1_GRVWB16_GSU1_GSUAMB_GSUC1_GSUWGMRR1_K1_LBSPPB256_MIWT1_5_NTA0_NLCA4_SU0_SUM0_SUS0_VWB1_WG64_4_1_WGM1_WGMXCC8_WGMXCCGn1
    SolutionIndex: 4
    SolutionNameMin: Cijk_Alik_Bljk_F8NBS_STA_BH_BiasSB_HAS_SABV_SAV_UserArgs_MT128x80x256_MI16x16x1_SN_LDSB1_GRVWB16_GSU1_GSUAMB_GSUC1_GSUWGMRR1_K1_LBSPPB256_MIWT2_5_NTA0_NLCA4_SU0_SUM0_SUS0_VWB1_WG64_4_1_WGM1_WGMXCC8_WGMXCCGn1
    SolutionIndex: 5
    SolutionNameMin: Cijk_Alik_Bljk_F8NBS_STA_BH_BiasSB_HAS_SABV_SAV_UserArgs_MT64x16x512_MI16x16x1_SN_LDSB0_GRVWB16_GSU1_GSUAMB_GSUC1_GSUWGMRR1_K1_LBSPPB512_MIWT1_1_NTA0_NLCA8_SU0_SUM0_SUS0_VWB1_WG64_4_1_WGM1_WGMXCC8_WGMXCCGn1
    SolutionIndex: 6
    SolutionNameMin: Cijk_Alik_Bljk_F8NBS_STA_BH_BiasSB_HAS_SABV_SAV_UserArgs_MT64x48x512_MI16x16x1_SN_LDSB1_GRVWB16_GSU1_GSUAMB_GSUC1_GSUWGMRR1_K1_LBSPPB512_MIWT1_3_NTA0_NLCA8_SU0_SUM0_SUS0_VWB1_WG64_4_1_WGM1_WGMXCC8_WGMXCCGn1
    SolutionIndex: 7
    SolutionNameMin: Cijk_Alik_Bljk_F8NBS_STA_BH_BiasSB_HAS_SABV_SAV_UserArgs_MT32x32x512_MI16x16x1_SN_LDSB1_GRVWB16_GSU1_GSUAMB_GSUC1_GSUWGMRR1_K1_LBSPPB1024_MIWT1_2_NTA0_NLCA8_SU0_SUM0_SUS0_VWB2_WG32_4_1_WGM1_WGMXCC8_WGMXCCGn1
    SolutionIndex: 8
    SolutionNameMin: Cijk_Alik_Bljk_F8NBS_STA_BH_BiasSB_HAS_SABV_SAV_UserArgs_MT64x32x512_MI16x16x1_SN_LDSB1_GRVWB16_GSU1_GSUAMB_GSUC1_GSUWGMRR1_K1_LBSPPB1024_MIWT2_2_NTA0_NLCA8_SU0_SUM0_SUS0_VWB2_WG32_4_1_WGM1_WGMXCC8_WGMXCCGn1
    SolutionIndex: 9
    SolutionNameMin: Cijk_Alik_Bljk_F8NBS_STA_BH_BiasSB_HAS_SABV_SAV_UserArgs_MT32x16x1024_MI16x16x1_SN_LDSB1_GRVWB16_GSU1_GSUAMB_GSUC1_GSUWGMRR1_K1_LBSPPB1024_MIWT1_1_NTA0_NLCA16_SU0_SUM0_SUS0_VWB1_WG32_4_1_WGM1_WGMXCC8_WGMXCCGn1
    SolutionIndex: 10
    SolutionNameMin: Cijk_Alik_Bljk_F8NBS_STA_BH_BiasSB_HAS_SABV_SAV_UserArgs_MT128x160x128_MI16x16x1_SN_LDSB1_GRVWB16_GSU1_GSUAMB_GSUC1_GSUWGMRR1_K1_LBSPPB256_MIWT2_10_NTA4_NLCA2_SU0_SUM0_SUS0_VWB2_WG64_4_1_WGM1_WGMXCC8_WGMXCCGn1
    SolutionIndex: 11
    SolutionNameMin: Cijk_Alik_Bljk_F8NBS_STA_BH_BiasSB_HAS_SABV_SAV_UserArgs_MT64x48x256_MI16x16x1_SN_LDSB0_GRVWB16_GSU1_GSUAMB_GSUC1_GSUWGMRR1_K1_LBSPPB256_MIWT1_3_NTA4_NLCA4_SU0_SUM0_SUS0_VWB1_WG64_4_1_WGM1_WGMXCC8_WGMXCCGn1
    SolutionIndex: 12
    SolutionNameMin: Cijk_Alik_Bljk_F8NBS_STA_BH_BiasSB_HAS_SABV_SAV_UserArgs_MT128x64x256_MI16x16x1_SN_LDSB1_GRVWB16_GSU1_GSUAMB_GSUC1_GSUWGMRR1_K1_LBSPPB1024_MIWT2_4_NTA4_NLCA4_SU0_SUM0_SUS0_VWB4_WG64_4_1_WGM1_WGMXCC8_WGMXCCGn1
    SolutionIndex: 13
    SolutionNameMin: Cijk_Alik_Bljk_F8NBS_STA_BH_BiasSB_HAS_SABV_SAV_UserArgs_MT128x96x256_MI16x16x1_SN_LDSB1_GRVWB16_GSU1_GSUAMB_GSUC1_GSUWGMRR1_K1_LBSPPB512_MIWT2_6_NTA4_NLCA4_SU0_SUM0_SUS0_VWB2_WG64_4_1_WGM1_WGMXCC8_WGMXCCGn1
    SolutionIndex: 14
    SolutionNameMin: Cijk_Alik_Bljk_F8NBS_STA_BH_BiasSB_HAS_SABV_SAV_UserArgs_MT64x112x256_MI16x16x1_SN_LDSB1_GRVWB16_GSU1_GSUAMB_GSUC1_GSUWGMRR1_K1_LBSPPB256_MIWT1_7_NTA4_NLCA4_SU0_SUM0_SUS0_VWB1_WG64_4_1_WGM1_WGMXCC8_WGMXCCGn1
    SolutionIndex: 15
    SolutionNameMin: Cijk_Alik_Bljk_F8NBS_STA_BH_BiasSB_HAS_SABV_SAV_UserArgs_MT128x128x256_MI16x16x1_SN_LDSB1_GRVWB16_GSU1_GSUAMB_GSUC1_GSUWGMRR1_K1_LBSPPB2048_MIWT2_8_NTA4_NLCA4_SU0_SUM0_SUS0_VWB8_WG64_4_1_WGM1_WGMXCC8_WGMXCCGn1
    SolutionIndex: 16
    SolutionNameMin: Cijk_Alik_Bljk_F8NBS_STA_BH_BiasSB_HAS_SABV_SAV_UserArgs_MT64x16x512_MI16x16x1_SN_LDSB0_GRVWB16_GSU1_GSUAMB_GSUC1_GSUWGMRR1_K1_LBSPPB512_MIWT1_1_NTA4_NLCA8_SU0_SUM0_SUS0_VWB1_WG64_4_1_WGM1_WGMXCC8_WGMXCCGn1
    SolutionIndex: 17
    SolutionNameMin: Cijk_Alik_Bljk_F8NBS_STA_BH_BiasSB_HAS_SABV_SAV_UserArgs_MT32x32x512_MI16x16x1_SN_LDSB1_GRVWB16_GSU1_GSUAMB_GSUC1_GSUWGMRR1_K1_LBSPPB1024_MIWT1_2_NTA4_NLCA8_SU0_SUM0_SUS0_VWB2_WG32_4_1_WGM1_WGMXCC8_WGMXCCGn1
    SolutionIndex: 18
    SolutionNameMin: Cijk_Alik_Bljk_F8NBS_STA_BH_BiasSB_HAS_SABV_SAV_UserArgs_MT64x32x512_MI16x16x1_SN_LDSB1_GRVWB16_GSU1_GSUAMB_GSUC1_GSUWGMRR1_K1_LBSPPB1024_MIWT2_2_NTA4_NLCA8_SU0_SUM0_SUS0_VWB2_WG32_4_1_WGM1_WGMXCC8_WGMXCCGn1
    SolutionIndex: 19
    SolutionNameMin: Cijk_Alik_Bljk_F8NBS_STA_BH_BiasSB_HAS_SABV_SAV_UserArgs_MT32x16x1024_MI16x16x1_SN_LDSB1_GRVWB16_GSU1_GSUAMB_GSUC1_GSUWGMRR1_K1_LBSPPB1024_MIWT1_1_NTA4_NLCA16_SU0_SUM0_SUS0_VWB1_WG32_4_1_WGM1_WGMXCC8_WGMXCCGn1
    SolutionIndex: 20
    SolutionNameMin: Cijk_Alik_Bljk_F8NBS_STA_BH_BiasSB_HAS_SABV_SAV_UserArgs_MT64x32x512_MI16x16x1_SN_LDSB1_GRVWB16_GSU1_GSUC0_GSUWGMRR0_K1_LBSPPB1024_MIWT1_2_NLCA8_SU8_SUM0_SUS512_VWB2_WG64_4_1_WGM6_WGMXCC8_WGMXCCGn1
    SolutionIndex: 21
    SolutionNameMin: Cijk_Alik_Bljk_F8NBS_STA_BH_BiasSB_HAS_SABV_SAV_UserArgs_MT64x32x512_MI16x16x1_SN_LDSB1_GRVWB16_GSU1_GSUC0_GSUWGMRR0_K1_LBSPPB1024_MIWT1_2_NLCA8_SU8_SUM0_SUS512_VWB2_WG64_4_1_WGM8_WGMXCC8_WGMXCCGn1
    SolutionIndex: 22
    SolutionNameMin: Cijk_Alik_Bljk_F8NBS_STA_BH_BiasSB_HAS_SABV_SAV_UserArgs_MT128x32x512_MI16x16x1_SN_LDSB1_GRVWB16_GSU1_GSUC0_GSUWGMRR0_K1_LBSPPB1024_MIWT2_2_NLCA8_SU8_SUM0_SUS512_VWB2_WG64_4_1_WGM6_WGMXCC8_WGMXCCGn1
    SolutionIndex: 23
    SolutionNameMin: Cijk_Alik_Bljk_F8NBS_STA_BH_BiasSB_HAS_SABV_SAV_UserArgs_MT128x32x512_MI16x16x1_SN_LDSB1_GRVWB16_GSU1_GSUC0_GSUWGMRR0_K1_LBSPPB1024_MIWT2_2_NLCA8_SU8_SUM0_SUS512_VWB2_WG64_4_1_WGM8_WGMXCC8_WGMXCCGn1
    SolutionIndex: 24
    SolutionNameMin: Cijk_Alik_Bljk_F8NBS_STA_BH_BiasSB_HAS_SABV_SAV_UserArgs_MT64x48x512_MI16x16x1_SN_LDSB1_GRVWB16_GSU1_GSUC0_GSUWGMRR0_K1_LBSPPB512_MIWT1_3_NLCA8_SU8_SUM0_SUS512_VWB1_WG64_4_1_WGM8_WGMXCC8_WGMXCCGn1
    SolutionIndex: 25
    SolutionNameMin: Cijk_Alik_Bljk_F8NBS_STA_BH_BiasSB_HAS_SABV_SAV_UserArgs_MT128x32x512_MI16x16x1_SN_LDSB1_GRVWB16_GSU1_GSUC0_GSUWGMRR0_K1_LBSPPB1024_MIWT2_2_NLCA8_SU0_SUM0_SUS0_VWB2_WG64_4_1_WGM6_WGMXCC8_WGMXCCGn1
    SolutionIndex: 26
    SolutionNameMin: Cijk_Alik_Bljk_F8NBS_STA_BH_BiasSB_HAS_SABV_SAV_UserArgs_MT128x32x512_MI16x16x1_SN_LDSB1_GRVWB16_GSU1_GSUC0_GSUWGMRR0_K1_LBSPPB1024_MIWT2_2_NLCA8_SU0_SUM0_SUS0_VWB2_WG64_4_1_WGM8_WGMXCC8_WGMXCCGn1
    SolutionIndex: 27
    SolutionNameMin: Cijk_Alik_Bljk_F8NBS_STA_BH_BiasSB_HAS_SABV_SAV_UserArgs_MT64x48x512_MI16x16x1_SN_LDSB1_GRVWB16_GSU1_GSUC0_GSUWGMRR0_K1_LBSPPB512_MIWT1_3_NLCA8_SU8_SUM0_SUS512_VWB1_WG64_4_1_WGM6_WGMXCC8_WGMXCCGn1
    SolutionIndex: 28
    SolutionNameMin: Cijk_Alik_Bljk_F8NBS_STA_BH_BiasSB_HAS_SABV_SAV_UserArgs_MT128x64x256_MI16x16x1_SN_LDSB1_GRVWB16_GSU1_GSUC0_GSUWGMRR0_K1_LBSPPB1024_MIWT2_4_NLCA4_SU0_SUM0_SUS0_VWB4_WG64_4_1_WGM8_WGMXCC8_WGMXCCGn1
    SolutionIndex: 29
    SolutionNameMin: Cijk_Alik_Bljk_F8NBS_STA_BH_BiasSB_HAS_SABV_SAV_UserArgs_MT128x48x256_MI16x16x1_SN_LDSB0_GRVWB16_GSU1_GSUC0_GSUWGMRR0_K1_LBSPPB256_MIWT2_3_NLCA4_SU0_SUM0_SUS0_VWB1_WG64_4_1_WGM6_WGMXCC8_WGMXCCGn1
    SolutionIndex: 30
    SolutionNameMin: Cijk_Alik_Bljk_F8NBS_STA_BH_BiasSB_HAS_SABV_SAV_UserArgs_MT128x48x256_MI16x16x1_SN_LDSB0_GRVWB16_GSU1_GSUC0_GSUWGMRR0_K1_LBSPPB256_MIWT2_3_NLCA4_SU0_SUM0_SUS0_VWB1_WG64_4_1_WGM8_WGMXCC8_WGMXCCGn1
    SolutionIndex: 31
    SolutionNameMin: Cijk_Alik_Bljk_F8NBS_STA_BH_BiasSB_HAS_SABV_SAV_UserArgs_MT128x48x256_MI16x16x1_SN_LDSB0_GRVWB16_GSU1_GSUC0_GSUWGMRR0_K1_LBSPPB256_MIWT2_3_NLCA4_SU8_SUM0_SUS256_VWB1_WG64_4_1_WGM6_WGMXCC8_WGMXCCGn1
    SolutionIndex: 32
    SolutionNameMin: Cijk_Alik_Bljk_F8NBS_STA_BH_BiasSB_HAS_SABV_SAV_UserArgs_MT128x64x256_MI16x16x1_SN_LDSB1_GRVWB16_GSU1_GSUC0_GSUWGMRR0_K1_LBSPPB1024_MIWT2_4_NLCA4_SU0_SUM0_SUS0_VWB4_WG64_4_1_WGM6_WGMXCC8_WGMXCCGn1
    SolutionIndex: 33
    SolutionNameMin: Cijk_Alik_Bljk_F8NBS_STA_BH_BiasSB_HAS_SABV_SAV_UserArgs_MT128x64x256_MI16x16x1_SN_LDSB1_GRVWB16_GSU1_GSUC0_GSUWGMRR0_K1_LBSPPB1024_MIWT2_4_NLCA4_SU8_SUM0_SUS256_VWB4_WG64_4_1_WGM8_WGMXCC8_WGMXCCGn1
    SolutionIndex: 34
    SolutionNameMin: Cijk_Alik_Bljk_F8NBS_STA_BH_BiasSB_HAS_SABV_SAV_UserArgs_MT128x80x256_MI16x16x1_SN_LDSB1_GRVWB16_GSU1_GSUC0_GSUWGMRR0_K1_LBSPPB256_MIWT2_5_NLCA4_SU8_SUM0_SUS256_VWB1_WG64_4_1_WGM8_WGMXCC8_WGMXCCGn1
    SolutionIndex: 35
    SolutionNameMin: Cijk_Alik_Bljk_F8NBS_STA_BH_BiasSB_HAS_SABV_SAV_UserArgs_MT128x96x256_MI16x16x1_SN_LDSB1_GRVWB16_GSU1_GSUC0_GSUWGMRR0_K1_LBSPPB512_MIWT2_6_NLCA4_SU0_SUM0_SUS0_VWB2_WG64_4_1_WGM8_WGMXCC8_WGMXCCGn1
    SolutionIndex: 36
    SolutionNameMin: Cijk_Alik_Bljk_F8NBS_STA_BH_BiasSB_HAS_SABV_SAV_UserArgs_MT128x96x256_MI16x16x1_SN_LDSB1_GRVWB16_GSU1_GSUC0_GSUWGMRR0_K1_LBSPPB512_MIWT2_6_NLCA4_SU0_SUM0_SUS0_VWB2_WG64_4_1_WGM6_WGMXCC8_WGMXCCGn1
    SolutionIndex: 37
    SolutionNameMin: Cijk_Alik_Bljk_F8NBS_STA_BH_BiasSB_HAS_SABV_SAV_UserArgs_MT256x64x256_MI16x16x1_SN_LDSB1_GRVWB16_GSU1_GSUC0_GSUWGMRR0_K1_LBSPPB1024_MIWT4_4_NLCA4_SU0_SUM0_SUS0_VWB4_WG64_4_1_WGM8_WGMXCC8_WGMXCCGn1
    SolutionIndex: 38
    SolutionNameMin: Cijk_Alik_Bljk_F8NBS_STA_BH_BiasSB_HAS_SABV_SAV_UserArgs_MT256x64x256_MI16x16x1_SN_LDSB1_GRVWB16_GSU1_GSUC0_GSUWGMRR0_K1_LBSPPB1024_MIWT4_4_NLCA4_SU0_SUM0_SUS0_VWB4_WG64_4_1_WGM6_WGMXCC8_WGMXCCGn1
    SolutionIndex: 39
    SolutionNameMin: Cijk_Alik_Bljk_F8NBS_STA_BH_BiasSB_HAS_SABV_SAV_UserArgs_MT256x64x128_MI16x16x1_SN_LDSB0_GRVWB16_GSU1_GSUC0_GSUWGMRR0_K1_LBSPPB512_MIWT4_4_NLCA2_SU0_SUM0_SUS0_VWB4_WG64_4_1_WGM8_WGMXCC8_WGMXCCGn1
    SolutionIndex: 40
    SolutionNameMin: Cijk_Alik_Bljk_F8NBS_STA_BH_BiasSB_HAS_SABV_SAV_UserArgs_MT192x96x128_MI16x16x1_SN_LDSB0_GRVWB16_GSU1_GSUC0_GSUWGMRR0_K1_LBSPPB256_MIWT3_6_NLCA2_SU0_SUM0_SUS0_VWB2_WG64_4_1_WGM8_WGMXCC8_WGMXCCGn1
    SolutionIndex: 41
    SolutionNameMin: Cijk_Alik_Bljk_F8NBS_STA_BH_BiasSB_HAS_SABV_SAV_UserArgs_MT256x96x128_MI16x16x1_SN_LDSB0_GRVWB16_GSU1_GSUC0_GSUWGMRR0_K1_LBSPPB256_MIWT4_6_NLCA2_SU0_SUM0_SUS0_VWB2_WG64_4_1_WGM6_WGMXCC8_WGMXCCGn1
    SolutionIndex: 42
    SolutionNameMin: Cijk_Alik_Bljk_F8NBS_STA_BH_BiasSB_HAS_SABV_SAV_UserArgs_MT128x160x128_MI16x16x1_SN_LDSB1_GRVWB16_GSU1_GSUC0_GSUWGMRR0_K1_LBSPPB256_MIWT2_10_NLCA2_SU8_SUM0_SUS128_VWB2_WG64_4_1_WGM1_WGMXCC8_WGMXCCGn1
    SolutionIndex: 43
    SolutionNameMin: Cijk_Alik_Bljk_F8NBS_STA_BH_BiasSB_HAS_SABV_SAV_UserArgs_MT128x160x128_MI16x16x1_SN_LDSB1_GRVWB16_GSU1_GSUC0_GSUWGMRR0_K1_LBSPPB256_MIWT2_10_NLCA2_SU0_SUM0_SUS0_VWB2_WG64_4_1_WGM6_WGMXCC8_WGMXCCGn1
    SolutionIndex: 44
    SolutionNameMin: Cijk_Alik_Bljk_F8NBS_STA_BH_BiasSB_HAS_SABV_SAV_UserArgs_MT256x96x128_MI16x16x1_SN_LDSB0_GRVWB16_GSU1_GSUC0_GSUWGMRR0_K1_LBSPPB256_MIWT4_6_NLCA2_SU0_SUM0_SUS0_VWB2_WG64_4_1_WGM8_WGMXCC8_WGMXCCGn1
    SolutionIndex: 45
    SolutionNameMin: Cijk_Alik_Bljk_F8NBS_STA_BH_BiasSB_HAS_SABV_SAV_UserArgs_MT256x96x128_MI16x16x1_SN_LDSB0_GRVWB16_GSU1_GSUC0_GSUWGMRR0_K1_LBSPPB256_MIWT4_6_NLCA2_SU0_SUM0_SUS0_VWB2_WG64_4_1_WGM1_WGMXCC8_WGMXCCGn1
    SolutionIndex: 46
    SolutionNameMin: Cijk_Alik_Bljk_F8NBS_STA_BH_BiasSB_HAS_SABV_SAV_UserArgs_MT256x128x128_MI16x16x1_SN_LDSB1_GRVWB16_GSU1_GSUC0_GSUWGMRR0_K1_LBSPPB1024_MIWT4_8_NLCA2_SU0_SUM0_SUS0_VWB8_WG64_4_1_WGM6_WGMXCC8_WGMXCCGn1
    SolutionIndex: 47
    SolutionNameMin: Cijk_Alik_Bljk_F8NBS_STA_BH_BiasSB_HAS_SABV_SAV_UserArgs_MT192x160x128_MI16x16x1_SN_LDSB1_GRVWB16_GSU1_GSUC0_GSUWGMRR0_K1_LBSPPB256_MIWT3_10_NLCA2_SU0_SUM0_SUS0_VWB2_WG64_4_1_WGM6_WGMXCC8_WGMXCCGn1
    SolutionIndex: 48
    SolutionNameMin: Cijk_Alik_Bljk_F8NBS_STA_BH_BiasSB_HAS_SABV_SAV_UserArgs_MT512x64x128_MI16x16x1_SN_LDSB0_GRVWB16_GSU1_GSUC0_GSUWGMRR0_K1_LBSPPB512_MIWT8_4_NLCA2_SU0_SUM0_SUS0_VWB4_WG64_4_1_WGM1_WGMXCC8_WGMXCCGn1
    SolutionIndex: 49
    SolutionNameMin: Cijk_Alik_Bljk_F8NBS_STA_BH_BiasSB_HAS_SABV_SAV_UserArgs_MT256x128x128_MI16x16x1_SN_LDSB1_GRVWB16_GSU1_GSUC0_GSUWGMRR0_K1_LBSPPB1024_MIWT4_8_NLCA2_SU0_SUM0_SUS0_VWB8_WG64_4_1_WGM8_WGMXCC8_WGMXCCGn1
    SolutionIndex: 50
    SolutionNameMin: Cijk_Alik_Bljk_F8NBS_STA_BH_BiasSB_HAS_SABV_SAV_UserArgs_MT128x64x256_MI16x16x1_SN_LDSB1_GRVWB16_GSU1_GSUC0_GSUWGMRR0_K1_LBSPPB1024_MIWT2_4_NLCA4_SU8_SUM0_SUS256_VWB4_WG64_4_1_WGM6_WGMXCC8_WGMXCCGn1
    SolutionIndex: 51
    SolutionNameMin: Cijk_Alik_Bljk_F8NBS_STA_BH_BiasSB_HAS_SABV_SAV_UserArgs_MT128x48x256_MI16x16x1_SN_LDSB0_GRVWB16_GSU1_GSUC0_GSUWGMRR0_K1_LBSPPB256_MIWT2_3_NLCA4_SU8_SUM0_SUS256_VWB1_WG64_4_1_WGM8_WGMXCC8_WGMXCCGn1
    SolutionIndex: 52
    SolutionNameMin: Cijk_Alik_Bljk_F8NBS_STA_BH_BiasSB_HAS_SABV_SAV_UserArgs_MT128x80x256_MI16x16x1_SN_LDSB1_GRVWB16_GSU1_GSUC0_GSUWGMRR0_K1_LBSPPB256_MIWT2_5_NLCA4_SU0_SUM0_SUS0_VWB1_WG64_4_1_WGM8_WGMXCC8_WGMXCCGn1
    SolutionIndex: 53
    SolutionNameMin: Cijk_Alik_Bljk_F8NBS_STA_BH_BiasSB_HAS_SABV_SAV_UserArgs_MT128x80x256_MI16x16x1_SN_LDSB1_GRVWB16_GSU1_GSUC0_GSUWGMRR0_K1_LBSPPB256_MIWT2_5_NLCA4_SU0_SUM0_SUS0_VWB1_WG64_4_1_WGM6_WGMXCC8_WGMXCCGn1
    SolutionIndex: 54
    SolutionNameMin: Cijk_Alik_Bljk_F8NBS_STA_BH_BiasSB_HAS_SABV_SAV_UserArgs_MT128x96x256_MI16x16x1_SN_LDSB1_GRVWB16_GSU1_GSUC0_GSUWGMRR0_K1_LBSPPB512_MIWT2_6_NLCA4_SU8_SUM0_SUS256_VWB2_WG64_4_1_WGM8_WGMXCC8_WGMXCCGn1
    SolutionIndex: 55
    SolutionNameMin: Cijk_Alik_Bljk_F8NBS_STA_BH_BiasSB_HAS_SABV_SAV_UserArgs_MT128x112x256_MI16x16x1_SN_LDSB1_GRVWB16_GSU1_GSUC0_GSUWGMRR0_K1_LBSPPB256_MIWT2_7_NLCA4_SU8_SUM0_SUS256_VWB1_WG64_4_1_WGM6_WGMXCC8_WGMXCCGn1
    SolutionIndex: 56
    SolutionNameMin: Cijk_Alik_Bljk_F8NBS_STA_BH_BiasSB_HAS_SABV_SAV_UserArgs_MT128x112x256_MI16x16x1_SN_LDSB1_GRVWB16_GSU1_GSUC0_GSUWGMRR0_K1_LBSPPB256_MIWT2_7_NLCA4_SU0_SUM0_SUS0_VWB1_WG64_4_1_WGM6_WGMXCC8_WGMXCCGn1
    SolutionIndex: 57
    SolutionNameMin: Cijk_Alik_Bljk_F8NBS_STA_BH_BiasSB_HAS_SABV_SAV_UserArgs_MT256x80x256_MI16x16x1_SN_LDSB1_GRVWB16_GSU1_GSUC0_GSUWGMRR0_K1_LBSPPB256_MIWT4_5_NLCA4_SU0_SUM0_SUS0_VWB1_WG64_4_1_WGM6_WGMXCC8_WGMXCCGn1
    SolutionIndex: 58
    SolutionNameMin: Cijk_Alik_Bljk_F8NBS_STA_BH_BiasSB_HAS_SABV_SAV_UserArgs_MT320x64x128_MI16x16x1_SN_LDSB0_GRVWB16_GSU1_GSUC0_GSUWGMRR0_K1_LBSPPB512_MIWT5_4_NLCA2_SU8_SUM0_SUS128_VWB4_WG64_4_1_WGM8_WGMXCC8_WGMXCCGn1
    SolutionIndex: 59
    SolutionNameMin: Cijk_Alik_Bljk_F8NBS_STA_BH_BiasSB_HAS_SABV_SAV_UserArgs_MT320x96x128_MI16x16x1_SN_LDSB0_GRVWB16_GSU1_GSUC0_GSUWGMRR0_K1_LBSPPB256_MIWT5_6_NLCA2_SU0_SUM0_SUS0_VWB2_WG64_4_1_WGM8_WGMXCC8_WGMXCCGn1
    SolutionIndex: 60
    SolutionNameMin: Cijk_Alik_Bljk_F8NBS_STA_BH_BiasSB_HAS_SABV_SAV_UserArgs_MT192x160x128_MI16x16x1_SN_LDSB1_GRVWB16_GSU1_GSUC0_GSUWGMRR0_K1_LBSPPB256_MIWT3_10_NLCA2_SU8_SUM0_SUS128_VWB2_WG64_4_1_WGM6_WGMXCC8_WGMXCCGn1
    SolutionIndex: 61
    SolutionNameMin: Cijk_Alik_Bljk_F8NBS_STA_BH_BiasSB_HAS_SABV_SAV_UserArgs_MT256x160x128_MI16x16x1_SN_LDSB0_GRVWB16_GSU1_GSUC0_GSUWGMRR0_K1_LBSPPB256_MIWT4_10_NLCA2_SU0_SUM0_SUS0_VWB2_WG64_4_1_WGM8_WGMXCC8_WGMXCCGn1
    SolutionIndex: 62
    SolutionNameMin: Cijk_Alik_Bljk_F8NBS_STA_BH_BiasSB_HAS_SABV_SAV_UserArgs_MT256x160x128_MI16x16x1_SN_LDSB0_GRVWB16_GSU1_GSUC0_GSUWGMRR0_K1_LBSPPB256_MIWT4_10_NLCA2_SU0_SUM0_SUS0_VWB2_WG64_4_1_WGM6_WGMXCC8_WGMXCCGn1
    SolutionIndex: 63
    SolutionNameMin: Cijk_Alik_Bljk_F8NBS_STA_BH_BiasSB_HAS_SABV_SAV_UserArgs_MT256x192x128_MI16x16x1_SN_LDSB0_GRVWB16_GSU1_GSUC0_GSUWGMRR0_K1_LBSPPB512_MIWT4_12_NLCA2_SU0_SUM0_SUS0_VWB4_WG64_4_1_WGM1_WGMXCC8_WGMXCCGn1
    SolutionIndex: 64
    SolutionNameMin: Cijk_Alik_Bljk_F8NBS_STA_BH_BiasSB_HAS_SABV_SAV_UserArgs_MT256x192x128_MI16x16x1_SN_LDSB0_GRVWB16_GSU1_GSUC0_GSUWGMRR0_K1_LBSPPB512_MIWT4_12_NLCA2_SU0_SUM0_SUS0_VWB4_WG64_4_1_WGM6_WGMXCC8_WGMXCCGn1
    SolutionIndex: 65
    SolutionNameMin: Cijk_Alik_Bljk_F8NBS_STA_BH_BiasSB_HAS_SABV_SAV_UserArgs_MT256x192x128_MI16x16x1_SN_LDSB0_GRVWB16_GSU1_GSUC0_GSUWGMRR0_K1_LBSPPB512_MIWT4_12_NLCA2_SU0_SUM0_SUS0_VWB4_WG64_4_1_WGM8_WGMXCC8_WGMXCCGn1
    SolutionIndex: 66
    SolutionNameMin: Cijk_Alik_Bljk_F8NBS_STA_BH_BiasSB_HAS_SABV_SAV_UserArgs_MT256x224x128_MI16x16x1_SN_LDSB0_GRVWB16_GSU1_GSUC0_GSUWGMRR0_K1_LBSPPB256_MIWT4_14_NLCA2_SU0_SUM0_SUS0_VWB2_WG64_4_1_WGM1_WGMXCC8_WGMXCCGn1
    SolutionIndex: 67
    SolutionNameMin: Cijk_Alik_Bljk_F8NBS_STA_BH_BiasSB_HAS_SABV_SAV_UserArgs_MT384x160x128_MI16x16x1_SN_LDSB0_GRVWB16_GSU1_GSUC0_GSUWGMRR0_K1_LBSPPB256_MIWT6_10_NLCA2_SU0_SUM0_SUS0_VWB2_WG64_4_1_WGM6_WGMXCC8_WGMXCCGn1
    SolutionIndex: 68
    SolutionNameMin: Cijk_Alik_Bljk_F8NBS_STA_BH_BiasSB_HAS_SABV_SAV_UserArgs_MT256x224x128_MI16x16x1_SN_LDSB0_GRVWB16_GSU1_GSUC0_GSUWGMRR0_K1_LBSPPB256_MIWT4_14_NLCA2_SU0_SUM0_SUS0_VWB2_WG64_4_1_WGM6_WGMXCC8_WGMXCCGn1
    SolutionIndex: 69
    SolutionNameMin: Cijk_Alik_Bljk_F8NBS_STA_BH_BiasSB_HAS_SABV_SAV_UserArgs_MT192x80x256_MI16x16x1_SN_LDSB1_GRVWB16_GSU1_GSUC0_GSUWGMRR0_K1_LBSPPB256_MIWT3_5_NLCA4_SU0_SUM0_SUS0_VWB1_WG64_4_1_WGM6_WGMXCC8_WGMXCCGn1
    SolutionIndex: 70
    SolutionNameMin: Cijk_Alik_Bljk_F8NBS_STA_BH_BiasSB_HAS_SABV_SAV_UserArgs_MT256x64x128_MI16x16x1_SN_LDSB0_GRVWB16_GSU1_GSUC0_GSUWGMRR0_K1_LBSPPB512_MIWT4_4_NLCA2_SU0_SUM0_SUS0_VWB4_WG64_4_1_WGM6_WGMXCC8_WGMXCCGn1
    SolutionIndex: 71
    SolutionNameMin: Cijk_Alik_Bljk_F8NBS_STA_BH_BiasSB_HAS_SABV_SAV_UserArgs_MT192x96x128_MI16x16x1_SN_LDSB0_GRVWB16_GSU1_GSUC0_GSUWGMRR0_K1_LBSPPB256_MIWT3_6_NLCA2_SU8_SUM0_SUS128_VWB2_WG64_4_1_WGM8_WGMXCC8_WGMXCCGn1
    SolutionIndex: 72
    SolutionNameMin: Cijk_Alik_Bljk_F8NBS_STA_BH_BiasSB_HAS_SABV_SAV_UserArgs_MT320x64x128_MI16x16x1_SN_LDSB0_GRVWB16_GSU1_GSUC0_GSUWGMRR0_K1_LBSPPB512_MIWT5_4_NLCA2_SU0_SUM0_SUS0_VWB4_WG64_4_1_WGM6_WGMXCC8_WGMXCCGn1
    SolutionIndex: 73
    SolutionNameMin: Cijk_Alik_Bljk_F8NBS_STA_BH_BiasSB_HAS_SABV_SAV_UserArgs_MT192x112x128_MI16x16x1_SN_LDSB1_GRVWB8_GSU1_GSUC0_GSUWGMRR0_K1_LBSPPB128_MIWT3_7_NLCA2_SU0_SUM0_SUS0_VWB1_WG64_4_1_WGM6_WGMXCC8_WGMXCCGn1
    SolutionIndex: 74
    SolutionNameMin: Cijk_Alik_Bljk_F8NBS_STA_BH_BiasSB_HAS_SABV_SAV_UserArgs_MT256x96x128_MI16x16x1_SN_LDSB0_GRVWB16_GSU1_GSUC0_GSUWGMRR0_K1_LBSPPB256_MIWT4_6_NLCA2_SU8_SUM0_SUS128_VWB2_WG64_4_1_WGM6_WGMXCC8_WGMXCCGn1
    SolutionIndex: 75
    SolutionNameMin: Cijk_Alik_Bljk_F8NBS_STA_BH_BiasSB_HAS_SABV_SAV_UserArgs_MT320x80x128_MI16x16x1_SN_LDSB0_GRVWB8_GSU1_GSUC0_GSUWGMRR0_K1_LBSPPB128_MIWT5_5_NLCA2_SU0_SUM0_SUS0_VWB1_WG64_4_1_WGM6_WGMXCC8_WGMXCCGn1
    SolutionIndex: 76
    SolutionNameMin: Cijk_Alik_Bljk_F8NBS_STA_BH_BiasSB_HAS_SABV_SAV_UserArgs_MT384x64x128_MI16x16x1_SN_LDSB0_GRVWB16_GSU1_GSUC0_GSUWGMRR0_K1_LBSPPB512_MIWT6_4_NLCA2_SU0_SUM0_SUS0_VWB4_WG64_4_1_WGM8_WGMXCC8_WGMXCCGn1
    SolutionIndex: 77
    SolutionNameMin: Cijk_Alik_Bljk_F8NBS_STA_BH_BiasSB_HAS_SABV_SAV_UserArgs_MT320x96x128_MI16x16x1_SN_LDSB0_GRVWB16_GSU1_GSUC0_GSUWGMRR0_K1_LBSPPB256_MIWT5_6_NLCA2_SU0_SUM0_SUS0_VWB2_WG64_4_1_WGM6_WGMXCC8_WGMXCCGn1
    SolutionIndex: 78
    SolutionNameMin: Cijk_Alik_Bljk_F8NBS_STA_BH_BiasSB_HAS_SABV_SAV_UserArgs_MT320x96x128_MI16x16x1_SN_LDSB0_GRVWB16_GSU1_GSUC0_GSUWGMRR0_K1_LBSPPB256_MIWT5_6_NLCA2_SU8_SUM0_SUS128_VWB2_WG64_4_1_WGM8_WGMXCC8_WGMXCCGn1
    SolutionIndex: 79
    SolutionNameMin: Cijk_Alik_Bljk_F8NBS_STA_BH_BiasSB_HAS_SABV_SAV_UserArgs_MT448x64x128_MI16x16x1_SN_LDSB0_GRVWB16_GSU1_GSUC0_GSUWGMRR0_K1_LBSPPB512_MIWT7_4_NLCA2_SU0_SUM0_SUS0_VWB4_WG64_4_1_WGM8_WGMXCC8_WGMXCCGn1
    SolutionIndex: 80
    SolutionNameMin: Cijk_Alik_Bljk_F8NBS_STA_BH_BiasSB_HAS_SABV_SAV_UserArgs_MT192x192x128_MI16x16x1_SN_LDSB0_GRVWB16_GSU1_GSUC0_GSUWGMRR0_K1_LBSPPB512_MIWT3_12_NLCA2_SU0_SUM0_SUS0_VWB4_WG64_4_1_WGM6_WGMXCC8_WGMXCCGn1
    SolutionIndex: 81
    SolutionNameMin: Cijk_Alik_Bljk_F8NBS_STA_BH_BiasSB_HAS_SABV_SAV_UserArgs_MT512x64x128_MI16x16x1_SN_LDSB0_GRVWB16_GSU1_GSUC0_GSUWGMRR0_K1_LBSPPB512_MIWT8_4_NLCA2_SU0_SUM0_SUS0_VWB4_WG64_4_1_WGM6_WGMXCC8_WGMXCCGn1
    SolutionIndex: 82
    SolutionNameMin: Cijk_Alik_Bljk_F8NBS_STA_BH_BiasSB_HAS_SABV_SAV_UserArgs_MT256x160x128_MI16x16x1_SN_LDSB0_GRVWB16_GSU1_GSUC0_GSUWGMRR0_K1_LBSPPB256_MIWT4_10_NLCA2_SU8_SUM0_SUS128_VWB2_WG64_4_1_WGM6_WGMXCC8_WGMXCCGn1
    SolutionIndex: 83
    SolutionNameMin: Cijk_Alik_Bljk_F8NBS_STA_BH_BiasSB_HAS_SABV_SAV_UserArgs_MT192x96x128_MI16x16x1_SN_LDSB0_GRVWB16_GSU1_GSUC0_GSUWGMRR0_K1_LBSPPB256_MIWT3_6_NLCA2_SU0_SUM0_SUS0_VWB2_WG64_4_1_WGM6_WGMXCC8_WGMXCCGn1
    SolutionIndex: 84
    SolutionNameMin: Cijk_Alik_Bljk_F8NBS_STA_BH_BiasSB_HAS_SABV_SAV_UserArgs_MT256x176x128_MI16x16x1_SN_LDSB0_GRVWB8_GSU1_GSUC0_GSUWGMRR0_K1_LBSPPB128_MIWT4_11_NLCA2_SU8_SUM0_SUS128_VWB1_WG64_4_1_WGM8_WGMXCC8_WGMXCCGn1
    SolutionIndex: 85
    SolutionNameMin: Cijk_Alik_Bljk_F8NBS_STA_BH_BiasSB_HAS_SABV_SAV_UserArgs_MT256x192x128_MI16x16x1_SN_LDSB0_GRVWB16_GSU1_GSUC0_GSUWGMRR0_K1_LBSPPB512_MIWT4_12_NLCA2_SU8_SUM0_SUS128_VWB4_WG64_4_1_WGM8_WGMXCC8_WGMXCCGn1
    SolutionIndex: 86
    SolutionNameMin: Cijk_Alik_Bljk_F8NBS_STA_BH_BiasSB_HAS_SABV_SAV_UserArgs_MT320x160x128_MI16x16x1_SN_LDSB0_GRVWB16_GSU1_GSUC0_GSUWGMRR0_K1_LBSPPB256_MIWT5_10_NLCA2_SU0_SUM0_SUS0_VWB2_WG64_4_1_WGM8_WGMXCC8_WGMXCCGn1
    SolutionIndex: 87
    SolutionNameMin: Cijk_Alik_Bljk_F8NBS_STA_BH_BiasSB_HAS_SABV_SAV_UserArgs_MT384x160x128_MI16x16x1_SN_LDSB0_GRVWB16_GSU1_GSUC0_GSUWGMRR0_K1_LBSPPB256_MIWT6_10_NLCA2_SU0_SUM0_SUS0_VWB2_WG64_4_1_WGM8_WGMXCC8_WGMXCCGn1
    SolutionIndex: 88
    SolutionNameMin: Cijk_Alik_Bljk_F8NBS_STA_BH_BiasSB_HAS_SABV_SAV_UserArgs_MT384x144x128_MI16x16x1_SN_LDSB0_GRVWB8_GSU1_GSUC0_GSUWGMRR0_K1_LBSPPB128_MIWT6_9_NLCA2_SU8_SUM0_SUS128_VWB1_WG64_4_1_WGM8_WGMXCC8_WGMXCCGn1
    SolutionIndex: 89
    SolutionNameMin: Cijk_Alik_Bljk_F8NBS_STA_BH_BiasSB_HAS_SABV_SAV_UserArgs_MT448x128x128_MI16x16x1_SN_LDSB0_GRVWB16_GSU1_GSUC0_GSUWGMRR0_K1_LBSPPB1024_MIWT7_8_NLCA2_SU0_SUM0_SUS0_VWB8_WG64_4_1_WGM8_WGMXCC8_WGMXCCGn1
    SolutionIndex: 90
    SolutionNameMin: Cijk_Alik_Bljk_F8NBS_STA_BH_BiasSB_HAS_SABV_SAV_UserArgs_MT512x128x128_MI16x16x1_SN_LDSB0_GRVWB16_GSU1_GSUC0_GSUWGMRR0_K1_LBSPPB1024_MIWT8_8_NLCA2_SU0_SUM0_SUS0_VWB8_WG64_4_1_WGM6_WGMXCC8_WGMXCCGn1
    SolutionIndex: 91
    SolutionNameMin: Cijk_Alik_Bljk_F8NBS_STA_BH_BiasSB_HAS_SABV_SAV_UserArgs_MT192x224x128_MI16x16x1_SN_LDSB0_GRVWB16_GSU1_GSUC0_GSUWGMRR0_K1_LBSPPB256_MIWT3_14_NLCA2_SU8_SUM0_SUS128_VWB2_WG64_4_1_WGM8_WGMXCC8_WGMXCCGn1
    SolutionIndex: 92
    SolutionNameMin: Cijk_Alik_Bljk_F8NBS_STA_BH_BiasSB_HAS_SABV_SAV_UserArgs_MT384x160x128_MI16x16x1_SN_LDSB0_GRVWB16_GSU1_GSUC0_GSUWGMRR0_K1_LBSPPB256_MIWT6_10_NLCA2_SU8_SUM0_SUS128_VWB2_WG64_4_1_WGM8_WGMXCC8_WGMXCCGn1
    SolutionIndex: 93
    SolutionNameMin: Cijk_Alik_Bljk_F8NBS_STA_BH_BiasSB_HAS_SABV_SAV_UserArgs_MT512x128x128_MI16x16x1_SN_LDSB0_GRVWB16_GSU1_GSUC0_GSUWGMRR0_K1_LBSPPB1024_MIWT8_8_NLCA2_SU8_SUM0_SUS128_VWB8_WG64_4_1_WGM8_WGMXCC8_WGMXCCGn1
    SolutionIndex: 94
    SolutionNameMin: Cijk_Alik_Bljk_F8NBS_STA_BH_BiasSB_HAS_SABV_SAV_UserArgs_MT192x64x256_MI16x16x1_SN_LDSB1_GRVWB16_GSU1_GSUC0_GSUWGMRR0_K1_LBSPPB1024_MIWT3_4_NLCA4_SU0_SUM0_SUS0_VWB4_WG64_4_1_WGM8_WGMXCC8_WGMXCCGn1
    SolutionIndex: 95
    SolutionNameMin: Cijk_Alik_Bljk_F8NBS_STA_BH_BiasSB_HAS_SABV_SAV_UserArgs_MT128x112x256_MI16x16x1_SN_LDSB1_GRVWB16_GSU1_GSUC0_GSUWGMRR0_K1_LBSPPB256_MIWT2_7_NLCA4_SU0_SUM0_SUS0_VWB1_WG64_4_1_WGM8_WGMXCC8_WGMXCCGn1
    SolutionIndex: 96
    SolutionNameMin: Cijk_Alik_Bljk_F8NBS_STA_BH_BiasSB_HAS_SABV_SAV_UserArgs_MT128x128x256_MI16x16x1_SN_LDSB1_GRVWB16_GSU1_GSUC0_GSUWGMRR0_K1_LBSPPB2048_MIWT2_8_NLCA4_SU0_SUM0_SUS0_VWB8_WG64_4_1_WGM6_WGMXCC8_WGMXCCGn1
    SolutionIndex: 97
    SolutionNameMin: Cijk_Alik_Bljk_F8NBS_STA_BH_BiasSB_HAS_SABV_SAV_UserArgs_MT320x48x256_MI16x16x1_SN_LDSB0_GRVWB16_GSU1_GSUC0_GSUWGMRR0_K1_LBSPPB256_MIWT5_3_NLCA4_SU0_SUM0_SUS0_VWB1_WG64_4_1_WGM8_WGMXCC8_WGMXCCGn1
    SolutionIndex: 98
    SolutionNameMin: Cijk_Alik_Bljk_F8NBS_STA_BH_BiasSB_HAS_SABV_SAV_UserArgs_MT128x128x256_MI16x16x1_SN_LDSB1_GRVWB16_GSU1_GSUC0_GSUWGMRR0_K1_LBSPPB2048_MIWT2_8_NLCA4_SU0_SUM0_SUS0_VWB8_WG64_4_1_WGM8_WGMXCC8_WGMXCCGn1
    SolutionIndex: 99
    SolutionNameMin: Cijk_Alik_Bljk_F8NBS_STA_BH_BiasSB_HAS_SABV_SAV_UserArgs_MT320x64x128_MI16x16x1_SN_LDSB0_GRVWB16_GSU1_GSUC0_GSUWGMRR0_K1_LBSPPB512_MIWT5_4_NLCA2_SU0_SUM0_SUS0_VWB4_WG64_4_1_WGM8_WGMXCC8_WGMXCCGn1
    SolutionIndex: 100
    SolutionNameMin: Cijk_Alik_Bljk_F8NBS_STA_BH_BiasSB_HAS_SABV_SAV_UserArgs_MT320x80x128_MI16x16x1_SN_LDSB0_GRVWB8_GSU1_GSUC0_GSUWGMRR0_K1_LBSPPB128_MIWT5_5_NLCA2_SU0_SUM0_SUS0_VWB1_WG64_4_1_WGM8_WGMXCC8_WGMXCCGn1
    SolutionIndex: 101
    SolutionNameMin: Cijk_Alik_Bljk_F8NBS_STA_BH_BiasSB_HAS_SABV_SAV_UserArgs_MT192x128x128_MI16x16x1_SN_LDSB1_GRVWB16_GSU1_GSUC0_GSUWGMRR0_K1_LBSPPB1024_MIWT3_8_NLCA2_SU0_SUM0_SUS0_VWB8_WG64_4_1_WGM8_WGMXCC8_WGMXCCGn1
    SolutionIndex: 102
    SolutionNameMin: Cijk_Alik_Bljk_F8NBS_STA_BH_BiasSB_HAS_SABV_SAV_UserArgs_MT320x80x128_MI16x16x1_SN_LDSB0_GRVWB8_GSU1_GSUC0_GSUWGMRR0_K1_LBSPPB128_MIWT5_5_NLCA2_SU8_SUM0_SUS128_VWB1_WG64_4_1_WGM8_WGMXCC8_WGMXCCGn1
    SolutionIndex: 103
    SolutionNameMin: Cijk_Alik_Bljk_F8NBS_STA_BH_BiasSB_HAS_SABV_SAV_UserArgs_MT256x128x128_MI16x16x1_SN_LDSB1_GRVWB16_GSU1_GSUC0_GSUWGMRR0_K1_LBSPPB1024_MIWT4_8_NLCA2_SU8_SUM0_SUS128_VWB8_WG64_4_1_WGM6_WGMXCC8_WGMXCCGn1
    SolutionIndex: 104
    SolutionNameMin: Cijk_Alik_Bljk_F8NBS_STA_BH_BiasSB_HAS_SABV_SAV_UserArgs_MT256x112x128_MI16x16x1_SN_LDSB1_GRVWB8_GSU1_GSUC0_GSUWGMRR0_K1_LBSPPB128_MIWT4_7_NLCA2_SU0_SUM0_SUS0_VWB1_WG64_4_1_WGM6_WGMXCC8_WGMXCCGn1
    SolutionIndex: 105
    SolutionNameMin: Cijk_Alik_Bljk_F8NBS_STA_BH_BiasSB_HAS_SABV_SAV_UserArgs_MT320x112x128_MI16x16x1_SN_LDSB0_GRVWB8_GSU1_GSUC0_GSUWGMRR0_K1_LBSPPB128_MIWT5_7_NLCA2_SU0_SUM0_SUS0_VWB1_WG64_4_1_WGM8_WGMXCC8_WGMXCCGn1
    SolutionIndex: 106
    SolutionNameMin: Cijk_Alik_Bljk_F8NBS_STA_BH_BiasSB_HAS_SABV_SAV_UserArgs_MT320x112x128_MI16x16x1_SN_LDSB0_GRVWB8_GSU1_GSUC0_GSUWGMRR0_K1_LBSPPB128_MIWT5_7_NLCA2_SU0_SUM0_SUS0_VWB1_WG64_4_1_WGM6_WGMXCC8_WGMXCCGn1
    SolutionIndex: 107
    SolutionNameMin: Cijk_Alik_Bljk_F8NBS_STA_BH_BiasSB_HAS_SABV_SAV_UserArgs_MT320x128x128_MI16x16x1_SN_LDSB0_GRVWB16_GSU1_GSUC0_GSUWGMRR0_K1_LBSPPB1024_MIWT5_8_NLCA2_SU0_SUM0_SUS0_VWB8_WG64_4_1_WGM6_WGMXCC8_WGMXCCGn1
    SolutionIndex: 108
    SolutionNameMin: Cijk_Alik_Bljk_F8NBS_STA_BH_BiasSB_HAS_SABV_SAV_UserArgs_MT192x256x128_MI16x16x1_SN_LDSB1_GRVWB16_GSU1_GSUC0_GSUWGMRR0_K1_LBSPPB2048_MIWT3_16_NLCA2_SU0_SUM0_SUS0_VWB16_WG64_4_1_WGM6_WGMXCC8_WGMXCCGn1
    SolutionIndex: 109
    SolutionNameMin: Cijk_Alik_Bljk_F8NBS_STA_BH_BiasSB_HAS_SABV_SAV_UserArgs_MT320x144x128_MI16x16x1_SN_LDSB0_GRVWB8_GSU1_GSUC0_GSUWGMRR0_K1_LBSPPB128_MIWT5_9_NLCA2_SU0_SUM0_SUS0_VWB1_WG64_4_1_WGM6_WGMXCC8_WGMXCCGn1
    SolutionIndex: 110
    SolutionNameMin: Cijk_Alik_Bljk_F8NBS_STA_BH_BiasSB_HAS_SABV_SAV_UserArgs_MT320x176x128_MI16x16x1_SN_LDSB0_GRVWB8_GSU1_GSUC0_GSUWGMRR0_K1_LBSPPB128_MIWT5_11_NLCA2_SU8_SUM0_SUS128_VWB1_WG64_4_1_WGM8_WGMXCC8_WGMXCCGn1
    SolutionIndex: 111
    SolutionNameMin: Cijk_Alik_Bljk_F8NBS_STA_BH_BiasSB_HAS_SABV_SAV_UserArgs_MT256x256x128_MI16x16x1_SN_LDSB1_GRVWB16_GSU1_GSUC0_GSUWGMRR0_K1_LBSPPB2048_MIWT4_16_NLCA2_SU0_SUM0_SUS0_VWB16_WG64_4_1_WGM6_WGMXCC8_WGMXCCGn1
    SolutionIndex: 112
    SolutionNameMin: Cijk_Alik_Bljk_F8NBS_STA_BH_BiasSB_HAS_SABV_SAV_UserArgs_MT320x176x128_MI16x16x1_SN_LDSB0_GRVWB8_GSU1_GSUC0_GSUWGMRR0_K1_LBSPPB128_MIWT5_11_NLCA2_SU8_SUM0_SUS128_VWB1_WG64_4_1_WGM6_WGMXCC8_WGMXCCGn1
    SolutionIndex: 113
    SolutionNameMin: Cijk_Alik_Bljk_F8NBS_STA_BH_BiasSB_HAS_SABV_SAV_UserArgs_MT256x256x128_MI16x16x1_SN_LDSB1_GRVWB16_GSU1_GSUC0_GSUWGMRR0_K1_LBSPPB2048_MIWT4_16_NLCA2_SU8_SUM0_SUS128_VWB16_WG64_4_1_WGM8_WGMXCC8_WGMXCCGn1
    SolutionIndex: 114
    SolutionNameMin: Cijk_Alik_Bljk_F8NBS_STA_BH_BiasSB_HAS_SABV_SAV_UserArgs_MT256x256x128_MI16x16x1_SN_LDSB1_GRVWB16_GSU1_GSUC0_GSUWGMRR0_K1_LBSPPB2048_MIWT4_16_NLCA2_SU8_SUM0_SUS128_VWB16_WG64_4_1_WGM6_WGMXCC8_WGMXCCGn1
    SolutionIndex: 115
    SolutionNameMin: Cijk_Alik_Bljk_F8NBS_STA_BH_BiasSB_HAS_SABV_SAV_UserArgs_MT256x256x128_MI16x16x1_SN_LDSB1_GRVWB16_GSU1_GSUC0_GSUWGMRR0_K1_LBSPPB2048_MIWT4_16_NLCA2_SU0_SUM0_SUS0_VWB16_WG64_4_1_WGM8_WGMXCC8_WGMXCCGn1
    SolutionIndex: 116
    SolutionNameMin: Cijk_Alik_Bljk_F8NBS_STA_BH_BiasSB_HAS_SABV_SAV_UserArgs_MT32x16x512_MI16x16x1_SN_LDSB0_GRVWB16_GSU1_GSUC0_GSUWGMRR0_K1_LBSPPB512_MIWT1_1_NLCA8_SU0_SUM0_SUS0_VWB1_WG32_4_1_WGM1_WGMXCC8_WGMXCCGn1
    SolutionIndex: 117
    SolutionNameMin: Cijk_Alik_Bljk_F8NBS_STA_BH_BiasSB_HAS_SABV_SAV_UserArgs_MT64x16x512_MI16x16x1_SN_LDSB0_GRVWB16_GSU1_GSUC0_GSUWGMRR0_K1_LBSPPB512_MIWT1_1_NLCA8_SU0_SUM0_SUS0_VWB1_WG64_4_1_WGM8_WGMXCC8_WGMXCCGn1
    SolutionIndex: 118
    SolutionNameMin: Cijk_Alik_Bljk_F8NBS_STA_BH_BiasSB_HAS_SABV_SAV_UserArgs_MT64x32x512_MI16x16x1_SN_LDSB1_GRVWB16_GSU1_GSUC0_GSUWGMRR0_K1_LBSPPB1024_MIWT1_2_NLCA8_SU0_SUM0_SUS0_VWB2_WG64_4_1_WGM8_WGMXCC8_WGMXCCGn1
    SolutionIndex: 119
    SolutionNameMin: Cijk_Alik_Bljk_F8NBS_STA_BH_BiasSB_HAS_SABV_SAV_UserArgs_MT128x16x512_MI16x16x1_SN_LDSB0_GRVWB16_GSU1_GSUC0_GSUWGMRR0_K1_LBSPPB512_MIWT2_1_NLCA8_SU0_SUM0_SUS0_VWB1_WG64_4_1_WGM6_WGMXCC8_WGMXCCGn1
    SolutionIndex: 120
    SolutionNameMin: Cijk_Alik_Bljk_F8NBS_STA_BH_BiasSB_HAS_SABV_SAV_UserArgs_MT128x16x512_MI16x16x1_SN_LDSB0_GRVWB16_GSU1_GSUC0_GSUWGMRR0_K1_LBSPPB512_MIWT2_1_NLCA8_SU0_SUM0_SUS0_VWB1_WG64_4_1_WGM8_WGMXCC8_WGMXCCGn1
    SolutionIndex: 121
    SolutionNameMin: Cijk_Alik_Bljk_F8NBS_STA_BH_BiasSB_HAS_SABV_SAV_UserArgs_MT64x48x256_MI16x16x1_SN_LDSB0_GRVWB16_GSU1_GSUC0_GSUWGMRR0_K1_LBSPPB256_MIWT1_3_NLCA4_SU8_SUM0_SUS256_VWB1_WG64_4_1_WGM8_WGMXCC8_WGMXCCGn1
    SolutionIndex: 122
    SolutionNameMin: Cijk_Alik_Bljk_F8NBS_STA_BH_BiasSB_HAS_SABV_SAV_UserArgs_MT64x32x256_MI16x16x1_SN_LDSB0_GRVWB16_GSU1_GSUC0_GSUWGMRR0_K1_LBSPPB512_MIWT1_2_NLCA4_SU8_SUM0_SUS256_VWB2_WG64_4_1_WGM8_WGMXCC8_WGMXCCGn1
    SolutionIndex: 123
    SolutionNameMin: Cijk_Alik_Bljk_F8NBS_STA_BH_BiasSB_HAS_SABV_SAV_UserArgs_MT128x80x256_MI16x16x1_SN_LDSB1_GRVWB16_GSU1_GSUC0_GSUWGMRR0_K1_LBSPPB256_MIWT2_5_NLCA4_SU8_SUM0_SUS256_VWB1_WG64_4_1_WGM6_WGMXCC8_WGMXCCGn1
    SolutionIndex: 124
    SolutionNameMin: Cijk_Alik_Bljk_F8NBS_STA_BH_BiasSB_HAS_SABV_SAV_UserArgs_MT192x48x256_MI16x16x1_SN_LDSB0_GRVWB16_GSU1_GSUC0_GSUWGMRR0_K1_LBSPPB256_MIWT3_3_NLCA4_SU0_SUM0_SUS0_VWB1_WG64_4_1_WGM6_WGMXCC8_WGMXCCGn1
    SolutionIndex: 125
    SolutionNameMin: Cijk_Alik_Bljk_F8NBS_STA_BH_BiasSB_HAS_SABV_SAV_UserArgs_MT128x128x256_MI16x16x1_SN_LDSB1_GRVWB16_GSU1_GSUC0_GSUWGMRR0_K1_LBSPPB2048_MIWT2_8_NLCA4_SU8_SUM0_SUS256_VWB8_WG64_4_1_WGM8_WGMXCC8_WGMXCCGn1
    SolutionIndex: 126
    SolutionNameMin: Cijk_Alik_Bljk_F8NBS_STA_BH_BiasSB_HAS_SABV_SAV_UserArgs_MT128x112x256_MI16x16x1_SN_LDSB1_GRVWB16_GSU1_GSUC0_GSUWGMRR0_K1_LBSPPB256_MIWT2_7_NLCA4_SU8_SUM0_SUS256_VWB1_WG64_4_1_WGM8_WGMXCC8_WGMXCCGn1
    SolutionIndex: 127
    SolutionNameMin: Cijk_Alik_Bljk_F8NBS_STA_BH_BiasSB_HAS_SABV_SAV_UserArgs_MT128x64x128_MI16x16x1_SN_LDSB0_GRVWB16_GSU1_GSUC0_GSUWGMRR0_K1_LBSPPB512_MIWT2_4_NLCA2_SU8_SUM0_SUS128_VWB4_WG64_4_1_WGM8_WGMXCC8_WGMXCCGn1
    SolutionIndex: 128
    SolutionNameMin: Cijk_Alik_Bljk_F8NBS_STA_BH_BiasSB_HAS_SABV_SAV_UserArgs_MT320x48x256_MI16x16x1_SN_LDSB0_GRVWB16_GSU1_GSUC0_GSUWGMRR0_K1_LBSPPB256_MIWT5_3_NLCA4_SU0_SUM0_SUS0_VWB1_WG64_4_1_WGM6_WGMXCC8_WGMXCCGn1
    SolutionIndex: 129
    SolutionNameMin: Cijk_Alik_Bljk_F8NBS_STA_BH_BiasSB_HAS_SABV_SAV_UserArgs_MT128x128x128_MI16x16x1_SN_LDSB1_GRVWB16_GSU1_GSUC0_GSUWGMRR0_K1_LBSPPB1024_MIWT2_8_NLCA2_SU8_SUM0_SUS128_VWB8_WG64_4_1_WGM8_WGMXCC8_WGMXCCGn1
    SolutionIndex: 130
    SolutionNameMin: Cijk_Alik_Bljk_F8NBS_STA_BH_BiasSB_HAS_SABV_SAV_UserArgs_MT128x96x128_MI16x16x1_SN_LDSB0_GRVWB16_GSU1_GSUC0_GSUWGMRR0_K1_LBSPPB256_MIWT2_6_NLCA2_SU8_SUM0_SUS128_VWB2_WG64_4_1_WGM8_WGMXCC8_WGMXCCGn1
    SolutionIndex: 131
    SolutionNameMin: Cijk_Alik_Bljk_F8NBS_STA_BH_BiasSB_HAS_SABV_SAV_UserArgs_MT320x128x128_MI16x16x1_SN_LDSB0_GRVWB16_GSU1_GSUC0_GSUWGMRR0_K1_LBSPPB1024_MIWT5_8_NLCA2_SU0_SUM0_SUS0_VWB8_WG64_4_1_WGM8_WGMXCC8_WGMXCCGn1
    SolutionIndex: 132
    SolutionNameMin: Cijk_Alik_Bljk_F8NBS_STA_BH_BiasSB_HAS_SABV_SAV_UserArgs_MT320x192x128_MI16x16x1_SN_LDSB0_GRVWB16_GSU1_GSUC0_GSUWGMRR0_K1_LBSPPB512_MIWT5_12_NLCA2_SU0_SUM0_SUS0_VWB4_WG64_4_1_WGM6_WGMXCC8_WGMXCCGn1
    SolutionIndex: 133
    SolutionNameMin: Cijk_Alik_Bljk_F8NBS_STA_BH_BiasSB_HAS_SABV_SAV_UserArgs_MT320x208x128_MI16x16x1_SN_LDSB1_GRVWB8_GSU1_GSUC0_GSUWGMRR0_K1_LBSPPB128_MIWT5_13_NLCA2_SU0_SUM0_SUS0_VWB1_WG64_4_1_WGM6_WGMXCC8_WGMXCCGn1
    SolutionIndex: 134
    SolutionNameMin: Cijk_Alik_Bljk_F8NBS_STA_BH_BiasSB_HAS_SABV_SAV_UserArgs_MT320x192x128_MI16x16x1_SN_LDSB0_GRVWB16_GSU1_GSUC0_GSUWGMRR0_K1_LBSPPB512_MIWT5_12_NLCA2_SU0_SUM0_SUS0_VWB4_WG64_4_1_WGM8_WGMXCC8_WGMXCCGn1
    SolutionIndex: 135
    SolutionNameMin: Cijk_Alik_Bljk_F8NBS_STA_BH_BiasSB_HAS_SABV_SAV_UserArgs_MT512x128x128_MI16x16x1_SN_LDSB0_GRVWB16_GSU1_GSUC0_GSUWGMRR0_K1_LBSPPB1024_MIWT8_8_NLCA2_SU0_SUM0_SUS0_VWB8_WG64_4_1_WGM1_WGMXCC8_WGMXCCGn1
    SolutionIndex: 136
    SolutionNameMin: Cijk_Alik_Bljk_F8NBS_STA_BH_BiasSB_HAS_SABV_SAV_UserArgs_MT256x256x128_MI16x16x1_SN_LDSB1_GRVWB16_GSU1_GSUC0_GSUWGMRR0_K1_LBSPPB2048_MIWT4_16_NLCA2_SU0_SUM0_SUS0_VWB16_WG64_4_1_WGM1_WGMXCC8_WGMXCCGn1
    SolutionIndex: 137
    SolutionNameMin: Cijk_Alik_Bljk_F8NBS_STA_BH_BiasSB_HAS_SABV_SAV_UserArgs_MT192x128x128_MI16x16x1_SN_LDSB1_GRVWB16_GSU1_GSUC0_GSUWGMRR0_K1_LBSPPB1024_MIWT3_8_NLCA2_SU0_SUM0_SUS0_VWB8_WG64_4_1_WGM6_WGMXCC8_WGMXCCGn1
    SolutionIndex: 138
    SolutionNameMin: Cijk_Alik_Bljk_F8NBS_STA_BH_BiasSB_HAS_SABV_SAV_UserArgs_MT16x16x512_MI16x16x1_SN_LDSB0_GRVWB16_GSU1_GSUAMB_GSUC1_GSUWGMRR1_K1_LBSPPB512_MIWT1_1_NTA0_NLCA8_SU0_SUM0_SUS0_VWB1_WG16_4_1_WGM1_WGMXCC8_WGMXCCGn1
    SolutionIndex: 139
    SolutionNameMin: Cijk_Alik_Bljk_F8NBS_STA_BH_BiasSB_HAS_SABV_SAV_UserArgs_MT32x16x512_MI16x16x1_SN_LDSB0_GRVWB16_GSU1_GSUAMB_GSUC1_GSUWGMRR1_K1_LBSPPB512_MIWT1_1_NTA0_NLCA8_SU0_SUM0_SUS0_VWB1_WG32_4_1_WGM1_WGMXCC8_WGMXCCGn1
    SolutionIndex: 140
    SolutionNameMin: Cijk_Alik_Bljk_F8NBS_STA_BH_BiasSB_HAS_SABV_SAV_UserArgs_MT64x32x512_MI16x16x1_SN_LDSB1_GRVWB16_GSU1_GSUAMB_GSUC1_GSUWGMRR1_K1_LBSPPB1024_MIWT1_2_NTA0_NLCA8_SU0_SUM0_SUS0_VWB2_WG64_4_1_WGM1_WGMXCC8_WGMXCCGn1
    SolutionIndex: 141
    SolutionNameMin: Cijk_Alik_Bljk_F8NBS_STA_BH_BiasSB_HAS_SABV_SAV_UserArgs_MT128x32x512_MI16x16x1_SN_LDSB1_GRVWB16_GSU1_GSUAMB_GSUC1_GSUWGMRR1_K1_LBSPPB1024_MIWT2_2_NTA0_NLCA8_SU0_SUM0_SUS0_VWB2_WG64_4_1_WGM1_WGMXCC8_WGMXCCGn1
    SolutionIndex: 142
    SolutionNameMin: Cijk_Alik_Bljk_F8NBS_STA_BH_BiasSB_HAS_SABV_SAV_UserArgs_MT128x32x256_MI16x16x1_SN_LDSB0_GRVWB16_GSU1_GSUAMB_GSUC1_GSUWGMRR1_K1_LBSPPB512_MIWT2_2_NTA0_NLCA4_SU0_SUM0_SUS0_VWB2_WG64_4_1_WGM1_WGMXCC8_WGMXCCGn1
    SolutionIndex: 143
    SolutionNameMin: Cijk_Alik_Bljk_F8NBS_STA_BH_BiasSB_HAS_SABV_SAV_UserArgs_MT64x16x1024_MI16x16x1_SN_LDSB1_GRVWB16_GSU1_GSUAMB_GSUC1_GSUWGMRR1_K1_LBSPPB1024_MIWT1_1_NTA0_NLCA16_SU0_SUM0_SUS0_VWB1_WG64_4_1_WGM1_WGMXCC8_WGMXCCGn1
    SolutionIndex: 144
    SolutionNameMin: Cijk_Alik_Bljk_F8NBS_STA_BH_BiasSB_HAS_SABV_SAV_UserArgs_MT64x32x256_MI16x16x1_SN_LDSB0_GRVWB16_GSU1_GSUAMB_GSUC1_GSUWGMRR1_K1_LBSPPB512_MIWT1_2_NTA0_NLCA4_SU0_SUM0_SUS0_VWB2_WG64_4_1_WGM1_WGMXCC8_WGMXCCGn1
    SolutionIndex: 145
    SolutionNameMin: Cijk_Alik_Bljk_F8NBS_STA_BH_BiasSB_HAS_SABV_SAV_UserArgs_MT64x16x1024_MI16x16x1_SN_LDSB1_GRVWB16_GSU1_GSUC0_GSUWGMRR0_K1_LBSPPB1024_MIWT1_1_NLCA16_SU8_SUM0_SUS1024_VWB1_WG64_4_1_WGM6_WGMXCC8_WGMXCCGn1
    SolutionIndex: 146
    SolutionNameMin: Cijk_Alik_Bljk_F8NBS_STA_BH_BiasSB_HAS_SABV_SAV_UserArgs_MT64x16x1024_MI16x16x1_SN_LDSB1_GRVWB16_GSU1_GSUC0_GSUWGMRR0_K1_LBSPPB1024_MIWT1_1_NLCA16_SU8_SUM0_SUS1024_VWB1_WG64_4_1_WGM8_WGMXCC8_WGMXCCGn1
    SolutionIndex: 147
    SolutionNameMin: Cijk_Alik_Bljk_F8NBS_STA_BH_BiasSB_HAS_SABV_SAV_UserArgs_MT64x16x512_MI16x16x1_SN_LDSB0_GRVWB16_GSU1_GSUC0_GSUWGMRR0_K1_LBSPPB512_MIWT1_1_NLCA8_SU8_SUM0_SUS512_VWB1_WG64_4_1_WGM8_WGMXCC8_WGMXCCGn1
    SolutionIndex: 148
    SolutionNameMin: Cijk_Alik_Bljk_F8NBS_STA_BH_BiasSB_HAS_SABV_SAV_UserArgs_MT64x16x512_MI16x16x1_SN_LDSB0_GRVWB16_GSU1_GSUC0_GSUWGMRR0_K1_LBSPPB512_MIWT1_1_NLCA8_SU8_SUM0_SUS512_VWB1_WG64_4_1_WGM6_WGMXCC8_WGMXCCGn1
    SolutionIndex: 149
    SolutionNameMin: Cijk_Alik_Bljk_F8NBS_STA_BH_BiasSB_HAS_SABV_SAV_UserArgs_MT32x32x512_MI16x16x1_SN_LDSB1_GRVWB16_GSU1_GSUC0_GSUWGMRR0_K1_LBSPPB1024_MIWT1_2_NLCA8_SU8_SUM0_SUS512_VWB2_WG32_4_1_WGM6_WGMXCC8_WGMXCCGn1
    SolutionIndex: 150
    SolutionNameMin: Cijk_Alik_Bljk_F8NBS_STA_BH_BiasSB_HAS_SABV_SAV_UserArgs_MT64x32x512_MI16x16x1_SN_LDSB1_GRVWB16_GSU1_GSUC0_GSUWGMRR0_K1_LBSPPB1024_MIWT2_2_NLCA8_SU0_SUM0_SUS0_VWB2_WG32_4_1_WGM8_WGMXCC8_WGMXCCGn1
    SolutionIndex: 151
    SolutionNameMin: Cijk_Alik_Bljk_F8NBS_STA_BH_BiasSB_HAS_SABV_SAV_UserArgs_MT128x32x512_MI16x16x1_SN_LDSB1_GRVWB16_GSU1_GSUC0_GSUWGMRR0_K1_LBSPPB1024_MIWT2_2_NLCA8_SU0_SUM0_SUS0_VWB2_WG64_4_1_WGM1_WGMXCC8_WGMXCCGn1
    SolutionIndex: 152
    SolutionNameMin: Cijk_Alik_Bljk_F8NBS_STA_BH_BiasSB_HAS_SABV_SAV_UserArgs_MT128x48x256_MI16x16x1_SN_LDSB0_GRVWB16_GSU1_GSUC0_GSUWGMRR0_K1_LBSPPB256_MIWT2_3_NLCA4_SU8_SUM0_SUS256_VWB1_WG64_4_1_WGM1_WGMXCC8_WGMXCCGn1
    SolutionIndex: 153
    SolutionNameMin: Cijk_Alik_Bljk_F8NBS_STA_BH_BiasSB_HAS_SABV_SAV_UserArgs_MT128x64x256_MI16x16x1_SN_LDSB1_GRVWB16_GSU1_GSUC0_GSUWGMRR0_K1_LBSPPB1024_MIWT2_4_NLCA4_SU8_SUM0_SUS256_VWB4_WG64_4_1_WGM1_WGMXCC8_WGMXCCGn1
    SolutionIndex: 154
    SolutionNameMin: Cijk_Alik_Bljk_F8NBS_STA_BH_BiasSB_HAS_SABV_SAV_UserArgs_MT128x48x256_MI16x16x1_SN_LDSB0_GRVWB16_GSU1_GSUC0_GSUWGMRR0_K1_LBSPPB256_MIWT2_3_NLCA4_SU0_SUM0_SUS0_VWB1_WG64_4_1_WGM1_WGMXCC8_WGMXCCGn1
    SolutionIndex: 155
    SolutionNameMin: Cijk_Alik_Bljk_F8NBS_STA_BH_BiasSB_HAS_SABV_SAV_UserArgs_MT128x64x256_MI16x16x1_SN_LDSB1_GRVWB16_GSU1_GSUC0_GSUWGMRR0_K1_LBSPPB1024_MIWT2_4_NLCA4_SU0_SUM0_SUS0_VWB4_WG64_4_1_WGM1_WGMXCC8_WGMXCCGn1
    SolutionIndex: 156
    SolutionNameMin: Cijk_Alik_Bljk_F8NBS_STA_BH_BiasSB_HAS_SABV_SAV_UserArgs_MT128x80x256_MI16x16x1_SN_LDSB1_GRVWB16_GSU1_GSUC0_GSUWGMRR0_K1_LBSPPB256_MIWT2_5_NLCA4_SU0_SUM0_SUS0_VWB1_WG64_4_1_WGM1_WGMXCC8_WGMXCCGn1
    SolutionIndex: 157
    SolutionNameMin: Cijk_Alik_Bljk_F8NBS_STA_BH_BiasSB_HAS_SABV_SAV_UserArgs_MT128x96x256_MI16x16x1_SN_LDSB1_GRVWB16_GSU1_GSUC0_GSUWGMRR0_K1_LBSPPB512_MIWT2_6_NLCA4_SU8_SUM0_SUS256_VWB2_WG64_4_1_WGM1_WGMXCC8_WGMXCCGn1
    SolutionIndex: 158
    SolutionNameMin: Cijk_Alik_Bljk_F8NBS_STA_BH_BiasSB_HAS_SABV_SAV_UserArgs_MT128x96x256_MI16x16x1_SN_LDSB1_GRVWB16_GSU1_GSUC0_GSUWGMRR0_K1_LBSPPB512_MIWT2_6_NLCA4_SU0_SUM0_SUS0_VWB2_WG64_4_1_WGM1_WGMXCC8_WGMXCCGn1
    SolutionIndex: 159
    SolutionNameMin: Cijk_Alik_Bljk_F8NBS_STA_BH_BiasSB_HAS_SABV_SAV_UserArgs_MT128x96x256_MI16x16x1_SN_LDSB1_GRVWB16_GSU1_GSUC0_GSUWGMRR0_K1_LBSPPB512_MIWT2_6_NLCA4_SU8_SUM0_SUS256_VWB2_WG64_4_1_WGM6_WGMXCC8_WGMXCCGn1
    SolutionIndex: 160
    SolutionNameMin: Cijk_Alik_Bljk_F8NBS_STA_BH_BiasSB_HAS_SABV_SAV_UserArgs_MT128x112x256_MI16x16x1_SN_LDSB1_GRVWB16_GSU1_GSUC0_GSUWGMRR0_K1_LBSPPB256_MIWT2_7_NLCA4_SU0_SUM0_SUS0_VWB1_WG64_4_1_WGM1_WGMXCC8_WGMXCCGn1
    SolutionIndex: 161
    SolutionNameMin: Cijk_Alik_Bljk_F8NBS_STA_BH_BiasSB_HAS_SABV_SAV_UserArgs_MT128x128x256_MI16x16x1_SN_LDSB1_GRVWB16_GSU1_GSUC0_GSUWGMRR0_K1_LBSPPB2048_MIWT2_8_NLCA4_SU0_SUM0_SUS0_VWB8_WG64_4_1_WGM1_WGMXCC8_WGMXCCGn1
    SolutionIndex: 162
    SolutionNameMin: Cijk_Alik_Bljk_F8NBS_STA_BH_BiasSB_HAS_SABV_SAV_UserArgs_MT192x96x128_MI16x16x1_SN_LDSB0_GRVWB16_GSU1_GSUC0_GSUWGMRR0_K1_LBSPPB256_MIWT3_6_NLCA2_SU0_SUM0_SUS0_VWB2_WG64_4_1_WGM1_WGMXCC8_WGMXCCGn1
    SolutionIndex: 163
    SolutionNameMin: Cijk_Alik_Bljk_F8NBS_STA_BH_BiasSB_HAS_SABV_SAV_UserArgs_MT128x160x128_MI16x16x1_SN_LDSB1_GRVWB16_GSU1_GSUC0_GSUWGMRR0_K1_LBSPPB256_MIWT2_10_NLCA2_SU0_SUM0_SUS0_VWB2_WG64_4_1_WGM1_WGMXCC8_WGMXCCGn1
    SolutionIndex: 164
    SolutionNameMin: Cijk_Alik_Bljk_F8NBS_STA_BH_BiasSB_HAS_SABV_SAV_UserArgs_MT320x64x128_MI16x16x1_SN_LDSB0_GRVWB16_GSU1_GSUC0_GSUWGMRR0_K1_LBSPPB512_MIWT5_4_NLCA2_SU0_SUM0_SUS0_VWB4_WG64_4_1_WGM1_WGMXCC8_WGMXCCGn1
    SolutionIndex: 165
    SolutionNameMin: Cijk_Alik_Bljk_F8NBS_STA_BH_BiasSB_HAS_SABV_SAV_UserArgs_MT448x64x128_MI16x16x1_SN_LDSB0_GRVWB16_GSU1_GSUC0_GSUWGMRR0_K1_LBSPPB512_MIWT7_4_NLCA2_SU0_SUM0_SUS0_VWB4_WG64_4_1_WGM1_WGMXCC8_WGMXCCGn1
    SolutionIndex: 166
    SolutionNameMin: Cijk_Alik_Bljk_F8NBS_STA_BH_BiasSB_HAS_SABV_SAV_UserArgs_MT448x64x128_MI16x16x1_SN_LDSB0_GRVWB16_GSU1_GSUC0_GSUWGMRR0_K1_LBSPPB512_MIWT7_4_NLCA2_SU0_SUM0_SUS0_VWB4_WG64_4_1_WGM6_WGMXCC8_WGMXCCGn1
    SolutionIndex: 167
    SolutionNameMin: Cijk_Alik_Bljk_F8NBS_STA_BH_BiasSB_HAS_SABV_SAV_UserArgs_MT16x16x128_MI16x16x1_SN_LDSB0_GRVWB16_GSU1_GSUC0_GSUWGMRR0_K1_LBSPPB128_MIWT1_1_NLCA2_SU8_SUM0_SUS128_VWB1_WG16_4_1_WGM1_WGMXCC8_WGMXCCGn1
    SolutionIndex: 168
    SolutionNameMin: Cijk_Alik_Bljk_F8NBS_STA_BH_BiasSB_HAS_SABV_SAV_UserArgs_MT64x16x128_MI16x16x1_SN_LDSB0_GRVWB8_GSU1_GSUC0_GSUWGMRR0_K1_LBSPPB128_MIWT1_1_NLCA2_SU0_SUM0_SUS0_VWB1_WG64_4_1_WGM1_WGMXCC8_WGMXCCGn1
    SolutionIndex: 169
    SolutionNameMin: Cijk_Alik_Bljk_F8NBS_STA_BH_BiasSB_HAS_SABV_SAV_UserArgs_MT64x16x128_MI16x16x1_SN_LDSB0_GRVWB8_GSU1_GSUC0_GSUWGMRR0_K1_LBSPPB128_MIWT1_1_NLCA2_SU8_SUM0_SUS128_VWB1_WG64_4_1_WGM8_WGMXCC8_WGMXCCGn1
    SolutionIndex: 170
    SolutionNameMin: Cijk_Alik_Bljk_F8NBS_STA_BH_BiasSB_HAS_SABV_SAV_UserArgs_MT32x16x128_MI16x16x1_SN_LDSB0_GRVWB16_GSU1_GSUC0_GSUWGMRR0_K1_LBSPPB128_MIWT1_1_NLCA2_SU0_SUM0_SUS0_VWB1_WG32_4_1_WGM1_WGMXCC8_WGMXCCGn1
    SolutionIndex: 171
    SolutionNameMin: Cijk_Alik_Bljk_F8NBS_STA_BH_BiasSB_HAS_SABV_SAV_UserArgs_MT64x16x128_MI16x16x1_SN_LDSB0_GRVWB8_GSU1_GSUC0_GSUWGMRR0_K1_LBSPPB128_MIWT1_1_NLCA2_SU8_SUM0_SUS128_VWB1_WG64_4_1_WGM6_WGMXCC8_WGMXCCGn1
    SolutionIndex: 172
    SolutionNameMin: Cijk_Alik_Bljk_F8NBS_STA_BH_BiasSB_HAS_SABV_SAV_UserArgs_MT64x16x128_MI16x16x1_SN_LDSB0_GRVWB16_GSU1_GSUC0_GSUWGMRR0_K1_LBSPPB128_MIWT2_1_NLCA2_SU8_SUM0_SUS128_VWB1_WG32_4_1_WGM8_WGMXCC8_WGMXCCGn1
    SolutionIndex: 173
    SolutionNameMin: Cijk_Alik_Bljk_F8NBS_STA_BH_BiasSB_HAS_SABV_SAV_UserArgs_MT64x32x128_MI16x16x1_SN_LDSB0_GRVWB16_GSU1_GSUC0_GSUWGMRR0_K1_LBSPPB256_MIWT1_2_NLCA2_SU8_SUM0_SUS128_VWB2_WG64_4_1_WGM8_WGMXCC8_WGMXCCGn1
    SolutionIndex: 174
    SolutionNameMin: Cijk_Alik_Bljk_F8NBS_STA_BH_BiasSB_HAS_SABV_SAV_UserArgs_MT64x32x128_MI16x16x1_SN_LDSB0_GRVWB16_GSU1_GSUC0_GSUWGMRR0_K1_LBSPPB256_MIWT1_2_NLCA2_SU8_SUM0_SUS128_VWB2_WG64_4_1_WGM6_WGMXCC8_WGMXCCGn1
    SolutionIndex: 175
    SolutionNameMin: Cijk_Alik_Bljk_F8NBS_STA_BH_BiasSB_HAS_SABV_SAV_UserArgs_MT64x32x128_MI16x16x1_SN_LDSB0_GRVWB16_GSU1_GSUC0_GSUWGMRR0_K1_LBSPPB256_MIWT1_2_NLCA2_SU0_SUM0_SUS0_VWB2_WG64_4_1_WGM6_WGMXCC8_WGMXCCGn1
    SolutionIndex: 176
    SolutionNameMin: Cijk_Alik_Bljk_F8NBS_STA_BH_BiasSB_HAS_SABV_SAV_UserArgs_MT64x32x128_MI16x16x1_SN_LDSB0_GRVWB16_GSU1_GSUC0_GSUWGMRR0_K1_LBSPPB256_MIWT1_2_NLCA2_SU0_SUM0_SUS0_VWB2_WG64_4_1_WGM8_WGMXCC8_WGMXCCGn1
    SolutionIndex: 177
    SolutionNameMin: Cijk_Alik_Bljk_F8NBS_STA_BH_BiasSB_HAS_SABV_SAV_UserArgs_MT128x32x128_MI16x16x1_SN_LDSB0_GRVWB16_GSU1_GSUC0_GSUWGMRR0_K1_LBSPPB256_MIWT2_2_NLCA2_SU8_SUM0_SUS128_VWB2_WG64_4_1_WGM8_WGMXCC8_WGMXCCGn1
    SolutionIndex: 178
    SolutionNameMin: Cijk_Alik_Bljk_F8NBS_STA_BH_BiasSB_HAS_SABV_SAV_UserArgs_MT128x48x128_MI16x16x1_SN_LDSB0_GRVWB8_GSU1_GSUC0_GSUWGMRR0_K1_LBSPPB128_MIWT2_3_NLCA2_SU8_SUM0_SUS128_VWB1_WG64_4_1_WGM8_WGMXCC8_WGMXCCGn1
    SolutionIndex: 179
    SolutionNameMin: Cijk_Alik_Bljk_F8NBS_STA_BH_BiasSB_HAS_SABV_SAV_UserArgs_MT128x32x128_MI16x16x1_SN_LDSB0_GRVWB16_GSU1_GSUC0_GSUWGMRR0_K1_LBSPPB256_MIWT2_2_NLCA2_SU0_SUM0_SUS0_VWB2_WG64_4_1_WGM8_WGMXCC8_WGMXCCGn1
    SolutionIndex: 180
    SolutionNameMin: Cijk_Alik_Bljk_F8NBS_STA_BH_BiasSB_HAS_SABV_SAV_UserArgs_MT64x48x128_MI16x16x1_SN_LDSB0_GRVWB8_GSU1_GSUC0_GSUWGMRR0_K1_LBSPPB128_MIWT1_3_NLCA2_SU0_SUM0_SUS0_VWB1_WG64_4_1_WGM8_WGMXCC8_WGMXCCGn1
    SolutionIndex: 181
    SolutionNameMin: Cijk_Alik_Bljk_F8NBS_STA_BH_BiasSB_HAS_SABV_SAV_UserArgs_MT128x64x128_MI16x16x1_SN_LDSB0_GRVWB16_GSU1_GSUC0_GSUWGMRR0_K1_LBSPPB512_MIWT2_4_NLCA2_SU0_SUM0_SUS0_VWB4_WG64_4_1_WGM8_WGMXCC8_WGMXCCGn1
    SolutionIndex: 182
    SolutionNameMin: Cijk_Alik_Bljk_F8NBS_STA_BH_BiasSB_HAS_SABV_SAV_UserArgs_MT192x32x128_MI16x16x1_SN_LDSB0_GRVWB16_GSU1_GSUC0_GSUWGMRR0_K1_LBSPPB256_MIWT3_2_NLCA2_SU0_SUM0_SUS0_VWB2_WG64_4_1_WGM8_WGMXCC8_WGMXCCGn1
    SolutionIndex: 183
    SolutionNameMin: Cijk_Alik_Bljk_F8NBS_STA_BH_BiasSB_HAS_SABV_SAV_UserArgs_MT320x32x128_MI16x16x1_SN_LDSB0_GRVWB16_GSU1_GSUC0_GSUWGMRR0_K1_LBSPPB256_MIWT5_2_NLCA2_SU0_SUM0_SUS0_VWB2_WG64_4_1_WGM6_WGMXCC8_WGMXCCGn1
    SolutionIndex: 184
    SolutionNameMin: Cijk_Alik_Bljk_F8NBS_STA_BH_BiasSB_HAS_SABV_SAV_UserArgs_MT128x96x128_MI16x16x1_SN_LDSB0_GRVWB16_GSU1_GSUC0_GSUWGMRR0_K1_LBSPPB256_MIWT2_6_NLCA2_SU0_SUM0_SUS0_VWB2_WG64_4_1_WGM8_WGMXCC8_WGMXCCGn1
    SolutionIndex: 185
    SolutionNameMin: Cijk_Alik_Bljk_F8NBS_STA_BH_BiasSB_HAS_SABV_SAV_UserArgs_MT320x32x128_MI16x16x1_SN_LDSB0_GRVWB16_GSU1_GSUC0_GSUWGMRR0_K1_LBSPPB256_MIWT5_2_NLCA2_SU0_SUM0_SUS0_VWB2_WG64_4_1_WGM8_WGMXCC8_WGMXCCGn1
    SolutionIndex: 186
    SolutionNameMin: Cijk_Alik_Bljk_F8NBS_STA_BH_BiasSB_HAS_SABV_SAV_UserArgs_MT128x128x128_MI16x16x1_SN_LDSB1_GRVWB16_GSU1_GSUC0_GSUWGMRR0_K1_LBSPPB1024_MIWT2_8_NLCA2_SU0_SUM0_SUS0_VWB8_WG64_4_1_WGM6_WGMXCC8_WGMXCCGn1
    SolutionIndex: 187
    SolutionNameMin: Cijk_Alik_Bljk_F8NBS_STA_BH_BiasSB_HAS_SABV_SAV_UserArgs_MT320x64x128_MI16x16x1_SN_LDSB0_GRVWB16_GSU1_GSUC0_GSUWGMRR0_K1_LBSPPB512_MIWT5_4_NLCA2_SU8_SUM0_SUS128_VWB4_WG64_4_1_WGM6_WGMXCC8_WGMXCCGn1
    SolutionIndex: 188
    SolutionNameMin: Cijk_Alik_Bljk_F8NBS_STA_BH_BiasSB_HAS_SABV_SAV_UserArgs_MT128x128x128_MI16x16x1_SN_LDSB1_GRVWB16_GSU1_GSUC0_GSUWGMRR0_K1_LBSPPB1024_MIWT2_8_NLCA2_SU0_SUM0_SUS0_VWB8_WG64_4_1_WGM1_WGMXCC8_WGMXCCGn1
    SolutionIndex: 189
    SolutionNameMin: Cijk_Alik_Bljk_F8NBS_STA_BH_BiasSB_HAS_SABV_SAV_UserArgs_MT128x128x128_MI16x16x1_SN_LDSB1_GRVWB16_GSU1_GSUC0_GSUWGMRR0_K1_LBSPPB1024_MIWT2_8_NLCA2_SU0_SUM0_SUS0_VWB8_WG64_4_1_WGM8_WGMXCC8_WGMXCCGn1
    SolutionIndex: 190
    SolutionNameMin: Cijk_Alik_Bljk_F8NBS_STA_BH_BiasSB_HAS_SABV_SAV_UserArgs_MT128x128x128_MI16x16x1_SN_LDSB1_GRVWB16_GSU1_GSUC0_GSUWGMRR0_K1_LBSPPB1024_MIWT2_8_NLCA2_SU8_SUM0_SUS128_VWB8_WG64_4_1_WGM1_WGMXCC8_WGMXCCGn1
    SolutionIndex: 191
    SolutionNameMin: Cijk_Alik_Bljk_F8NBS_STA_BH_BiasSB_HAS_SABV_SAV_UserArgs_MT256x96x128_MI16x16x1_SN_LDSB0_GRVWB16_GSU1_GSUC0_GSUWGMRR0_K1_LBSPPB256_MIWT4_6_NLCA2_SU8_SUM0_SUS128_VWB2_WG64_4_1_WGM1_WGMXCC8_WGMXCCGn1
    SolutionIndex: 192
    SolutionNameMin: Cijk_Alik_Bljk_F8NBS_STA_BH_BiasSB_HAS_SABV_SAV_UserArgs_MT256x64x128_MI16x16x1_SN_LDSB0_GRVWB16_GSU1_GSUC0_GSUWGMRR0_K1_LBSPPB512_MIWT4_4_NLCA2_SU0_SUM0_SUS0_VWB4_WG64_4_1_WGM1_WGMXCC8_WGMXCCGn1
    SolutionIndex: 193
    SolutionNameMin: Cijk_Alik_Bljk_F8NBS_STA_BH_BiasSB_HAS_SABV_SAV_UserArgs_MT320x80x128_MI16x16x1_SN_LDSB0_GRVWB8_GSU1_GSUC0_GSUWGMRR0_K1_LBSPPB128_MIWT5_5_NLCA2_SU0_SUM0_SUS0_VWB1_WG64_4_1_WGM1_WGMXCC8_WGMXCCGn1
    SolutionIndex: 194
    SolutionNameMin: Cijk_Alik_Bljk_F8NBS_STA_BH_BiasSB_HAS_SABV_SAV_UserArgs_MT128x112x256_MI16x16x1_SN_LDSB1_GRVWB16_GSU1_GSUC0_GSUWGMRR0_K1_LBSPPB256_MIWT2_7_NLCA4_SU8_SUM0_SUS256_VWB1_WG64_4_1_WGM1_WGMXCC8_WGMXCCGn1
    SolutionIndex: 195
    SolutionNameMin: Cijk_Alik_Bljk_F8NBS_STA_BH_BiasSB_HAS_SABV_SAV_UserArgs_MT256x64x256_MI16x16x1_SN_LDSB1_GRVWB16_GSU1_GSUC0_GSUWGMRR0_K1_LBSPPB1024_MIWT4_4_NLCA4_SU0_SUM0_SUS0_VWB4_WG64_4_1_WGM1_WGMXCC8_WGMXCCGn1
    SolutionIndex: 196
    SolutionNameMin: Cijk_Alik_Bljk_F8NBS_STA_BH_BiasSB_HAS_SABV_SAV_UserArgs_MT256x80x256_MI16x16x1_SN_LDSB1_GRVWB16_GSU1_GSUC0_GSUWGMRR0_K1_LBSPPB256_MIWT4_5_NLCA4_SU0_SUM0_SUS0_VWB1_WG64_4_1_WGM8_WGMXCC8_WGMXCCGn1
    SolutionIndex: 197
    SolutionNameMin: Cijk_Alik_Bljk_F8NBS_STA_BH_BiasSB_HAS_SABV_SAV_UserArgs_MT64x32x256_MI16x16x1_SN_LDSB0_GRVWB16_GSU1_GSUC0_GSUWGMRR0_K1_LBSPPB512_MIWT1_2_NLCA4_SU0_SUM0_SUS0_VWB2_WG64_4_1_WGM6_WGMXCC8_WGMXCCGn1
    SolutionIndex: 198
    SolutionNameMin: Cijk_Alik_Bljk_F8NBS_STA_BH_BiasSB_HAS_SABV_SAV_UserArgs_MT128x32x256_MI16x16x1_SN_LDSB0_GRVWB16_GSU1_GSUC0_GSUWGMRR0_K1_LBSPPB512_MIWT2_2_NLCA4_SU0_SUM0_SUS0_VWB2_WG64_4_1_WGM6_WGMXCC8_WGMXCCGn1
    SolutionIndex: 199
    SolutionNameMin: Cijk_Alik_Bljk_F8NBS_STA_BH_BiasSB_HAS_SABV_SAV_UserArgs_MT64x32x256_MI16x16x1_SN_LDSB0_GRVWB16_GSU1_GSUC0_GSUWGMRR0_K1_LBSPPB512_MIWT1_2_NLCA4_SU0_SUM0_SUS0_VWB2_WG64_4_1_WGM8_WGMXCC8_WGMXCCGn1
    SolutionIndex: 200
    SolutionNameMin: Cijk_Alik_Bljk_F8NBS_STA_BH_BiasSB_HAS_SABV_SAV_UserArgs_MT128x32x256_MI16x16x1_SN_LDSB0_GRVWB16_GSU1_GSUC0_GSUWGMRR0_K1_LBSPPB512_MIWT2_2_NLCA4_SU0_SUM0_SUS0_VWB2_WG64_4_1_WGM8_WGMXCC8_WGMXCCGn1
    SolutionIndex: 201
    SolutionNameMin: Cijk_Alik_Bljk_F8NBS_STA_BH_BiasSB_HAS_SABV_SAV_UserArgs_MT64x48x256_MI16x16x1_SN_LDSB0_GRVWB16_GSU1_GSUC0_GSUWGMRR0_K1_LBSPPB256_MIWT1_3_NLCA4_SU0_SUM0_SUS0_VWB1_WG64_4_1_WGM6_WGMXCC8_WGMXCCGn1
    SolutionIndex: 202
    SolutionNameMin: Cijk_Alik_Bljk_F8NBS_STA_BH_BiasSB_HAS_SABV_SAV_UserArgs_MT64x48x256_MI16x16x1_SN_LDSB0_GRVWB16_GSU1_GSUC0_GSUWGMRR0_K1_LBSPPB256_MIWT1_3_NLCA4_SU0_SUM0_SUS0_VWB1_WG64_4_1_WGM8_WGMXCC8_WGMXCCGn1
    SolutionIndex: 203
    SolutionNameMin: Cijk_Alik_Bljk_F8NBS_STA_BH_BiasSB_HAS_SABV_SAV_UserArgs_MT128x64x128_MI16x16x1_SN_LDSB0_GRVWB16_GSU1_GSUC0_GSUWGMRR0_K1_LBSPPB512_MIWT2_4_NLCA2_SU0_SUM0_SUS0_VWB4_WG64_4_1_WGM6_WGMXCC8_WGMXCCGn1
    SolutionIndex: 204
    SolutionNameMin: Cijk_Alik_Bljk_F8NBS_STA_BH_BiasSB_HAS_SABV_SAV_UserArgs_MT128x96x128_MI16x16x1_SN_LDSB0_GRVWB16_GSU1_GSUC0_GSUWGMRR0_K1_LBSPPB256_MIWT2_6_NLCA2_SU0_SUM0_SUS0_VWB2_WG64_4_1_WGM6_WGMXCC8_WGMXCCGn1
    SolutionIndex: 205
    SolutionNameMin: Cijk_Alik_Bljk_F8NBS_STA_BH_BiasSB_HAS_SABV_SAV_UserArgs_MT320x48x128_MI16x16x1_SN_LDSB0_GRVWB8_GSU1_GSUC0_GSUWGMRR0_K1_LBSPPB128_MIWT5_3_NLCA2_SU0_SUM0_SUS0_VWB1_WG64_4_1_WGM6_WGMXCC8_WGMXCCGn1
    SolutionIndex: 206
    SolutionNameMin: Cijk_Alik_Bljk_F8NBS_STA_BH_BiasSB_HAS_SABV_SAV_UserArgs_MT256x64x128_MI16x16x1_SN_LDSB0_GRVWB16_GSU1_GSUC0_GSUWGMRR0_K1_LBSPPB512_MIWT4_4_NLCA2_SU8_SUM0_SUS128_VWB4_WG64_4_1_WGM8_WGMXCC8_WGMXCCGn1
    SolutionIndex: 207
    SolutionNameMin: Cijk_Alik_Bljk_F8NBS_STA_BH_BiasSB_HAS_SABV_SAV_UserArgs_MT256x80x128_MI16x16x1_SN_LDSB0_GRVWB8_GSU1_GSUC0_GSUWGMRR0_K1_LBSPPB128_MIWT4_5_NLCA2_SU0_SUM0_SUS0_VWB1_WG64_4_1_WGM8_WGMXCC8_WGMXCCGn1
- - - [2048, 16, 1, 5120]
    - [9, 18.99]
  - - [2048, 32, 1, 5120]
    - [9, 36.19]
  - - [2048, 48, 1, 5120]
    - [5, 45.49]
  - - [2048, 64, 1, 5120]
    - [7, 55.96]
  - - [2048, 80, 1, 5120]
    - [7, 62.05]
  - - [2048, 96, 1, 5120]
    - [7, 74.46]
  - - [2048, 112, 1, 5120]
    - [7, 78.18]
  - - [2048, 128, 1, 5120]
    - [7, 91.08]
  - - [2048, 144, 1, 5120]
    - [6, 91.57]
  - - [2048, 160, 1, 5120]
    - [8, 98.77]
  - - [4096, 16, 1, 5120]
    - [19, 33.62]
  - - [4096, 32, 1, 5120]
    - [17, 54.46]
  - - [4096, 48, 1, 5120]
    - [7, 64.24]
  - - [4096, 64, 1, 5120]
    - [8, 86.4]
  - - [4096, 80, 1, 5120]
    - [6, 89.43]
  - - [4096, 96, 1, 5120]
    - [6, 108.21]
  - - [4096, 112, 1, 5120]
    - [0, 108.23]
  - - [4096, 128, 1, 5120]
    - [0, 123.45]
  - - [4096, 144, 1, 5120]
    - [0, 136.81]
  - - [4096, 160, 1, 5120]
    - [0, 136.04]
  - - [16384, 16, 1, 5120]
    - [16, 57.61]
  - - [16384, 32, 1, 5120]
    - [18, 105.0]
  - - [16384, 48, 1, 5120]
    - [11, 137.54]
  - - [16384, 64, 1, 5120]
    - [12, 162.23]
  - - [16384, 80, 1, 5120]
    - [3, 172.38]
  - - [16384, 96, 1, 5120]
    - [13, 194.64]
  - - [16384, 112, 1, 5120]
    - [14, 202.94]
  - - [16384, 128, 1, 5120]
    - [15, 216.56]
  - - [16384, 144, 1, 5120]
    - [4, 218.26]
  - - [16384, 160, 1, 5120]
    - [10, 245.29]
  - - [5120, 16, 1, 8192]
    - [19, 42.65]
  - - [5120, 32, 1, 8192]
    - [17, 69.13]
  - - [5120, 48, 1, 8192]
    - [6, 81.84]
  - - [5120, 64, 1, 8192]
    - [8, 101.93]
  - - [5120, 80, 1, 8192]
    - [6, 110.85]
  - - [5120, 96, 1, 8192]
    - [6, 131.57]
  - - [5120, 112, 1, 8192]
    - [0, 131.1]
  - - [5120, 128, 1, 8192]
    - [0, 147.61]
  - - [5120, 144, 1, 8192]
    - [0, 165.15]
  - - [5120, 160, 1, 8192]
    - [4, 165.03]
  - - [5120, 176, 1, 8192]
    - [1, 170.2]
  - - [5120, 192, 1, 8192]
    - [2, 189.68]
  - - [5120, 208, 1, 8192]
    - [4, 185.92]
  - - [5120, 224, 1, 8192]
    - [4, 196.36]
  - - [5120, 240, 1, 8192]
    - [4, 216.64]
  - - [5120, 256, 1, 8192]
    - [2, 222.52]
  - - [2048, 176, 1, 5120]
    - [20, 128.85]
  - - [2048, 192, 1, 5120]
    - [21, 140.39]
  - - [2048, 208, 1, 5120]
    - [21, 141.7]
  - - [2048, 224, 1, 5120]
    - [21, 151.99]
  - - [2048, 240, 1, 5120]
    - [21, 152.34]
  - - [2048, 256, 1, 5120]
    - [21, 166.84]
  - - [2048, 272, 1, 5120]
    - [20, 163.49]
  - - [2048, 288, 1, 5120]
    - [20, 173.19]
  - - [2048, 304, 1, 5120]
    - [22, 165.35]
  - - [2048, 320, 1, 5120]
    - [23, 176.66]
  - - [2048, 336, 1, 5120]
    - [24, 176.85]
  - - [2048, 352, 1, 5120]
    - [23, 184.93]
  - - [2048, 368, 1, 5120]
    - [25, 186.09]
  - - [2048, 384, 1, 5120]
    - [25, 201.15]
  - - [2048, 400, 1, 5120]
    - [23, 198.07]
  - - [2048, 416, 1, 5120]
    - [26, 209.52]
  - - [2048, 432, 1, 5120]
    - [27, 203.87]
  - - [2048, 448, 1, 5120]
    - [23, 217.49]
  - - [2048, 464, 1, 5120]
    - [23, 209.79]
  - - [2048, 480, 1, 5120]
    - [26, 225.71]
  - - [2048, 496, 1, 5120]
    - [26, 218.82]
  - - [2048, 512, 1, 5120]
    - [26, 232.72]
  - - [2048, 544, 1, 5120]
    - [25, 237.12]
  - - [2048, 576, 1, 5120]
    - [25, 245.74]
  - - [2048, 608, 1, 5120]
    - [26, 253.16]
  - - [2048, 640, 1, 5120]
    - [28, 246.87]
  - - [2048, 672, 1, 5120]
    - [29, 254.99]
  - - [2048, 704, 1, 5120]
    - [28, 264.0]
  - - [2048, 736, 1, 5120]
    - [30, 263.17]
  - - [2048, 768, 1, 5120]
    - [28, 279.52]
  - - [2048, 800, 1, 5120]
    - [31, 277.44]
  - - [2048, 832, 1, 5120]
    - [32, 291.28]
  - - [2048, 864, 1, 5120]
    - [29, 297.56]
  - - [2048, 896, 1, 5120]
    - [28, 302.73]
  - - [2048, 928, 1, 5120]
    - [32, 294.09]
  - - [2048, 960, 1, 5120]
    - [28, 316.12]
  - - [2048, 992, 1, 5120]
    - [33, 307.02]
  - - [2048, 1024, 1, 5120]
    - [28, 332.38]
  - - [2048, 1088, 1, 5120]
    - [28, 334.17]
  - - [2048, 1152, 1, 5120]
    - [32, 353.34]
  - - [2048, 1216, 1, 5120]
    - [28, 346.93]
  - - [2048, 1280, 1, 5120]
    - [34, 346.19]
  - - [2048, 1344, 1, 5120]
    - [35, 351.22]
  - - [2048, 1408, 1, 5120]
    - [36, 345.01]
  - - [2048, 1472, 1, 5120]
    - [36, 351.09]
  - - [2048, 1536, 1, 5120]
    - [36, 374.64]
  - - [2048, 1600, 1, 5120]
    - [36, 370.73]
  - - [2048, 1664, 1, 5120]
    - [36, 381.91]
  - - [2048, 1728, 1, 5120]
    - [36, 396.6]
  - - [2048, 1792, 1, 5120]
    - [35, 390.68]
  - - [2048, 1856, 1, 5120]
    - [37, 366.49]
  - - [2048, 1920, 1, 5120]
    - [38, 379.61]
  - - [2048, 1984, 1, 5120]
    - [37, 386.61]
  - - [2048, 2048, 1, 5120]
    - [37, 393.42]
  - - [2048, 2176, 1, 5120]
    - [37, 399.26]
  - - [2048, 2304, 1, 5120]
    - [39, 409.31]
  - - [2048, 2432, 1, 5120]
    - [37, 419.62]
  - - [2048, 2560, 1, 5120]
    - [40, 414.01]
  - - [2048, 2688, 1, 5120]
    - [41, 412.64]
  - - [2048, 2816, 1, 5120]
    - [42, 420.71]
  - - [2048, 2944, 1, 5120]
    - [43, 418.34]
  - - [2048, 3072, 1, 5120]
    - [44, 435.88]
  - - [2048, 3200, 1, 5120]
    - [45, 428.07]
  - - [2048, 3328, 1, 5120]
    - [44, 439.84]
  - - [2048, 3456, 1, 5120]
    - [45, 462.18]
  - - [2048, 3584, 1, 5120]
    - [44, 457.34]
  - - [2048, 3712, 1, 5120]
    - [46, 424.89]
  - - [2048, 3840, 1, 5120]
    - [47, 432.86]
  - - [2048, 3968, 1, 5120]
    - [48, 434.66]
  - - [2048, 4096, 1, 5120]
    - [49, 448.23]
  - - [4096, 176, 1, 5120]
    - [26, 170.54]
  - - [4096, 192, 1, 5120]
    - [26, 193.4]
  - - [4096, 208, 1, 5120]
    - [26, 189.27]
  - - [4096, 224, 1, 5120]
    - [26, 209.31]
  - - [4096, 240, 1, 5120]
    - [26, 202.86]
  - - [4096, 256, 1, 5120]
    - [26, 226.93]
  - - [4096, 272, 1, 5120]
    - [25, 218.68]
  - - [4096, 288, 1, 5120]
    - [25, 236.81]
  - - [4096, 304, 1, 5120]
    - [30, 223.39]
  - - [4096, 320, 1, 5120]
    - [50, 243.7]
  - - [4096, 336, 1, 5120]
    - [51, 248.39]
  - - [4096, 352, 1, 5120]
    - [30, 246.02]
  - - [4096, 368, 1, 5120]
    - [30, 253.16]
  - - [4096, 384, 1, 5120]
    - [50, 274.32]
  - - [4096, 400, 1, 5120]
    - [28, 261.19]
  - - [4096, 416, 1, 5120]
    - [33, 269.85]
  - - [4096, 432, 1, 5120]
    - [29, 281.31]
  - - [4096, 448, 1, 5120]
    - [28, 298.57]
  - - [4096, 464, 1, 5120]
    - [28, 282.7]
  - - [4096, 480, 1, 5120]
    - [28, 291.23]
  - - [4096, 496, 1, 5120]
    - [28, 296.49]
  - - [4096, 512, 1, 5120]
    - [28, 318.16]
  - - [4096, 544, 1, 5120]
    - [32, 302.15]
  - - [4096, 576, 1, 5120]
    - [32, 324.1]
  - - [4096, 608, 1, 5120]
    - [52, 315.72]
  - - [4096, 640, 1, 5120]
    - [52, 338.16]
  - - [4096, 672, 1, 5120]
    - [35, 344.15]
  - - [4096, 704, 1, 5120]
    - [53, 339.63]
  - - [4096, 736, 1, 5120]
    - [54, 343.12]
  - - [4096, 768, 1, 5120]
    - [35, 366.92]
  - - [4096, 800, 1, 5120]
    - [36, 359.35]
  - - [4096, 832, 1, 5120]
    - [36, 364.0]
  - - [4096, 864, 1, 5120]
    - [36, 391.35]
  - - [4096, 896, 1, 5120]
    - [55, 368.56]
  - - [4096, 928, 1, 5120]
    - [56, 354.66]
  - - [4096, 960, 1, 5120]
    - [37, 378.28]
  - - [4096, 992, 1, 5120]
    - [56, 373.81]
  - - [4096, 1024, 1, 5120]
    - [37, 388.38]
  - - [4096, 1088, 1, 5120]
    - [38, 390.86]
  - - [4096, 1152, 1, 5120]
    - [38, 414.81]
  - - [4096, 1216, 1, 5120]
    - [39, 415.54]
  - - [4096, 1280, 1, 5120]
    - [57, 401.76]
  - - [4096, 1344, 1, 5120]
    - [44, 412.84]
  - - [4096, 1408, 1, 5120]
    - [43, 420.93]
  - - [4096, 1472, 1, 5120]
    - [58, 411.51]
  - - [4096, 1536, 1, 5120]
    - [41, 439.77]
  - - [4096, 1600, 1, 5120]
    - [44, 430.53]
  - - [4096, 1664, 1, 5120]
    - [44, 433.16]
  - - [4096, 1728, 1, 5120]
    - [41, 446.49]
  - - [4096, 1792, 1, 5120]
    - [41, 451.39]
  - - [4096, 1856, 1, 5120]
    - [59, 423.05]
  - - [4096, 1920, 1, 5120]
    - [60, 435.63]
  - - [4096, 1984, 1, 5120]
    - [59, 432.31]
  - - [4096, 2048, 1, 5120]
    - [49, 442.57]
  - - [4096, 2176, 1, 5120]
    - [59, 453.18]
  - - [4096, 2304, 1, 5120]
    - [48, 461.64]
  - - [4096, 2432, 1, 5120]
    - [49, 475.45]
  - - [4096, 2560, 1, 5120]
    - [61, 485.52]
  - - [4096, 2688, 1, 5120]
    - [62, 474.21]
  - - [4096, 2816, 1, 5120]
    - [62, 481.58]
  - - [4096, 2944, 1, 5120]
    - [62, 488.34]
  - - [4096, 3072, 1, 5120]
    - [63, 479.66]
  - - [4096, 3200, 1, 5120]
    - [64, 474.17]
  - - [4096, 3328, 1, 5120]
    - [44, 485.99]
  - - [4096, 3456, 1, 5120]
    - [65, 499.08]
  - - [4096, 3584, 1, 5120]
    - [64, 502.15]
  - - [4096, 3712, 1, 5120]
    - [66, 486.31]
  - - [4096, 3840, 1, 5120]
    - [67, 483.41]
  - - [4096, 3968, 1, 5120]
    - [66, 502.42]
  - - [4096, 4096, 1, 5120]
    - [68, 499.78]
  - - [16384, 176, 1, 5120]
    - [35, 274.02]
  - - [16384, 192, 1, 5120]
    - [35, 312.6]
  - - [16384, 208, 1, 5120]
    - [56, 287.94]
  - - [16384, 224, 1, 5120]
    - [56, 317.6]
  - - [16384, 240, 1, 5120]
    - [69, 321.42]
  - - [16384, 256, 1, 5120]
    - [70, 345.49]
  - - [16384, 272, 1, 5120]
    - [40, 336.11]
  - - [16384, 288, 1, 5120]
    - [71, 363.71]
  - - [16384, 304, 1, 5120]
    - [58, 331.78]
  - - [16384, 320, 1, 5120]
    - [72, 375.42]
  - - [16384, 336, 1, 5120]
    - [73, 353.79]
  - - [16384, 352, 1, 5120]
    - [74, 364.34]
  - - [16384, 368, 1, 5120]
    - [74, 373.97]
  - - [16384, 384, 1, 5120]
    - [41, 400.97]
  - - [16384, 400, 1, 5120]
    - [75, 369.49]
  - - [16384, 416, 1, 5120]
    - [76, 372.66]
  - - [16384, 432, 1, 5120]
    - [76, 388.45]
  - - [16384, 448, 1, 5120]
    - [76, 404.14]
  - - [16384, 464, 1, 5120]
    - [77, 394.87]
  - - [16384, 480, 1, 5120]
    - [78, 413.82]
  - - [16384, 496, 1, 5120]
    - [49, 392.58]
  - - [16384, 512, 1, 5120]
    - [79, 419.22]
  - - [16384, 544, 1, 5120]
    - [80, 397.54]
  - - [16384, 576, 1, 5120]
    - [81, 434.45]
  - - [16384, 608, 1, 5120]
    - [61, 424.8]
  - - [16384, 640, 1, 5120]
    - [82, 458.59]
  - - [16384, 672, 1, 5120]
    - [83, 446.82]
  - - [16384, 704, 1, 5120]
    - [84, 437.23]
  - - [16384, 736, 1, 5120]
    - [85, 436.3]
  - - [16384, 768, 1, 5120]
    - [64, 469.01]
  - - [16384, 800, 1, 5120]
    - [86, 452.22]
  - - [16384, 832, 1, 5120]
    - [44, 451.77]
  - - [16384, 864, 1, 5120]
    - [44, 466.73]
  - - [16384, 896, 1, 5120]
    - [68, 482.62]
  - - [16384, 928, 1, 5120]
    - [87, 454.83]
  - - [16384, 960, 1, 5120]
    - [87, 468.74]
  - - [16384, 992, 1, 5120]
    - [88, 456.74]
  - - [16384, 1024, 1, 5120]
    - [89, 478.17]
  - - [16384, 1088, 1, 5120]
    - [87, 481.31]
  - - [16384, 1152, 1, 5120]
    - [90, 485.25]
  - - [16384, 1216, 1, 5120]
    - [41, 476.08]
  - - [16384, 1280, 1, 5120]
    - [44, 485.01]
  - - [16384, 1344, 1, 5120]
    - [44, 502.76]
  - - [16384, 1408, 1, 5120]
    - [62, 484.49]
  - - [16384, 1472, 1, 5120]
    - [91, 473.37]
  - - [16384, 1536, 1, 5120]
    - [44, 490.91]
  - - [16384, 1600, 1, 5120]
    - [44, 487.9]
  - - [16384, 1664, 1, 5120]
    - [41, 495.28]
  - - [16384, 1728, 1, 5120]
    - [41, 507.05]
  - - [16384, 1792, 1, 5120]
    - [44, 507.39]
  - - [16384, 1856, 1, 5120]
    - [44, 486.62]
  - - [16384, 1920, 1, 5120]
    - [44, 493.48]
  - - [16384, 1984, 1, 5120]
    - [68, 501.49]
  - - [16384, 2048, 1, 5120]
    - [87, 496.8]
  - - [16384, 2176, 1, 5120]
    - [92, 514.15]
  - - [16384, 2304, 1, 5120]
    - [90, 507.11]
  - - [16384, 2432, 1, 5120]
    - [93, 514.73]
  - - [16384, 2560, 1, 5120]
    - [44, 515.0]
  - - [16384, 2688, 1, 5120]
    - [41, 532.51]
  - - [16384, 2816, 1, 5120]
    - [62, 512.68]
  - - [16384, 2944, 1, 5120]
    - [44, 518.9]
  - - [16384, 3072, 1, 5120]
    - [41, 528.67]
  - - [16384, 3200, 1, 5120]
    - [87, 527.1]
  - - [16384, 3328, 1, 5120]
    - [87, 533.36]
  - - [16384, 3456, 1, 5120]
    - [41, 530.71]
  - - [16384, 3584, 1, 5120]
    - [64, 531.65]
  - - [16384, 3712, 1, 5120]
    - [44, 526.9]
  - - [16384, 3840, 1, 5120]
    - [41, 534.13]
  - - [16384, 3968, 1, 5120]
    - [44, 534.71]
  - - [16384, 4096, 1, 5120]
    - [68, 536.38]
  - - [5120, 272, 1, 8192]
    - [29, 255.74]
  - - [5120, 288, 1, 8192]
    - [29, 273.63]
  - - [5120, 304, 1, 8192]
    - [30, 273.93]
  - - [5120, 320, 1, 8192]
    - [32, 291.71]
  - - [5120, 336, 1, 8192]
    - [30, 299.62]
  - - [5120, 352, 1, 8192]
    - [32, 295.56]
  - - [5120, 368, 1, 8192]
    - [32, 300.49]
  - - [5120, 384, 1, 8192]
    - [28, 324.4]
  - - [5120, 400, 1, 8192]
    - [52, 315.52]
  - - [5120, 416, 1, 8192]
    - [28, 325.89]
  - - [5120, 432, 1, 8192]
    - [28, 321.76]
  - - [5120, 448, 1, 8192]
    - [28, 346.25]
  - - [5120, 464, 1, 8192]
    - [52, 324.41]
  - - [5120, 480, 1, 8192]
    - [53, 345.79]
  - - [5120, 496, 1, 8192]
    - [34, 330.56]
  - - [5120, 512, 1, 8192]
    - [52, 352.97]
  - - [5120, 544, 1, 8192]
    - [34, 363.45]
  - - [5120, 576, 1, 8192]
    - [35, 363.65]
  - - [5120, 608, 1, 8192]
    - [36, 353.2]
  - - [5120, 640, 1, 8192]
    - [94, 370.85]
  - - [5120, 672, 1, 8192]
    - [35, 398.77]
  - - [5120, 704, 1, 8192]
    - [94, 380.79]
  - - [5120, 736, 1, 8192]
    - [95, 374.48]
  - - [5120, 768, 1, 8192]
    - [96, 389.37]
  - - [5120, 800, 1, 8192]
    - [69, 383.45]
  - - [5120, 832, 1, 8192]
    - [37, 391.86]
  - - [5120, 864, 1, 8192]
    - [97, 394.88]
  - - [5120, 896, 1, 8192]
    - [98, 406.51]
  - - [5120, 928, 1, 8192]
    - [39, 388.98]
  - - [5120, 960, 1, 8192]
    - [38, 410.52]
  - - [5120, 992, 1, 8192]
    - [40, 397.5]
  - - [5120, 1024, 1, 8192]
    - [58, 412.64]
  - - [5120, 1088, 1, 8192]
    - [58, 421.7]
  - - [5120, 1152, 1, 8192]
    - [72, 421.61]
  - - [5120, 1216, 1, 8192]
    - [99, 451.99]
  - - [5120, 1280, 1, 8192]
    - [100, 431.44]
  - - [5120, 1344, 1, 8192]
    - [44, 438.84]
  - - [5120, 1408, 1, 8192]
    - [101, 444.17]
  - - [5120, 1472, 1, 8192]
    - [102, 439.24]
  - - [5120, 1536, 1, 8192]
    - [103, 451.38]
  - - [5120, 1600, 1, 8192]
    - [104, 444.02]
  - - [5120, 1664, 1, 8192]
    - [49, 453.55]
  - - [5120, 1728, 1, 8192]
    - [77, 461.59]
  - - [5120, 1792, 1, 8192]
    - [49, 468.34]
  - - [5120, 1856, 1, 8192]
    - [49, 456.86]
  - - [5120, 1920, 1, 8192]
    - [103, 479.3]
  - - [5120, 1984, 1, 8192]
    - [105, 470.39]
  - - [5120, 2048, 1, 8192]
    - [106, 469.31]
  - - [5120, 2176, 1, 8192]
    - [107, 477.82]
  - - [5120, 2304, 1, 8192]
    - [107, 487.71]
  - - [5120, 2432, 1, 8192]
    - [107, 499.64]
  - - [5120, 2560, 1, 8192]
    - [108, 493.1]
  - - [5120, 2688, 1, 8192]
    - [109, 493.24]
  - - [5120, 2816, 1, 8192]
    - [108, 506.48]
  - - [5120, 2944, 1, 8192]
    - [110, 489.97]
  - - [5120, 3072, 1, 8192]
    - [111, 506.22]
  - - [5120, 3200, 1, 8192]
    - [112, 499.83]
  - - [5120, 3328, 1, 8192]
    - [113, 526.78]
  - - [5120, 3456, 1, 8192]
    - [111, 513.18]
  - - [5120, 3584, 1, 8192]
    - [114, 527.61]
  - - [5120, 3712, 1, 8192]
    - [115, 516.02]
  - - [5120, 3840, 1, 8192]
    - [113, 541.28]
  - - [5120, 3968, 1, 8192]
    - [105, 483.75]
  - - [5120, 4096, 1, 8192]
    - [106, 486.12]
  - - [5120, 16, 1, 2048]
    - [116, 24.41]
  - - [5120, 32, 1, 2048]
    - [117, 47.42]
  - - [5120, 48, 1, 2048]
    - [117, 63.29]
  - - [5120, 64, 1, 2048]
    - [118, 77.11]
  - - [5120, 80, 1, 2048]
    - [119, 86.78]
  - - [5120, 96, 1, 2048]
    - [118, 101.88]
  - - [5120, 112, 1, 2048]
    - [120, 108.71]
  - - [5120, 128, 1, 2048]
    - [25, 118.66]
  - - [5120, 144, 1, 2048]
    - [121, 128.48]
  - - [5120, 160, 1, 2048]
    - [25, 137.3]
  - - [5120, 176, 1, 2048]
    - [122, 136.61]
  - - [5120, 192, 1, 2048]
    - [25, 157.67]
  - - [5120, 208, 1, 2048]
    - [26, 153.21]
  - - [5120, 224, 1, 2048]
    - [26, 172.75]
  - - [5120, 240, 1, 2048]
    - [31, 173.79]
  - - [5120, 256, 1, 2048]
    - [50, 177.75]
  - - [5120, 272, 1, 2048]
    - [31, 176.24]
  - - [5120, 288, 1, 2048]
    - [29, 195.8]
  - - [5120, 304, 1, 2048]
    - [30, 188.77]
  - - [5120, 320, 1, 2048]
    - [28, 202.29]
  - - [5120, 336, 1, 2048]
    - [30, 210.65]
  - - [5120, 352, 1, 2048]
    - [32, 196.69]
  - - [5120, 368, 1, 2048]
    - [28, 204.79]
  - - [5120, 384, 1, 2048]
    - [28, 226.72]
  - - [5120, 400, 1, 2048]
    - [123, 221.8]
  - - [5120, 416, 1, 2048]
    - [28, 220.94]
  - - [5120, 432, 1, 2048]
    - [28, 224.14]
  - - [5120, 448, 1, 2048]
    - [28, 247.1]
  - - [5120, 464, 1, 2048]
    - [123, 222.82]
  - - [5120, 480, 1, 2048]
    - [34, 246.01]
  - - [5120, 496, 1, 2048]
    - [34, 225.94]
  - - [5120, 512, 1, 2048]
    - [124, 236.62]
  - - [5120, 544, 1, 2048]
    - [52, 244.57]
  - - [5120, 576, 1, 2048]
    - [36, 257.49]
  - - [5120, 608, 1, 2048]
    - [30, 248.12]
  - - [5120, 640, 1, 2048]
    - [125, 253.51]
  - - [5120, 672, 1, 2048]
    - [54, 277.69]
  - - [5120, 704, 1, 2048]
    - [30, 272.38]
  - - [5120, 736, 1, 2048]
    - [126, 262.95]
  - - [5120, 768, 1, 2048]
    - [125, 282.37]
  - - [5120, 800, 1, 2048]
    - [127, 272.19]
  - - [5120, 832, 1, 2048]
    - [28, 293.49]
  - - [5120, 864, 1, 2048]
    - [128, 296.77]
  - - [5120, 896, 1, 2048]
    - [129, 307.31]
  - - [5120, 928, 1, 2048]
    - [127, 298.92]
  - - [5120, 960, 1, 2048]
    - [39, 317.07]
  - - [5120, 992, 1, 2048]
    - [34, 286.57]
  - - [5120, 1024, 1, 2048]
    - [72, 308.29]
  - - [5120, 1088, 1, 2048]
    - [99, 315.09]
  - - [5120, 1152, 1, 2048]
    - [72, 321.3]
  - - [5120, 1216, 1, 2048]
    - [99, 334.76]
  - - [5120, 1280, 1, 2048]
    - [100, 325.1]
  - - [5120, 1344, 1, 2048]
    - [41, 340.71]
  - - [5120, 1408, 1, 2048]
    - [130, 334.54]
  - - [5120, 1472, 1, 2048]
    - [39, 330.69]
  - - [5120, 1536, 1, 2048]
    - [59, 342.81]
  - - [5120, 1600, 1, 2048]
    - [52, 336.69]
  - - [5120, 1664, 1, 2048]
    - [49, 353.36]
  - - [5120, 1728, 1, 2048]
    - [59, 368.34]
  - - [5120, 1792, 1, 2048]
    - [49, 374.07]
  - - [5120, 1856, 1, 2048]
    - [39, 371.4]
  - - [5120, 1920, 1, 2048]
    - [46, 380.72]
  - - [5120, 1984, 1, 2048]
    - [99, 372.67]
  - - [5120, 2048, 1, 2048]
    - [99, 372.71]
  - - [5120, 2176, 1, 2048]
    - [99, 385.17]
  - - [5120, 2304, 1, 2048]
    - [107, 390.3]
  - - [5120, 2432, 1, 2048]
    - [131, 402.69]
  - - [5120, 2560, 1, 2048]
    - [75, 388.53]
  - - [5120, 2688, 1, 2048]
    - [41, 405.13]
  - - [5120, 2816, 1, 2048]
    - [101, 388.53]
  - - [5120, 2944, 1, 2048]
    - [100, 382.63]
  - - [5120, 3072, 1, 2048]
    - [132, 392.8]
  - - [5120, 3200, 1, 2048]
    - [99, 389.5]
  - - [5120, 3328, 1, 2048]
    - [133, 396.03]
  - - [5120, 3456, 1, 2048]
    - [134, 418.38]
  - - [5120, 3584, 1, 2048]
    - [115, 405.21]
  - - [5120, 3712, 1, 2048]
    - [135, 410.61]
  - - [5120, 3840, 1, 2048]
    - [136, 417.98]
  - - [5120, 3968, 1, 2048]
    - [41, 400.38]
  - - [5120, 4096, 1, 2048]
    - [137, 410.64]
  - - [896, 16, 1, 5120]
    - [9, 8.66]
  - - [896, 32, 1, 5120]
    - [9, 17.63]
  - - [896, 48, 1, 5120]
    - [9, 25.06]
  - - [896, 64, 1, 5120]
    - [9, 32.6]
  - - [896, 80, 1, 5120]
    - [9, 38.82]
  - - [896, 96, 1, 5120]
    - [9, 44.2]
  - - [896, 112, 1, 5120]
    - [138, 47.81]
  - - [896, 128, 1, 5120]
    - [5, 52.4]
  - - [896, 144, 1, 5120]
    - [5, 57.3]
  - - [896, 160, 1, 5120]
    - [5, 63.84]
  - - [1024, 16, 1, 5120]
    - [9, 9.83]
  - - [1024, 32, 1, 5120]
    - [9, 19.74]
  - - [1024, 48, 1, 5120]
    - [9, 28.22]
  - - [1024, 64, 1, 5120]
    - [9, 36.69]
  - - [1024, 80, 1, 5120]
    - [9, 42.35]
  - - [1024, 96, 1, 5120]
    - [9, 47.3]
  - - [1024, 112, 1, 5120]
    - [139, 50.98]
  - - [1024, 128, 1, 5120]
    - [7, 56.45]
  - - [1024, 144, 1, 5120]
    - [7, 61.09]
  - - [1024, 160, 1, 5120]
    - [7, 68.29]
  - - [1024, 176, 1, 5120]
    - [7, 71.44]
  - - [1024, 192, 1, 5120]
    - [7, 78.66]
  - - [1024, 208, 1, 5120]
    - [5, 80.3]
  - - [1024, 224, 1, 5120]
    - [5, 85.7]
  - - [1024, 240, 1, 5120]
    - [5, 90.36]
  - - [1024, 256, 1, 5120]
    - [5, 96.75]
  - - [1024, 272, 1, 5120]
    - [5, 99.33]
  - - [1024, 288, 1, 5120]
    - [5, 105.22]
  - - [1024, 304, 1, 5120]
    - [5, 107.9]
  - - [1024, 320, 1, 5120]
    - [140, 107.28]
  - - [1024, 336, 1, 5120]
    - [140, 109.09]
  - - [1024, 352, 1, 5120]
    - [140, 114.85]
  - - [1024, 368, 1, 5120]
    - [8, 115.16]
  - - [1024, 384, 1, 5120]
    - [8, 122.77]
  - - [1024, 400, 1, 5120]
    - [8, 122.44]
  - - [1024, 416, 1, 5120]
    - [8, 129.76]
  - - [1024, 432, 1, 5120]
    - [140, 129.42]
  - - [1024, 448, 1, 5120]
    - [8, 136.67]
  - - [1024, 464, 1, 5120]
    - [8, 133.17]
  - - [1024, 480, 1, 5120]
    - [8, 142.45]
  - - [1024, 496, 1, 5120]
    - [140, 141.07]
  - - [1024, 512, 1, 5120]
    - [8, 150.47]
  - - [1024, 544, 1, 5120]
    - [140, 152.98]
  - - [1024, 576, 1, 5120]
    - [8, 160.99]
  - - [1024, 608, 1, 5120]
    - [140, 163.62]
  - - [1024, 640, 1, 5120]
    - [141, 169.1]
  - - [1024, 672, 1, 5120]
    - [141, 170.72]
  - - [1024, 704, 1, 5120]
    - [142, 177.61]
  - - [1024, 736, 1, 5120]
    - [141, 179.47]
  - - [1024, 768, 1, 5120]
    - [141, 187.84]
  - - [1024, 800, 1, 5120]
    - [141, 190.92]
  - - [1024, 832, 1, 5120]
    - [141, 195.15]
  - - [1024, 864, 1, 5120]
    - [141, 198.56]
  - - [1024, 896, 1, 5120]
    - [142, 206.59]
  - - [1024, 928, 1, 5120]
    - [141, 210.71]
  - - [1024, 960, 1, 5120]
    - [141, 216.9]
  - - [1024, 992, 1, 5120]
    - [141, 219.57]
  - - [1024, 1024, 1, 5120]
    - [141, 223.32]
  - - [5120, 16, 1, 1024]
    - [19, 15.36]
  - - [5120, 32, 1, 1024]
    - [5, 26.76]
  - - [5120, 48, 1, 1024]
    - [143, 34.6]
  - - [5120, 64, 1, 1024]
    - [144, 45.68]
  - - [5120, 80, 1, 1024]
    - [6, 51.17]
  - - [5120, 96, 1, 1024]
    - [6, 62.97]
  - - [5120, 112, 1, 1024]
    - [0, 65.0]
  - - [5120, 128, 1, 1024]
    - [0, 73.84]
  - - [5120, 144, 1, 1024]
    - [0, 82.3]
  - - [5120, 160, 1, 1024]
    - [3, 86.08]
  - - [896, 176, 1, 5120]
    - [145, 79.59]
  - - [896, 192, 1, 5120]
    - [145, 87.39]
  - - [896, 208, 1, 5120]
    - [146, 89.67]
  - - [896, 224, 1, 5120]
    - [146, 95.8]
  - - [896, 240, 1, 5120]
    - [146, 97.71]
  - - [896, 256, 1, 5120]
    - [147, 104.36]
  - - [896, 272, 1, 5120]
    - [148, 102.94]
  - - [896, 288, 1, 5120]
    - [149, 111.41]
  - - [896, 304, 1, 5120]
    - [149, 112.99]
  - - [896, 320, 1, 5120]
    - [149, 119.66]
  - - [896, 336, 1, 5120]
    - [117, 118.33]
  - - [896, 352, 1, 5120]
    - [20, 123.05]
  - - [896, 368, 1, 5120]
    - [20, 125.9]
  - - [896, 384, 1, 5120]
    - [20, 131.64]
  - - [896, 400, 1, 5120]
    - [21, 131.11]
  - - [896, 416, 1, 5120]
    - [21, 137.17]
  - - [896, 432, 1, 5120]
    - [20, 136.43]
  - - [896, 448, 1, 5120]
    - [20, 140.99]
  - - [896, 464, 1, 5120]
    - [21, 143.43]
  - - [896, 480, 1, 5120]
    - [20, 148.01]
  - - [896, 496, 1, 5120]
    - [21, 151.32]
  - - [896, 512, 1, 5120]
    - [21, 156.02]
  - - [896, 544, 1, 5120]
    - [21, 158.89]
  - - [896, 576, 1, 5120]
    - [20, 163.19]
  - - [896, 608, 1, 5120]
    - [20, 168.64]
  - - [896, 640, 1, 5120]
    - [21, 173.48]
  - - [896, 672, 1, 5120]
    - [150, 178.58]
  - - [896, 704, 1, 5120]
    - [23, 176.34]
  - - [896, 736, 1, 5120]
    - [23, 178.8]
  - - [896, 768, 1, 5120]
    - [23, 183.0]
  - - [896, 800, 1, 5120]
    - [25, 188.41]
  - - [896, 832, 1, 5120]
    - [25, 189.9]
  - - [896, 864, 1, 5120]
    - [22, 193.83]
  - - [896, 896, 1, 5120]
    - [26, 199.42]
  - - [896, 928, 1, 5120]
    - [26, 204.45]
  - - [896, 960, 1, 5120]
    - [26, 209.14]
  - - [896, 992, 1, 5120]
    - [26, 214.21]
  - - [896, 1024, 1, 5120]
    - [26, 217.09]
  - - [896, 1088, 1, 5120]
    - [26, 222.81]
  - - [896, 1152, 1, 5120]
    - [151, 229.96]
  - - [896, 1216, 1, 5120]
    - [26, 236.0]
  - - [896, 1280, 1, 5120]
    - [151, 244.7]
  - - [896, 1344, 1, 5120]
    - [151, 250.63]
  - - [896, 1408, 1, 5120]
    - [50, 238.9]
  - - [896, 1472, 1, 5120]
    - [33, 248.18]
  - - [896, 1536, 1, 5120]
    - [152, 256.19]
  - - [896, 1600, 1, 5120]
    - [153, 257.52]
  - - [896, 1664, 1, 5120]
    - [153, 263.03]
  - - [896, 1728, 1, 5120]
    - [154, 273.34]
  - - [896, 1792, 1, 5120]
    - [32, 277.23]
  - - [896, 1856, 1, 5120]
    - [155, 282.67]
  - - [896, 1920, 1, 5120]
    - [154, 292.56]
  - - [896, 1984, 1, 5120]
    - [155, 295.95]
  - - [896, 2048, 1, 5120]
    - [33, 301.61]
  - - [896, 2176, 1, 5120]
    - [155, 311.23]
  - - [896, 2304, 1, 5120]
    - [155, 320.42]
  - - [896, 2432, 1, 5120]
    - [155, 337.07]
  - - [896, 2560, 1, 5120]
    - [155, 338.25]
  - - [896, 2688, 1, 5120]
    - [155, 337.47]
  - - [896, 2816, 1, 5120]
    - [156, 319.51]
  - - [896, 2944, 1, 5120]
    - [156, 327.89]
  - - [896, 3072, 1, 5120]
    - [157, 345.19]
  - - [896, 3200, 1, 5120]
    - [156, 351.26]
  - - [896, 3328, 1, 5120]
    - [53, 351.65]
  - - [896, 3456, 1, 5120]
    - [158, 360.41]
  - - [896, 3584, 1, 5120]
    - [159, 359.0]
  - - [896, 3712, 1, 5120]
    - [158, 366.85]
  - - [896, 3840, 1, 5120]
    - [158, 381.73]
  - - [896, 3968, 1, 5120]
    - [158, 374.5]
  - - [896, 4096, 1, 5120]
    - [158, 381.95]
  - - [896, 4352, 1, 5120]
    - [160, 367.16]
  - - [896, 4608, 1, 5120]
    - [160, 370.35]
  - - [896, 4864, 1, 5120]
    - [161, 384.31]
  - - [896, 5120, 1, 5120]
    - [161, 392.42]
  - - [896, 5376, 1, 5120]
    - [161, 396.41]
  - - [896, 5632, 1, 5120]
    - [162, 390.44]
  - - [896, 5888, 1, 5120]
    - [163, 389.47]
  - - [896, 6144, 1, 5120]
    - [164, 399.13]
  - - [896, 6400, 1, 5120]
    - [163, 404.31]
  - - [896, 6656, 1, 5120]
    - [163, 404.66]
  - - [896, 6912, 1, 5120]
    - [45, 397.32]
  - - [896, 7168, 1, 5120]
    - [165, 399.87]
  - - [896, 7424, 1, 5120]
    - [165, 408.53]
  - - [896, 7680, 1, 5120]
    - [158, 412.06]
  - - [896, 7936, 1, 5120]
    - [165, 417.89]
  - - [896, 8192, 1, 5120]
    - [79, 423.15]
  - - [896, 8448, 1, 5120]
    - [165, 424.27]
  - - [896, 8704, 1, 5120]
    - [165, 428.67]
  - - [896, 8960, 1, 5120]
    - [165, 432.93]
  - - [896, 9216, 1, 5120]
    - [166, 442.89]
  - - [896, 9728, 1, 5120]
    - [165, 450.68]
  - - [896, 9984, 1, 5120]
    - [80, 405.52]
  - - [5120, 16, 1, 640]
    - [167, 8.53]
  - - [5120, 32, 1, 640]
    - [168, 16.96]
  - - [5120, 48, 1, 640]
    - [169, 25.45]
  - - [5120, 64, 1, 640]
    - [170, 32.72]
  - - [5120, 80, 1, 640]
    - [169, 40.66]
  - - [5120, 96, 1, 640]
    - [171, 48.23]
  - - [5120, 112, 1, 640]
    - [169, 56.08]
  - - [5120, 128, 1, 640]
    - [172, 61.3]
  - - [5120, 144, 1, 640]
    - [173, 64.97]
  - - [5120, 160, 1, 640]
    - [174, 74.59]
  - - [5120, 176, 1, 640]
    - [175, 75.0]
  - - [5120, 192, 1, 640]
    - [174, 85.61]
  - - [5120, 208, 1, 640]
    - [176, 83.71]
  - - [5120, 224, 1, 640]
    - [177, 93.9]
  - - [5120, 240, 1, 640]
    - [178, 94.43]
  - - [5120, 256, 1, 640]
    - [179, 101.36]
  - - [5120, 272, 1, 640]
    - [180, 96.2]
  - - [5120, 288, 1, 640]
    - [178, 106.18]
  - - [5120, 304, 1, 640]
    - [179, 104.12]
  - - [5120, 320, 1, 640]
    - [179, 114.56]
  - - [5120, 336, 1, 640]
    - [178, 116.47]
  - - [5120, 352, 1, 640]
    - [179, 123.23]
  - - [5120, 368, 1, 640]
    - [179, 119.9]
  - - [5120, 384, 1, 640]
    - [179, 131.98]
  - - [5120, 400, 1, 640]
    - [179, 126.67]
  - - [5120, 416, 1, 640]
    - [179, 137.37]
  - - [5120, 432, 1, 640]
    - [177, 134.21]
  - - [5120, 448, 1, 640]
    - [179, 144.85]
  - - [5120, 464, 1, 640]
    - [179, 141.27]
  - - [5120, 480, 1, 640]
    - [179, 153.68]
  - - [5120, 496, 1, 640]
    - [179, 137.91]
  - - [5120, 512, 1, 640]
    - [179, 150.64]
  - - [5120, 544, 1, 640]
    - [179, 156.17]
  - - [5120, 576, 1, 640]
    - [179, 163.52]
  - - [5120, 608, 1, 640]
    - [179, 168.4]
  - - [5120, 640, 1, 640]
    - [177, 172.9]
  - - [5120, 672, 1, 640]
    - [178, 177.89]
  - - [5120, 704, 1, 640]
    - [177, 179.67]
  - - [5120, 736, 1, 640]
    - [181, 171.08]
  - - [5120, 768, 1, 640]
    - [181, 189.57]
  - - [5120, 800, 1, 640]
    - [181, 179.95]
  - - [5120, 832, 1, 640]
    - [127, 199.61]
  - - [5120, 864, 1, 640]
    - [127, 185.19]
  - - [5120, 896, 1, 640]
    - [181, 203.18]
  - - [5120, 928, 1, 640]
    - [181, 194.05]
  - - [5120, 960, 1, 640]
    - [181, 213.62]
  - - [5120, 992, 1, 640]
    - [178, 185.21]
  - - [5120, 1024, 1, 640]
    - [182, 187.99]
  - - [5120, 1088, 1, 640]
    - [183, 192.28]
  - - [5120, 1152, 1, 640]
    - [184, 211.35]
  - - [5120, 1216, 1, 640]
    - [185, 203.52]
  - - [5120, 1280, 1, 640]
    - [186, 209.57]
  - - [5120, 1344, 1, 640]
    - [184, 230.36]
  - - [5120, 1408, 1, 640]
    - [186, 217.81]
  - - [5120, 1472, 1, 640]
    - [70, 215.17]
  - - [5120, 1536, 1, 640]
    - [186, 226.67]
  - - [5120, 1600, 1, 640]
    - [70, 225.49]
  - - [5120, 1664, 1, 640]
    - [186, 231.05]
  - - [5120, 1728, 1, 640]
    - [70, 230.97]
  - - [5120, 1792, 1, 640]
    - [129, 244.14]
  - - [5120, 1856, 1, 640]
    - [39, 241.05]
  - - [5120, 1920, 1, 640]
    - [186, 252.24]
  - - [5120, 1984, 1, 640]
    - [99, 238.3]
  - - [5120, 2048, 1, 640]
    - [99, 240.27]
  - - [5120, 2176, 1, 640]
    - [164, 245.08]
  - - [5120, 2304, 1, 640]
    - [164, 250.16]
  - - [5120, 2432, 1, 640]
    - [187, 253.81]
  - - [5120, 2560, 1, 640]
    - [75, 242.73]
  - - [5120, 2688, 1, 640]
    - [41, 270.81]
  - - [5120, 2816, 1, 640]
    - [45, 246.79]
  - - [5120, 2944, 1, 640]
    - [75, 243.49]
  - - [5120, 3072, 1, 640]
    - [188, 235.88]
  - - [5120, 3200, 1, 640]
    - [188, 243.18]
  - - [5120, 3328, 1, 640]
    - [188, 253.56]
  - - [5120, 3456, 1, 640]
    - [129, 253.76]
  - - [5120, 3584, 1, 640]
    - [189, 257.62]
  - - [5120, 3712, 1, 640]
    - [188, 260.25]
  - - [5120, 3840, 1, 640]
    - [190, 266.44]
  - - [5120, 3968, 1, 640]
    - [164, 250.45]
  - - [5120, 4096, 1, 640]
    - [72, 254.23]
  - - [5120, 4352, 1, 640]
    - [72, 260.86]
  - - [5120, 4608, 1, 640]
    - [72, 269.35]
  - - [5120, 4864, 1, 640]
    - [164, 275.37]
  - - [5120, 5120, 1, 640]
    - [191, 267.53]
  - - [5120, 5376, 1, 640]
    - [45, 281.76]
  - - [5120, 5632, 1, 640]
    - [188, 279.29]
  - - [5120, 5888, 1, 640]
    - [72, 270.92]
  - - [5120, 6144, 1, 640]
    - [83, 264.41]
  - - [5120, 6400, 1, 640]
    - [163, 269.82]
  - - [5120, 6656, 1, 640]
    - [188, 275.48]
  - - [5120, 6912, 1, 640]
    - [45, 282.61]
  - - [5120, 7168, 1, 640]
    - [164, 287.8]
  - - [5120, 7424, 1, 640]
    - [192, 280.88]
  - - [5120, 7680, 1, 640]
    - [45, 286.91]
  - - [5120, 7936, 1, 640]
    - [45, 281.79]
  - - [5120, 8192, 1, 640]
    - [45, 293.86]
  - - [5120, 8448, 1, 640]
    - [191, 297.4]
  - - [5120, 8704, 1, 640]
    - [45, 300.08]
  - - [5120, 8960, 1, 640]
    - [193, 286.85]
  - - [5120, 9216, 1, 640]
    - [188, 289.98]
  - - [5120, 9728, 1, 640]
    - [164, 293.63]
  - - [5120, 9984, 1, 640]
    - [45, 292.36]
  - - [1024, 1088, 1, 5120]
    - [26, 238.8]
  - - [1024, 1152, 1, 5120]
    - [25, 248.5]
  - - [1024, 1216, 1, 5120]
    - [26, 251.98]
  - - [1024, 1280, 1, 5120]
    - [51, 248.55]
  - - [1024, 1344, 1, 5120]
    - [30, 257.76]
  - - [1024, 1408, 1, 5120]
    - [50, 262.28]
  - - [1024, 1472, 1, 5120]
    - [33, 269.34]
  - - [1024, 1536, 1, 5120]
    - [30, 279.9]
  - - [1024, 1600, 1, 5120]
    - [155, 279.89]
  - - [1024, 1664, 1, 5120]
    - [32, 289.62]
  - - [1024, 1728, 1, 5120]
    - [28, 295.21]
  - - [1024, 1792, 1, 5120]
    - [155, 302.11]
  - - [1024, 1856, 1, 5120]
    - [155, 308.93]
  - - [1024, 1920, 1, 5120]
    - [32, 314.73]
  - - [1024, 1984, 1, 5120]
    - [155, 319.56]
  - - [1024, 2048, 1, 5120]
    - [28, 325.42]
  - - [1024, 2176, 1, 5120]
    - [155, 333.98]
  - - [1024, 2304, 1, 5120]
    - [155, 344.8]
  - - [1024, 2432, 1, 5120]
    - [155, 347.35]
  - - [1024, 2560, 1, 5120]
    - [156, 340.47]
  - - [1024, 2688, 1, 5120]
    - [158, 346.28]
  - - [1024, 2816, 1, 5120]
    - [52, 348.51]
  - - [1024, 2944, 1, 5120]
    - [158, 355.65]
  - - [1024, 3072, 1, 5120]
    - [35, 370.62]
  - - [1024, 3200, 1, 5120]
    - [158, 372.4]
  - - [1024, 3328, 1, 5120]
    - [158, 375.88]
  - - [1024, 3456, 1, 5120]
    - [158, 385.65]
  - - [1024, 3584, 1, 5120]
    - [158, 391.82]
  - - [1024, 3712, 1, 5120]
    - [194, 365.85]
  - - [1024, 3840, 1, 5120]
    - [37, 373.39]
  - - [1024, 3968, 1, 5120]
    - [195, 379.66]
  - - [1024, 4096, 1, 5120]
    - [195, 388.25]
  - - [1024, 4352, 1, 5120]
    - [38, 394.73]
  - - [1024, 4608, 1, 5120]
    - [195, 404.02]
  - - [1024, 4864, 1, 5120]
    - [195, 412.73]
  - - [1024, 5120, 1, 5120]
    - [196, 394.74]
  - - [1024, 5376, 1, 5120]
    - [45, 409.71]
  - - [1024, 5632, 1, 5120]
    - [163, 413.96]
  - - [5120, 176, 1, 1024]
    - [197, 99.11]
  - - [5120, 192, 1, 1024]
    - [198, 113.69]
  - - [5120, 208, 1, 1024]
    - [199, 111.13]
  - - [5120, 224, 1, 1024]
    - [200, 125.06]
  - - [5120, 240, 1, 1024]
    - [30, 124.72]
  - - [5120, 256, 1, 1024]
    - [28, 127.28]
  - - [5120, 272, 1, 1024]
    - [201, 130.17]
  - - [5120, 288, 1, 1024]
    - [29, 142.15]
  - - [5120, 304, 1, 1024]
    - [202, 140.64]
  - - [5120, 320, 1, 1024]
    - [202, 148.79]
  - - [5120, 336, 1, 1024]
    - [30, 157.54]
  - - [5120, 352, 1, 1024]
    - [200, 155.69]
  - - [5120, 368, 1, 1024]
    - [200, 151.78]
  - - [5120, 384, 1, 1024]
    - [28, 166.81]
  - - [5120, 400, 1, 1024]
    - [200, 160.94]
  - - [5120, 416, 1, 1024]
    - [200, 176.61]
  - - [5120, 432, 1, 1024]
    - [200, 168.7]
  - - [5120, 448, 1, 1024]
    - [28, 187.34]
  - - [5120, 464, 1, 1024]
    - [200, 172.55]
  - - [5120, 480, 1, 1024]
    - [200, 190.53]
  - - [5120, 496, 1, 1024]
    - [30, 170.9]
  - - [5120, 512, 1, 1024]
    - [30, 180.45]
  - - [5120, 544, 1, 1024]
    - [30, 185.0]
  - - [5120, 576, 1, 1024]
    - [30, 205.93]
  - - [5120, 608, 1, 1024]
    - [30, 198.53]
  - - [5120, 640, 1, 1024]
    - [30, 206.89]
  - - [5120, 672, 1, 1024]
    - [30, 221.94]
  - - [5120, 704, 1, 1024]
    - [30, 221.55]
  - - [5120, 736, 1, 1024]
    - [203, 205.46]
  - - [5120, 768, 1, 1024]
    - [28, 225.01]
  - - [5120, 800, 1, 1024]
    - [53, 219.14]
  - - [5120, 832, 1, 1024]
    - [203, 228.7]
  - - [5120, 864, 1, 1024]
    - [128, 225.16]
  - - [5120, 896, 1, 1024]
    - [181, 244.43]
  - - [5120, 928, 1, 1024]
    - [181, 233.31]
  - - [5120, 960, 1, 1024]
    - [181, 253.27]
  - - [5120, 992, 1, 1024]
    - [52, 231.56]
  - - [5120, 1024, 1, 1024]
    - [52, 235.08]
  - - [5120, 1088, 1, 1024]
    - [72, 241.72]
  - - [5120, 1152, 1, 1024]
    - [204, 258.72]
  - - [5120, 1216, 1, 1024]
    - [99, 256.3]
  - - [5120, 1280, 1, 1024]
    - [100, 250.39]
  - - [5120, 1344, 1, 1024]
    - [130, 272.6]
  - - [5120, 1408, 1, 1024]
    - [184, 266.7]
  - - [5120, 1472, 1, 1024]
    - [70, 253.2]
  - - [5120, 1536, 1, 1024]
    - [189, 269.6]
  - - [5120, 1600, 1, 1024]
    - [39, 271.98]
  - - [5120, 1664, 1, 1024]
    - [189, 278.69]
  - - [5120, 1728, 1, 1024]
    - [205, 279.62]
  - - [5120, 1792, 1, 1024]
    - [189, 290.32]
  - - [5120, 1856, 1, 1024]
    - [206, 281.41]
  - - [5120, 1920, 1, 1024]
    - [186, 302.24]
  - - [5120, 1984, 1, 1024]
    - [99, 275.35]
  - - [5120, 2048, 1, 1024]
    - [72, 279.03]
  - - [5120, 2176, 1, 1024]
    - [99, 288.96]
  - - [5120, 2304, 1, 1024]
    - [44, 299.54]
  - - [5120, 2432, 1, 1024]
    - [99, 302.9]
  - - [5120, 2560, 1, 1024]
    - [75, 298.61]
  - - [5120, 2688, 1, 1024]
    - [41, 317.68]
  - - [5120, 2816, 1, 1024]
    - [137, 304.7]
  - - [5120, 2944, 1, 1024]
    - [75, 308.21]
  - - [5120, 3072, 1, 1024]
    - [40, 292.93]
  - - [5120, 3200, 1, 1024]
    - [207, 297.03]
  - - [5120, 3328, 1, 1024]
    - [72, 302.15]
  - - [5120, 3456, 1, 1024]
    - [189, 310.49]
  - - [5120, 3584, 1, 1024]
    - [189, 315.12]
  - - [5120, 3712, 1, 1024]
    - [189, 318.5]
  - - [5120, 3840, 1, 1024]
    - [189, 318.94]
  - - [5120, 3968, 1, 1024]
    - [44, 305.09]
  - - [5120, 4096, 1, 1024]
    - [101, 314.94]
  - - [5120, 4352, 1, 1024]
    - [72, 322.82]
  - - [5120, 4608, 1, 1024]
    - [72, 314.51]
  - - [5120, 4864, 1, 1024]
    - [72, 323.41]
  - - [5120, 5120, 1, 1024]
    - [101, 320.64]
  - - [5120, 5376, 1, 1024]
    - [44, 338.53]
  - - [5120, 5632, 1, 1024]
    - [44, 333.15]
- null
- null
- DeviceEfficiency
- GridBased
